標題,地址,屋齡,類型,建坪,主+陽,格局,樓層,車位,總價(萬),編號,抓取時間
近湖口交流道採光屋,新竹縣湖口鄉三元路二段,29.0年,華廈,18.32,14.05,2房2廳2衛1室(含加蓋1房1衛1室),5樓/5樓,無車位,395,7495WF,2025-10-04 04:43:17
藝術家美四房稀有釋出富源藝術家,新竹縣竹北市文采街,20.2年,大樓,71.78,37.24,4房2廳2衛,8樓/14樓,兩個以上車位,3,8974DT,2025-10-04 04:43:17
大學漾三房成家首選大學漾,新竹縣竹北市福興一路,11.2年,大樓,54.25,29.99,3房2廳2衛,4樓/24樓,坡道平面車位,2,5034YT,2025-10-04 04:43:17
竹北臨路透店改裝宿舍首選,新竹縣竹北市四維街,43.8年,店面/透天,67.25,62.66,5房2廳3衛2室(含加蓋2室),1-3樓/3樓,其他,3,7023ZH,2025-10-04 04:43:17
稻香田園風光獨棟美墅,新竹縣竹北市聯興三街,31.8年,別墅/透天,51.57,51.57,5房2廳3.5衛,1-4樓/4樓,其他,1,0514NW,2025-10-04 04:43:17
高鐵旁的雙翼套房雙翼,新竹縣竹北市復興二路,17.8年,套房,21.67,8.55,1房1廳1衛(含加蓋1房),8樓/11樓,坡道平面車位,1,2638JK,2025-10-04 04:43:17
高鐵佰坪獨棟豪墅,新竹縣竹北市隘口二路,18.5年,透天,124.51,121.25,5房2廳5衛1室(含加蓋1廳1衛),1-4樓/4樓,其他,16,1009JR,2025-10-04 04:43:17
北埔角間全新電梯透店Ａ,新竹縣北埔鄉中豐路,1.3年,透天/店面,109.96,83.25,4房4廳5衛,1-4樓/4樓,無車位,3,4936CD,2025-10-04 04:43:17
Ｗ太子中央公園Ｗ中央公園,新竹縣竹北市嘉豐南路一段,11.9年,大樓,113.56,51.15,3房2廳3衛,18樓/20樓,兩個以上車位,7,2388HF,2025-10-04 04:43:17
溫莎小品首購兩房附車位,新竹縣竹北市縣政一街,21.1年,華廈,22.94,15.78,2房2廳1衛,4樓/6樓,其他,1,3305CW,2025-10-04 04:43:17
湖口１８３６坪電梯大廠,新竹縣湖口鄉光復南路,38.4年,廠房,1836.53,1569.51,9廳5衛13室(含加蓋4室),B1-6樓/6樓,無車位,55,2316DZ,2025-10-04 04:43:17
近園區馥園孝親大透天,新竹縣寶山鄉吉林路,11.1年,透天,67.15,58.1,6房2廳2.5衛(含加蓋1房),1-3樓/3樓,其他,2,0826HU,2025-10-04 04:43:17
社區型美式庭院超美別墅Ｂ,新竹縣寶山鄉寶山二街,1.3年,透天,154.18,146.55,5房8廳7.5衛2室(含加蓋1室),1-3樓/3樓,其他,7,2793VV,2025-10-04 04:43:17
魔術大空間德鑫Ｖ１德鑫V1,新竹縣竹北市福興一路,10.8年,大樓,69.75,38.71,4房2廳2衛,3樓/27樓,坡道平面車位,3,6947VC,2025-10-04 04:43:26
成功學區｜椰林４房雙車位首璽３,新竹縣竹北市莊敬南路,17.0年,華廈,78.56,39.44,4房2廳2衛,2樓/10樓,兩個以上車位,3,7792VR,2025-10-04 04:43:26
新埔大坪數農地,新竹縣新埔鎮文德路三段,,土地,769.95,,,,無車位,1,49948A,2025-10-04 04:43:26
橫山前庭後院近百坪農舍,新竹縣橫山鄉蔗,10.3年,透天,94.69,84.8,4房2廳4衛1室,1-2樓/2樓,無車位,5,9726VQ,2025-10-04 04:43:26
新竹寶山綠色山莊合法農舍,新竹縣寶山鄉峰城路,15.6年,別墅/透天,57.38,57.38,5房2廳2衛(含加蓋2房),1樓/1樓,無車位,6,1611ZF,2025-10-04 04:43:26
福興高照臨路透天,新竹縣竹北市福興路,24.5年,透天,57.26,50.07,6房4廳5衛(含加蓋3房1廳2衛),1-3樓/3樓,無車位,2,4250MS,2025-10-04 04:43:26
寶山水庫臨路透天,新竹縣寶山鄉山湖路,42.8年,透天,40.3,35.46,1房2廳2衛,1-2樓/2樓,無車位,980,7727BQ,2025-10-04 04:43:26
大坪數近台元後院車庫透天,新竹縣竹北市中山三街,1.4年,透天,101.03,93.08,5房2廳6.5衛(含加蓋0.5衛),1-4樓/4樓,一樓平面車位,5,9468WW,2025-10-04 04:43:26
成功學區御天地高樓採光戶御天地,新竹縣竹北市自強三路,13.2年,大樓,60.85,34.27,3房2廳2衛1室,16樓/19樓,坡道平面車位,3,8782GJ,2025-10-04 04:43:26
專任新竹新埔鎮土地出售,新竹縣新埔鎮文德路二段,,土地,5863.36,,,,無車位,8,04213L,2025-10-04 04:43:26
長春獨立三層店住雙用宅,新竹縣竹東鎮長春路三段,30.7年,辦公/大樓,39.07,32.14,2房3廳2衛(含加蓋1房),1-3樓/12樓,無車位,838,0388JF,2025-10-04 04:43:26
近高鐵視野三房面公園合新璞遇,新竹縣竹北市東興路一段,1.6年,大樓,43.71,23.31,3房2廳2衛,13樓/15樓,坡道平面車位,2,4880QU,2025-10-04 04:43:26
專任竹風高樓美屋高峰會,新竹縣竹北市光明十八街,13.6年,大樓,51.08,28.71,2房2廳2衛1室,13樓/14樓,坡道平面車位,2,2039SP,2025-10-04 04:43:26
三民路臨路角間透天,新竹縣竹北市三民路,27.6年,透天/店面,55.3,49.45,5房2廳5衛(含加蓋3衛),1-4樓/4樓,無車位,2,9800JD,2025-10-04 04:43:26
竹北市區稀有庭院透天,新竹縣竹北市仁義路,41.1年,透天,39.33,39.33,4房2廳3衛(含加蓋1衛),1-2樓/2樓,無車位,2,8595MV,2025-10-04 04:43:26
近台元臨路朝外車庫透天,新竹縣竹北市中山三街,1.4年,透天,77.23,69.42,4房2廳4.5衛(含加蓋1衛),1-4樓/4樓,一樓平面車位,4,2127AM,2025-10-04 04:43:26
成家首選湖口透天,新竹縣湖口鄉中美西路,32.3年,透天,51.15,49.55,5房2廳3衛,1-4樓/4樓,無車位,1,29972J,2025-10-04 04:43:26
熱鬧竹北千坪土地農舍,新竹縣竹北市溝貝街,28.9年,別墅/透天,92.04,87.57,2房5廳4衛(含加蓋2房1廳1衛),1-3樓/3樓,無車位,9,5447WD,2025-10-04 04:43:26
德鑫春天高樓溫馨美三房德鑫春天,新竹縣竹北市成功六街,19.9年,大樓,50.4,27.62,3房2廳2衛,11樓/11樓,坡道平面車位,2,3901WS,2025-10-04 04:43:26
竹北好美獨棟庭院農舍,新竹縣竹北市蓮花路,13.9年,其它,165.24,158.99,8房2廳5衛,1-3樓/3樓,其他,4,35306Z,2025-10-04 04:43:26
湖口黃金屋２幽靜三房,新竹縣湖口鄉明豐路,8.8年,華廈,37.69,24.38,3房2廳2衛,2樓/5樓,一樓平面車位,1,8395UH,2025-10-04 04:43:33
豐邑雅砌金店面雅砌,新竹縣竹北市嘉豐六路二段,16.8年,店面/辦公,124.74,63.57,2房2廳1衛,B1-2樓/14樓,兩個以上車位,6,0192FF,2025-10-04 04:43:33
三民臨路㊝傳家金透店,新竹縣竹北市三民路,42.5年,店面/透天,129.8,124.71,6房2廳4衛1室(含加蓋1室),1-4樓/4樓,無車位,4,2303WB,2025-10-04 04:43:33
河岸第一排高樓豪邸景觀世界之窗,新竹縣竹北市興隆路一段,12.9年,大樓,121.08,62.03,3房3廳3衛1室,14樓/24樓,兩個以上車位,5,5036LB,2025-10-04 04:43:33
ＡＩ智慧園區優質店面靚公園-中央公園,新竹縣竹北市十興路,6.5年,店面,37.31,13.37,2廳1衛(含加蓋1廳),1樓/14樓,坡道平面車位,1,2381AV,2025-10-04 04:43:33
環球市旁社區透天,新竹縣竹東鎮三重路,31.4年,透天,56.89,54.37,4房2廳4衛(含加蓋2房1衛),1-3樓/3樓,無車位,1,8739VN,2025-10-04 04:43:33
鼎藏光明優質三房值得擁有鼎藏光明,新竹縣竹北市勝利一路,20.0年,大樓,40.44,24.32,3房2廳2衛,8樓/15樓,坡道平面車位,2,6065JK,2025-10-04 04:43:33
椰林科大頌豪邸大戶科大頌,新竹縣竹北市科大一路,14.2年,大樓,98.57,37.08,5房2廳3衛(含加蓋1房),13樓/13樓,兩個以上車位,5,22392J,2025-10-04 04:43:33
湖口室內車庫透天,新竹縣湖口鄉仁愛路,35.8年,透天,52.3,52.3,4房2廳2衛,1-3樓/3樓,其他,1,2424MN,2025-10-04 04:43:33
國賓｜外棟高樓景觀美屋國賓大悅,新竹縣竹北市勝利八街一段,9.3年,大樓,36.75,19.12,2房2廳1衛,24樓/27樓,坡道平面車位,2,8513MG,2025-10-04 04:43:33
新埔黃金中正路透店,新竹縣新埔鎮中正路,42.8年,店面/透天,46.98,42.28,1房2廳4.5衛5室(含加蓋2.5衛3室),1-4樓/4樓,無車位,1,2593BU,2025-10-04 04:43:33
俠隱美三房平車俠隱築科,新竹縣竹北市莊敬六街,19.9年,大樓,47.04,27.5,3房2廳2衛,8樓/15樓,坡道平面車位,2,7489NH,2025-10-04 04:43:33
專任｜謙里｜金店面惠宇謙里,新竹縣竹北市福興東路二段,8.0年,店面,78.94,41.19,2廳2衛,1-2樓/15樓,兩個以上車位,4,9849FD,2025-10-04 04:43:33
稀有華興椰林上選上選,新竹縣竹北市華興三街,10.2年,大樓,52.78,29.87,3房2廳2衛,13樓/14樓,坡道平面車位,2,5203RJ,2025-10-04 04:43:33
竹東康寧市區美透天,新竹縣竹東鎮康寧街,80.2年,透天,57.7,53.81,2房2廳6衛6室(含加蓋2房2廳6衛6室),1-2樓/2樓,無車位,3,3587YC,2025-10-04 04:43:33
天闊近園區車庫透天,新竹縣寶山鄉湳坑二街,27.8年,透天,59.34,52.89,4房2廳3衛,1-4樓/4樓,其他,1,1711SS,2025-10-04 04:43:33
合石一緒高樓層裝潢美屋合石一緒,新竹縣竹北市勝利十五街,4.9年,大樓,41.6,20.39,2房2廳1衛,9樓/14樓,坡道平面車位,2,6029QN,2025-10-04 04:43:33
竹北豪華百坪㊝電梯美邸,新竹縣竹北市中華路,10.2年,透天,108.43,100.41,4房3廳6衛(含加蓋1房1衛),1-4樓/4樓,兩個以上車位,4,6267AV,2025-10-04 04:43:33
勝利學區美４房靚公園A區-海德...,新竹縣竹北市十興路,6.6年,大樓,77.2,35.43,4房2廳2衛,4樓/15樓,兩個以上車位,3,3210UQ,2025-10-04 04:43:33
低總價～竹東１－４樓透店,新竹縣竹東鎮生產街,28.0年,透天/店面,53.41,51.13,4房2廳3衛1室,1-4樓/4樓,無車位,1,9918FJ,2025-10-04 04:43:33
自強重劃區透天,新竹縣新埔鎮文山六街,5.9年,透天,62.36,59.14,5房2廳3.5衛,1-4樓/4樓,一樓平面車位,3,4181QD,2025-10-04 04:43:42
大任經典,新竹縣竹北市成功二街,17.3年,華廈,12.86,8.62,1房1廳1衛(含加蓋1房),7樓/8樓,無車位,1,9266UY,2025-10-04 04:43:42
世界之窗河岸視野宅世界之窗,新竹縣竹北市興隆路一段,12.9年,大樓,112.54,62.03,4房2廳3衛,5樓/24樓,兩個以上車位,6,3927AB,2025-10-04 04:43:42
近家樂福七璽電梯透天,新竹縣竹北市光明六路,6.1年,透天,86.12,66.97,4房2廳5衛(含加蓋2衛),1-4樓/4樓,無車位,5,59338P,2025-10-04 04:43:42
華興重劃三房車位,新竹縣竹北市新國街,31.8年,華廈,32.14,22.77,3房2廳2衛,5樓/8樓,坡道機械車位,900,6600DC,2025-10-04 04:43:42
湖口長嶺段高鐵必經土地,新竹縣湖口鄉長嶺路長嶺段,,土地,514.25,,,,無車位,900,6584CN,2025-10-04 04:43:42
近ＡＩ園區興希望大兩房興希望,新竹縣竹北市北新一街,6.5年,大樓,31.48,21.44,2房2廳1衛,14樓/24樓,無車位,1,7754AP,2025-10-04 04:43:42
⭐華興天下面寬金店面,新竹縣竹北市中央路,32.1年,店面,76.16,27.77,2廳2衛1室,B1-1樓/7樓,無車位,1,7208CC,2025-10-04 04:43:42
最美花園府邸雙車位,新竹縣竹北市中山路,34.8年,華廈,101.04,72.07,5房4廳3衛,3樓/5樓,兩個以上車位,3,2477GC,2025-10-04 04:43:42
近家樂福雙面臨路角間店面昌益京典,新竹縣竹北市光明九路,23.5年,店面,20.57,10.07,1房1廳1衛(含加蓋1房),1樓/10樓,無車位,1,3621FD,2025-10-04 04:43:42
放翁清境明亮邊間雙併美墅放翁清境,新竹縣竹東鎮學府東路,24.7年,別墅/透天,71.05,70.58,5房3廳4衛,1-4樓/4樓,兩個以上車位,2,4534VL,2025-10-04 04:43:42
國賓次頂樓學區美兩房國賓大悅,新竹縣竹北市勝利八街一段,9.3年,大樓,33.66,17.16,2房2廳1衛,26樓/27樓,坡道平面車位,1,9098AY,2025-10-04 04:43:42
近ＡＩ園區新埔仰德街透天,新竹縣新埔鎮仰德街,45.3年,透天,27.32,27.32,4房2廳2衛,1-2樓/2樓,無車位,1,9354RS,2025-10-04 04:43:42
ＡＩ園區旁高質感翰林富苑翰林富苑,新竹縣竹北市莊敬三路,9.9年,大樓,88.65,43.75,3房2廳3衛,12樓/27樓,兩個以上車位,4,4199VT,2025-10-04 04:43:42
近康乃爾精美三房附平車宏觀大器,新竹縣竹北市六家五路二段,13.5年,大樓,46.37,23.91,3房2廳2衛,4樓/24樓,坡道平面車位,2,4959BB,2025-10-04 04:43:42
坤山央央店面央央,新竹縣竹北市文興路二段,1.7年,店面,89.48,55.25,2廳2衛,1-2樓/19樓,兩個以上車位,7,9399RW,2025-10-04 04:43:42
華興森睦大空間２房１室森睦,新竹縣竹北市華興五街,11.8年,大樓,58.22,32.03,2房2廳2衛1室,4樓/14樓,坡道平面車位,2,7019NV,2025-10-04 04:43:42
高鐵區近嘉豐國小土地,新竹縣竹北市福興東路二段,,土地,59.28,,,,無車位,7,39049N,2025-10-04 04:43:42
捷寶新世紀大空間店面捷寶新世紀,新竹縣竹北市復興二路,14.8年,店面,121.54,72.74,2廳2衛,1-2樓/19樓,兩個以上車位,9,7946RX,2025-10-04 04:43:42
【世紀皇家】角間採光美屋世紀皇家,新竹縣竹北市勝利六街,21.0年,大樓,40.64,25.63,2房2廳2衛1室,12樓/14樓,坡道機械車位,2,9321VT,2025-10-04 04:43:42
視野｜歌德堡｜三房雙車位瑆鑽歌德堡,新竹縣竹北市嘉豐三街,18.5年,大樓,68.28,34.05,3房2廳2衛,11樓/12樓,兩個以上車位,3,5009MZ,2025-10-04 04:43:49
新竹稀有大型完整土地,新竹縣峨眉鄉中豐公路,,土地,38342.16,,,,無車位,18,7584NF,2025-10-04 04:43:49
竹東多變三層樓大空間,新竹縣竹東鎮長春路三段,57.0年,透天/店面,132.96,132.96,3房2廳6衛,1-3樓/3樓,無車位,5,6109FV,2025-10-04 04:43:49
開心農場在我家,新竹縣新豐鄉崁頭,14.0年,其它,51.76,47.05,4房2廳3衛(含加蓋2房),1-2樓/2樓,無車位,2,3072KB,2025-10-04 04:43:49
遠雄文華匯帝王視野精品宅遠雄文華匯,新竹縣竹北市縣政二路南段,7.9年,大樓,47.28,23.58,2房2廳1衛,17樓/17樓,坡道平面車位,2,1489CT,2025-10-04 04:43:49
竹北中華路溫馨美透天,新竹縣竹北市中華路,29.4年,透天,51.54,47.4,4房2廳2.5衛,1-3樓/3樓,其他,2,5347NH,2025-10-04 04:43:49
竹北采采１房１室歡迎看屋,新竹縣竹北市中正西路,4.6年,華廈,20.53,14.98,1房2廳1衛1室,6樓/7樓,無車位,1,7631HB,2025-10-04 04:43:49
高鐵區｜朝西南｜臨路透天,新竹縣竹北市復興一街,19.0年,透天,65.55,58.32,4房2廳2.5衛1室,1-5樓/5樓,其他,3,8237GX,2025-10-04 04:43:49
稀有豐采５２０外棟＋挑高,新竹縣竹北市自強北路,預售,辦公/大樓,26.93,11.75,1廳1衛,9樓/25樓,坡道平面車位,1,0200UU,2025-10-04 04:43:49
㊝科大區精美裝潢三房四君子,新竹縣竹北市科大一路,13.4年,大樓,43.73,19.89,3房2廳2衛,7樓/11樓,坡道平面車位,2,6478PG,2025-10-04 04:43:49
新竹帝寶三房平面車位,新竹縣寶山鄉環城東路,預售,華廈,44.4,25.38,3房2廳2衛,4樓/7樓,坡道平面車位,1,6248TH,2025-10-04 04:43:49
九牧世家視野採光大三房九牧世家,新竹縣竹北市嘉興路,7.2年,大樓,58.53,31.16,3房2廳2衛,13樓/15樓,坡道平面車位,3,4429HP,2025-10-04 04:43:49
新工三路近社子重劃工業地,新竹縣竹北市新工三路,,土地,191.79,,,,無車位,8,02641H,2025-10-04 04:43:49
天空樹店面富宇天空樹,新竹縣竹北市十興路一段,6.9年,店面/辦公/大樓,43.14,17.01,2廳2衛,1樓/21樓,坡道平面車位,3,0450KW,2025-10-04 04:43:49
竹東近台三線美地,新竹縣竹東鎮中豐路三段,,土地,647.08,,,,無車位,998,24614D,2025-10-04 04:43:49
ＡＩ園區勝利國中舒適兩房精工禪,新竹縣竹北市嘉勤北路,19.4年,大樓,39.92,22.33,2房2廳1衛1室,2樓/12樓,其他,1,0038NP,2025-10-04 04:43:49
大有可為高樓大空間雙車位大有可為,新竹縣竹北市勝利一路,21.4年,大樓,57.68,33.19,3房2廳2衛,11樓/21樓,兩個以上車位,2,1387XJ,2025-10-04 04:43:49
近竹科寶山萬坪農牧林地,新竹縣寶山鄉寶山路二段,,土地,16872.41,,,,無車位,52,5983DK,2025-10-04 04:43:49
稀有出售成功學區透天,新竹縣竹北市成功七街,21.6年,透天,66.25,49.24,5房2廳4衛,B1-4樓/4樓,其他,3,9128KR,2025-10-04 04:43:49
佐多稻子景觀大宅佐多稻子,新竹縣竹北市縣政二路,19.3年,大樓,86.53,51.31,3房2廳2衛1室,8樓/13樓,兩個以上車位,4,1211XK,2025-10-04 04:43:49
縣政二路美土地,新竹縣竹北市縣政二路,,土地,30.28,,,,無車位,2,1880PV,2025-10-04 04:43:56
涵碧樓高樓採光小資優選,新竹縣竹北市自強南路,21.3年,套房,21.01,10.61,1房1廳1衛,8樓/14樓,坡道機械車位,1,2157DG,2025-10-04 04:43:56
專任石頭坑農地丙建地,新竹縣新埔鎮文德路二段,,土地,900.85,,,,無車位,1,45668Z,2025-10-04 04:43:56
現有資材室的農三土地,新竹縣寶山鄉寶山路二段,,土地,792.48,,,0樓/0樓,無車位,988,37556A,2025-10-04 04:43:56
豐采５２０高樓小空間附廁,新竹縣竹北市自強北路,預售,辦公/大樓,26.63,11.59,1廳1衛,8樓/25樓,坡道平面車位,1,2511LS,2025-10-04 04:43:56
臨路北埔農地景觀優,新竹縣北埔鄉竹四五鄉道,,土地,873.66,,,,無車位,1,62836Z,2025-10-04 04:43:56
明新科大～住宅區土地,新竹縣新豐鄉明新路,,土地,190.69,,,,無車位,9,0444JD,2025-10-04 04:43:56
高鐵區大土地,新竹縣竹北市光明六路東二段,,土地,465.65,,,,無車位,120,1874TC,2025-10-04 04:43:56
公園１號＊Ｂ２車位＊公園1號,新竹縣竹北市十興路一段,7.3年,單售車位,10.44,0,,--,坡道平面車位,160,7356NT,2025-10-04 04:43:56
巨人朝外小資優選巨人愛家,新竹縣竹北市勝利十一路,8.9年,大樓,34.32,17.05,2房2廳1衛,8樓/23樓,坡道平面車位,2,8082ZW,2025-10-04 04:43:56
家樂福生活圈小資族首選,新竹縣竹北市光明九路,19.2年,華廈,10.5,6.6,1房2廳1衛(含加蓋1房),6樓/9樓,無車位,698,0957VS,2025-10-04 04:43:56
★高鐵區核心三房美宅I-Park,新竹縣竹北市六家五路二段,16.4年,大樓,49.22,26.65,3房2廳2衛,8樓/15樓,坡道平面車位,2,4878VF,2025-10-04 04:43:56
雙面臨路黃金角邊土地,新竹縣竹北市成功三路,16.0年,土地,88.03,18.59,1廳1衛,1-1樓/1樓,無車位,16,49525B,2025-10-04 04:43:56
預售｜欣建築｜三房雙車位,新竹縣竹北市十興路二段,預售,大樓,63.19,29.13,3房2廳2衛,10樓/15樓,兩個以上車位,3,3516AW,2025-10-04 04:43:56
富宇葉慈富宇葉慈,新竹縣竹北市嘉政七街,9.2年,大樓,62.96,26.72,3房2廳2衛,8樓/13樓,兩個以上車位,3,5286HR,2025-10-04 04:43:56
椰林首選卓越品質椰林首選No.2,新竹縣竹北市光明二街,19.0年,華廈,55.69,34.07,3房2廳2衛1室,2樓/10樓,坡道平面車位,2,4542HK,2025-10-04 04:43:56
【高鐵預售】浩瀚寬郁三房,新竹縣竹北市光明六路東二段,預售,大樓,47.46,25.53,3房2廳2衛,6樓/22樓,坡道平面車位,3,7572BJ,2025-10-04 04:43:56
水曰優質黃金店面,新竹縣竹北市社崙街,2.4年,店面,57.65,27.02,1廳2衛,1樓/15樓,兩個以上車位,2,0064QC,2025-10-04 04:43:56
華興溫馨大兩房,新竹縣竹北市文昌街,30.2年,公寓,22.4,20.41,2房2廳1衛,5樓/5樓,無車位,658,6189UD,2025-10-04 04:43:56
【獨家】東方之星露臺３房東方之星,新竹縣竹北市嘉興二街,10.1年,大樓,61.78,28.95,3房2廳2衛,2樓/14樓,兩個以上車位,3,2077YP,2025-10-04 04:43:56
新竹新埔有機香草田園,新竹縣新埔鎮南蛇崎道路,,土地,1600.37,,,,無車位,1,8857PG,2025-10-04 04:44:05
千禧路方正臨路美農地,新竹縣湖口鄉千禧路,,土地,486.72,,,,無車位,1,5638AR,2025-10-04 04:44:05
新埔土地未來可期,新竹縣新埔鎮楊新路一段,,土地,2514.64,,,,無車位,2,51835S,2025-10-04 04:44:05
快來看寶山曼尼３兩房車位,新竹縣寶山鄉北坑路,預售,華廈,25.21,15.01,2房2廳2衛,4樓/6樓,坡道機械車位,1,0722PN,2025-10-04 04:44:05
近竹東市區美裝潢透天,新竹縣竹東鎮忠孝街,48.0年,透天,34.71,33.12,6房2廳3衛(含加蓋3房2衛),1-2樓/2樓,其他,1,9005UQ,2025-10-04 04:44:05
新竹侏儸紀果園土地,新竹縣新埔鎮楊新路一段,,土地,2163.07,,,,無車位,4,36086M,2025-10-04 04:44:05
橫山千坪土地,新竹縣橫山鄉中豐路三段,,土地,2404.27,,4房2廳2衛(含加蓋4房2廳2衛),1-2樓/2樓,無車位,3,37088W,2025-10-04 04:44:05
ＥＳＧ碳權近竹東臨路林地,新竹縣北埔鄉公園路,,土地,2432.1,,,,無車位,1,55847U,2025-10-04 04:44:05
快樂農場,新竹縣新豐鄉德興北路,,土地,414.12,,,,無車位,665,3219SL,2025-10-04 04:44:05
大學至善美套房,新竹縣芎林鄉文山路,20.4年,華廈,11.86,6.97,1房1廳1衛,4樓/10樓,無車位,330,36542Y,2025-10-04 04:44:05
青川之上青川之上,新竹縣竹北市興隆路一段,12.4年,大樓,128.03,72,5房2廳4衛,8樓/24樓,兩個以上車位,6,7464WV,2025-10-04 04:44:05
近康乃薾椰林觀景露臺四房椰林觀景,新竹縣竹北市六家五路二段,16.4年,大樓,80.96,41.31,4房2廳2衛,2樓/13樓,兩個以上車位,5,6480VG,2025-10-04 04:44:05
縣三高樓採光視野三房國賓大悅,新竹縣竹北市勝利八街一段,9.3年,大樓,47.78,24.11,3房2廳2衛,25樓/27樓,坡道平面車位,2,9160WU,2025-10-04 04:44:05
竹北大三房坡平車位冠軍城峰,新竹縣竹北市中央路,10.7年,大樓,55.45,27.43,3房2廳2衛,4樓/15樓,坡道平面車位,2,1895PF,2025-10-04 04:44:05
專任成功太睿一格視野兩房太睿一格,新竹縣竹北市成功十街,12.8年,華廈,37.85,18.42,2房2廳1衛,5樓/10樓,坡道平面車位,2,5635UN,2025-10-04 04:44:05
專任竹北首選企業據點商辦竹益OL,新竹縣竹北市成功十三街,10.3年,辦公,41.52,20.25,1廳,2樓/10樓,坡道平面車位,1,1618NH,2025-10-04 04:44:05
高鐵區威尼斯人電梯豪墅威尼斯人,新竹縣竹北市隘口三街,17.5年,透天,136.25,100.43,5房2廳6衛,B1-5樓/5樓,無車位,7,3808WL,2025-10-04 04:44:05
明新重劃高樓採光,新竹縣新豐鄉明新十街,1.2年,華廈,37.81,18.21,2房2廳1.5衛1室,9樓/9樓,坡道平面車位,1,2331KR,2025-10-04 04:44:05
新竹寶山新珊路林業用地,新竹縣寶山鄉新珊路,,土地,2253.69,,,,無車位,3,27630E,2025-10-04 04:44:05
新竹新埔香草田園（二）,新竹縣新埔鎮南蛇崎道路,,土地,763.35,,,,無車位,1,6013AU,2025-10-04 04:44:05
近新竹台積電臨路土地,新竹縣寶山鄉新林路,,土地,1821.97,,,,無車位,3,5967ZR,2025-10-04 04:44:14
橫山油羅７８０坪土地,新竹縣橫山鄉南坪古道,,土地,789.22,,,,無車位,3,70046D,2025-10-04 04:44:14
退休當營主之露營美地,新竹縣尖石鄉那羅至煤源聯絡道,,土地,2910.05,,4房1廳(含加蓋4房1廳),1-2樓/2樓,無車位,1,8370DT,2025-10-04 04:44:14
養心‧慢活‧新竹土地,新竹縣峨眉鄉東崎路,,土地,828.93,,1房1廳2衛(含加蓋1房1廳2衛),0樓/0樓,無車位,1,8953SV,2025-10-04 04:44:14
竹北法院特區稀有釋出商辦竹益OL,新竹縣竹北市成功十三街,10.3年,辦公,41.15,19.99,1廳,6樓/10樓,坡道平面車位,1,42276P,2025-10-04 04:44:14
豐采５２０視野辦公室,新竹縣竹北市自強北路,預售,辦公/大樓,65.09,35.52,1廳1衛,25樓/25樓,坡道平面車位,3,6814WU,2025-10-04 04:44:14
縣三巨人高樓景觀兩房巨人愛家,新竹縣竹北市勝利十一路,8.9年,大樓,32.16,14.92,2房2廳1衛,23樓/23樓,坡道平面車位,2,4614YQ,2025-10-04 04:44:14
城峰匯外棟視野雙主臥四房城峰匯,新竹縣竹北市莊敬五街,11.4年,大樓,80.37,49.24,4房2廳3衛,13樓/23樓,坡道平面車位,3,3905UR,2025-10-04 04:44:14
河岸第一排大宅天景高樓層大宅天景,新竹縣竹北市興隆路二段,12.7年,大樓,160.42,87.08,5房2廳4.5衛,14樓/25樓,兩個以上車位,8,3719SJ,2025-10-04 04:44:14
太睿郡大三房視野戶太睿郡,新竹縣竹北市福興東路一段,13.3年,大樓,60.37,32.99,3房2廳2衛,7樓/13樓,坡道平面車位,2,8951SJ,2025-10-04 04:44:14
明日軸㊝視野御邸明日軸,新竹縣竹北市六家五路二段,13.0年,大樓,88.58,44.34,4房2廳2衛,7樓/25樓,兩個以上車位,4,6839AB,2025-10-04 04:44:14
時代花園大廈㊝稀有釋出時代花園大廈,新竹縣竹北市十興路一段,11.5年,大樓,56.69,31.67,3房2廳2衛,2樓/24樓,坡道平面車位,3,5343TQ,2025-10-04 04:44:14
翰林富苑稀有高樓三房翰林富苑,新竹縣竹北市莊敬三路,9.9年,大樓,70.5,32.26,3房2廳3衛,27樓/27樓,兩個以上車位,3,1499ZB,2025-10-04 04:44:14
仰睦朝東南輕奢美４房仰睦,新竹縣竹北市新光五街,12.7年,大樓,67.89,38.13,4房2廳2衛,9樓/14樓,坡道平面車位,3,5287SW,2025-10-04 04:44:14
新竹丁建土地１９３２坪,新竹縣關西鎮水坑,,土地,1952.27,,,,無車位,35,8992WK,2025-10-04 04:44:14
高第三房平面車位昌益高第,新竹縣竹北市文化街,23.2年,華廈,48.61,29.35,3房2廳2衛,6樓/10樓,坡道平面車位,2,6260KL,2025-10-04 04:44:14
公園首璽稀有釋出公園首璽,新竹縣竹北市縣政五街,26.3年,華廈,59.57,40.89,4房2廳2衛,3-4樓/10樓,兩個以上車位,2,6848JC,2025-10-04 04:44:14
寶山幸福農莊Ａ土地,新竹縣寶山鄉仙爺路,,土地,343.64,,,,無車位,618,7919WZ,2025-10-04 04:44:14
富宇瑀玥美視野三房,新竹縣竹東鎮光武街,預售,大樓,45.14,23.67,3房2廳2衛,6樓/15樓,坡道平面車位,1,6890PN,2025-10-04 04:44:14
近生醫園區生活圈土地,新竹縣竹北市興海街,,土地,335.6,,,,無車位,5,40381K,2025-10-04 04:44:14
高鐵區低總價採光三房好FUN,新竹縣竹北市隘口六街,17.8年,華廈,47.83,23.9,3房2廳2衛,9樓/9樓,坡道平面車位,2,2642AU,2025-10-04 04:44:23
店長推薦！環宇市溫馨高樓環宇市,新竹縣竹東鎮光明路,10.2年,辦公/大樓,45.35,25.54,3房2廳2衛,9樓/14樓,坡道平面車位,2,4185RG,2025-10-04 04:44:23
尖石近內灣平坦臨路原保地,新竹縣尖石鄉嘉樂,,土地,848.51,,2廳(含加蓋2廳),1-1樓/1樓,無車位,800,8181PH,2025-10-04 04:44:23
璞遇高鐵稀有三房來電賞屋合新璞遇,新竹縣竹北市東興路一段,1.6年,大樓,43.33,23.08,3房2廳2衛,6樓/15樓,坡道平面車位,2,8679MT,2025-10-04 04:44:23
現代城１樓挑高大空間現代城,新竹縣竹北市六家七路,17.0年,大樓/店面,50.32,28.6,3房2廳3衛(含加蓋3房1廳2衛),1樓/14樓,坡道平面車位,3,7753TT,2025-10-04 04:44:23
價可談｜新豐土地,新竹縣新豐鄉濱海公路,,土地,197.29,,,,無車位,3,41423U,2025-10-04 04:44:23
寶山便宜臨巷土地,新竹縣寶山鄉峰城路,,土地,2177.09,,,,無車位,1,34078C,2025-10-04 04:44:23
新埔土地優質地段,新竹縣新埔鎮楊新路一段,,土地,873.43,,,,無車位,3,25385Y,2025-10-04 04:44:23
寶山幸福農莊Ｂ土地,新竹縣寶山鄉仙爺路,,土地,249.26,,,,無車位,438,7502UZ,2025-10-04 04:44:23
