標題,地址,屋齡,類型,建坪,主+陽,格局,樓層,車位,總價(萬),編號,抓取時間
【新世紀】新豐後湖近新屋投資田1179,新竹縣新豐鄉福興段後湖子小段段,,土地,1179.45,,,0樓/0樓,無車位,1,2038818CT,2025-10-04 04:55:29
竹北中華首席電梯邊間住店,新竹縣竹北市中華路,13.7年,別墅/透天,71.85,62.55,5房2廳4衛,1-4樓/4樓,其他,3,BB03219GH,2025-10-04 04:55:29
新埔開心農園,新竹縣新埔鎮南打鐵坑段南打鐵坑,,土地,542.99,,,0樓/0樓,無車位,498,BB03220GH,2025-10-04 04:55:29
新豐青埔合法農舍,新竹縣新豐鄉青埔子,9.7年,其它,62.54,57.72,5房2廳5衛,1-2樓/2樓,無車位,2,BS27429HB,2025-10-04 04:55:29
新豐福龍國小周邊美農地,新竹縣新豐鄉福興段員山子小段,,土地,605,,,0樓/0樓,無車位,498,BS47997HB,2025-10-04 04:55:29
上坪五指山美地A,新竹縣竹東鎮上坪段,,土地,1108.97,,,0樓/0樓,無車位,650,BS54190HB,2025-10-04 04:55:29
近竹科、工研院-邊間大地坪透天,新竹縣竹東鎮光明路,47.4年,別墅/透天,29.81,29.81,3房2廳3衛,1-2樓/2樓,無車位,1,BS54532HB,2025-10-04 04:55:29
C6031峨眉有水電平坦景觀地,新竹縣峨眉鄉赤柯山段,,土地,1140.48,,,0樓/0樓,無車位,2,BS54537HB,2025-10-04 04:55:29
成功路透天,新竹縣湖口鄉成功路,49.1年,店面,84.73,84.73,1廳2衛,1-2樓/2樓,無車位,4,DB00325GH,2025-10-04 04:55:29
湖口工業區投資套房90間,新竹縣湖口鄉民富街,13.5年,大樓,304.8,304.8,90房90衛,9樓/0樓,無車位,12,DS57371HB,2025-10-04 04:55:29
湖口青松園景觀豪墅,新竹縣湖口鄉長嶺路,3.0年,別墅/透天,54.79,51.91,4房2廳3衛,1-3樓/3樓,其他,3,VB00425GH,2025-10-04 04:55:29
湖口高級至寶店面,新竹縣湖口鄉吉祥街,5.2年,店面,48.81,28.3,3房2廳2衛,1樓/10樓,無車位,2,VB01503GH,2025-10-04 04:55:29
稀有釋出湖口美麗人生3套房,新竹縣湖口鄉大智路,4.2年,華廈,24.12,19.54,3房3衛,5樓/7樓,無車位,888,VB01526GH,2025-10-04 04:55:29
新加坡城堡四房平車美寓,新竹縣新豐鄉康樂路一段,30.1年,公寓,37.44,30.21,4房2廳2衛,4樓/5樓,無車位,998,VB01630GH,2025-10-04 04:55:29
新豐風之戀資材室,新竹縣新豐鄉福興段員山子小段,,土地,426.53,,,0樓/0樓,無車位,888,VB01680GH,2025-10-04 04:55:29
中崙漂亮農舍田,新竹縣新豐鄉中崙段,,土地,877.25,,,0樓/0樓,無車位,1,VS02123HB,2025-10-04 04:55:29
湖口台一線金店面+美好住家,新竹縣湖口鄉八德路一段,18.7年,別墅/透天,55.99,43.56,4房3廳4衛,-1-3樓/3樓,無車位,1,VS04001HB,2025-10-04 04:55:29
晨光 #小人國農加建,新竹縣關西鎮拱子溝段,,土地,3525.03,,,0樓/0樓,無車位,1,AS126069HB,2025-10-04 04:55:29
新豐福興美農地,新竹縣新豐鄉福興段,,土地,323.07,,,0樓/0樓,無車位,568,CS155067HB,2025-10-04 04:55:40
近新湖口重劃區旁農地B,新竹縣新豐鄉青埔子段,,土地,805.26,,,0樓/0樓,無車位,1,S2744659PA,2025-10-04 04:55:40
山林靜謐首選｜自用休閒、農作皆宜|,新竹縣橫山鄉沙坑壹段,,土地,113.46,,,0樓/0樓,無車位,524,2055900CT,2025-10-04 04:55:40
新豐坑子口近台15美田,新竹縣新豐鄉坑子口,,土地,810.7,,,0樓/0樓,無車位,1,BB03305GH,2025-10-04 04:55:40
峨眉石井美地(A),新竹縣峨眉鄉梯子桄,,土地,920.81,,,0樓/0樓,無車位,598,BS44142HB,2025-10-04 04:55:40
竹北縣三重劃區大坪數三角窗金店,新竹縣竹北市莊敬六街,11.5年,店面,65.53,44.29,2房1廳2衛,1-2樓/2樓,坡道平面車位,5,BS44555HB,2025-10-04 04:55:40
松下新宿黃金店面,新竹縣竹北市自強北路,3.5年,店面,60.82,32.92,1廳1衛,1樓/11樓,坡道平面車位,5,BS45949HB,2025-10-04 04:55:40
關西微風平坦美農地,新竹縣關西鎮十寮段糞箕窩小段,,土地,934.12,,,0樓/0樓,無車位,1,BS48398HB,2025-10-04 04:55:40
新埔田新市政御璽全新2房+平車,新竹縣新埔鎮田新路,1.1年,大樓,36.73,16.4,2房2廳1衛,3樓/15樓,坡道平面車位,1,BS52414HB,2025-10-04 04:55:40
新豐合法大農舍,新竹縣新豐鄉坑子口,18.8年,其它,63.99,59.57,4房2廳4衛,1-2樓/0樓,其他,3,BS54308HB,2025-10-04 04:55:40
首購湖口工業區大2房雙衛,新竹縣湖口鄉大勇路,13.9年,華廈,15.06,1.62,2房2廳2衛,1樓/5樓,無車位,798,BS55199HB,2025-10-04 04:55:40
竹北靜巷稀有大地坪透天,新竹縣竹北市仁義路,41.1年,別墅/透天,39.33,39.33,4房2廳3衛,1-2樓/2樓,無車位,2,BS55434HB,2025-10-04 04:55:40
橫山大山背景觀美地,新竹縣橫山鄉濫子段尖筆窩小段,,土地,1544.26,,,0樓/0樓,無車位,698,DS63706HB,2025-10-04 04:55:40
專約尖石鄉魔法女屋超美景點,新竹縣尖石鄉煤源段,,土地,22327.53,,,0樓/0樓,無車位,5,QS38957HB,2025-10-04 04:55:40
新豐輕屋齡兩房,新竹縣新豐鄉建興路二段,6.3年,華廈,23.38,14.56,2房1廳1衛,7樓/7樓,無車位,858,VB01223GH,2025-10-04 04:55:40
湖口黃昏市場9米面寬透天,新竹縣湖口鄉中興四巷,46.1年,別墅/透天,28.79,28.79,2房2廳1衛,1-2樓/2樓,無車位,698,VB01259GH,2025-10-04 04:55:40
王爺壟築硯2房2衛平車華廈,新竹縣湖口鄉達生八街,0.7年,大樓,37.74,19.51,2房2廳2衛,8樓/13樓,其他,1,VB01392GH,2025-10-04 04:55:40
湖口東區2+1房電梯車位華廈,新竹縣湖口鄉蘭州四街,13.7年,華廈,33.75,22.25,2房2廳2衛,5樓/5樓,其他,988,VB01393GH,2025-10-04 04:55:40
湖口王爺壟重劃區全新3房+平車,新竹縣湖口鄉達生八街,0.7年,大樓,47.84,26.22,3房2廳2衛,5樓/13樓,坡道平面車位,1,AS133924HB,2025-10-04 04:55:40
湖口合法資材室有水電快樂居,新竹縣湖口鄉徳盛段,,土地,538.45,,,0樓/0樓,無車位,1,S2640316PA,2025-10-04 04:55:40
湖口後站整新臨路美透天,新竹縣湖口鄉三明街,43.6年,別墅/透天,33.84,33.84,4房2廳3衛,1-2樓/2樓,無車位,990,1957831CT,2025-10-04 04:55:50
新埔照鏡丙建+建物+農地,新竹縣新埔鎮照鏡段,,土地,831.08,,,0樓/0樓,無車位,9,2060069CT,2025-10-04 04:55:50
*新豐新湖路農地,新竹縣新豐鄉新湖路(崁頭段,,土地,985.85,,,0樓/0樓,無車位,1,AS59285HB,2025-10-04 04:55:50
星都匯旁社區3房平車美屋,新竹縣竹東鎮自由街,28.8年,大樓,29.19,15.2,3房2廳2衛,11樓/11樓,坡道平面車位,968,BB03845GH,2025-10-04 04:55:50
新豐正台61線休閒角田,新竹縣新豐鄉後湖段,,土地,725.09,,,0樓/0樓,無車位,1,BS34330HB,2025-10-04 04:55:50
芎林路邊超值丙建+農地,新竹縣芎林鄉水坑貳段,,土地,1825.26,,,0樓/0樓,無車位,790,BS45122HB,2025-10-04 04:55:50
橫山大山背臨溪景觀地,新竹縣橫山鄉大山背段,,土地,990.61,,,0樓/0樓,無車位,1,BS49926HB,2025-10-04 04:55:50
新竹寶山5000坪農林地,新竹縣寶山鄉深井段,,土地,5042,,,0樓/0樓,無車位,12,BS51148HB,2025-10-04 04:55:50
竹東正中心蛋黃金店面,新竹縣竹東鎮中山路,8.9年,辦公,50.87,33.93,,1-2樓/0樓,無車位,2,BS52415HB,2025-10-04 04:55:50
關西絕美透天首選,新竹縣關西鎮十六張,29.3年,別墅/透天,33.4,31.1,6房2廳3衛,1-2樓/3樓,無車位,1,BS54027HB,2025-10-04 04:55:50
北埔湖中優美農地,新竹縣北埔鄉湖中段,,土地,784.24,,,0樓/0樓,無車位,688,BS54993HB,2025-10-04 04:55:50
新埔照鏡美農地,新竹縣新埔鎮照鏡,,土地,879.68,,,0樓/0樓,無車位,1,DS80194HB,2025-10-04 04:55:50
湖口省道4房大坪數店透,新竹縣湖口鄉八德路一段,18.7年,別墅/透天,55.99,51.06,4房3廳4衛,-1-3樓/3樓,其他,1,VS04378HB,2025-10-04 04:55:50
新豐風車之戀合法資材室,新竹縣新豐鄉福興段員山子小段,,土地,426.53,,,0樓/0樓,無車位,888,VS04414HB,2025-10-04 04:55:50
湖口漂亮店住,新竹縣湖口鄉三明街,43.9年,別墅/透天,33.84,33.84,3房2廳3衛,0樓/2樓,無車位,998,S2668239PA,2025-10-04 04:55:50
專任-順峰鼎社區型住店,新竹縣竹北市民生街,7.4年,大樓,55.62,17.33,,1樓/11樓,坡道平面車位,2,BS31613HB,2025-10-04 04:55:50
\急售出價談/新豐建興電梯住店,新竹縣新豐鄉建興路一段,6.7年,店面,49.24,35.33,3房2廳3衛,1-3樓/12樓,其他,2,BS37711HB,2025-10-04 04:55:50
高鐵紐約紐約2房附車位,新竹縣竹北市隘口六街,17.3年,華廈,17.95,10.53,2房2廳1衛,1樓/9樓,其他,1,BS41804HB,2025-10-04 04:55:50
峨眉平坦休閒果園,新竹縣峨眉鄉赤柯坪段赤柯山小段,,土地,950.28,,,0樓/0樓,無車位,868,BS44933HB,2025-10-04 04:55:50
湖口松湖園旁大坪數農+建,新竹縣湖口鄉和興段,,土地,1949.31,,,0樓/0樓,無車位,16,BS48225HB,2025-10-04 04:55:50
【猛哥賣厝】水流東橘子園美農地,新竹縣峨眉鄉水流東段,,土地,757.14,,,0樓/0樓,無車位,985,BS54062HB,2025-10-04 04:56:00
新埔鎮新龍路臨路方正美田,新竹縣新埔鎮廣興段,,土地,773.31,,,0樓/0樓,無車位,2,BS54227HB,2025-10-04 04:56:00
獨家湖口東區七米大面寬店面 1,新竹縣湖口鄉新生路,7.8年,華廈,22.89,18.74,1廳1衛,1樓/5樓,無車位,966,VB00333GH,2025-10-04 04:56:00
獨家新豐球場持分農地,新竹縣新豐鄉上坑段,,土地,49.91,,,0樓/0樓,無車位,42,VB00941GH,2025-10-04 04:56:00
湖口雙面臨路資材角田,新竹縣湖口鄉和興段,,土地,495.5,,,0樓/0樓,無車位,958,VB01585GH,2025-10-04 04:56:00
湖口近省道車庫大三房,新竹縣湖口鄉千禧路,25.2年,公寓,37.37,26.74,3房2廳2衛,4樓/5樓,其他,538,VB01649GH,2025-10-04 04:56:00
寶山景觀休閒美景地+小木屋,新竹縣寶山鄉新珊路,,土地,1026.64,,,0樓/0樓,無車位,1,AS113730HB,2025-10-04 04:56:00
湖口大面寬8米路一般農,新竹縣湖口鄉北安段,,土地,786.63,,,0樓/0樓,無車位,2,S2877788PA,2025-10-04 04:56:00
新竹關西稀有工業建地,新竹縣關西鎮大同壹段,,土地,1932.27,,,0樓/0樓,無車位,35,XS128919HB,2025-10-04 04:56:00
梢楠園渡假美屋C,新竹縣橫山鄉八十分,,土地,687.48,,,0樓/0樓,無車位,788,BS41513HB,2025-10-04 04:56:00
新豐休閒農保田,新竹縣新豐鄉崁頭段,,土地,426.83,,,0樓/0樓,無車位,475,BS41788HB,2025-10-04 04:56:00
新埔邊間雙車社區型別墅,新竹縣新埔鎮安石街,7.3年,別墅/透天,57.58,55.27,4房2廳3衛,1-5樓/0樓,其他,1,BS52672HB,2025-10-04 04:56:00
K216峨眉恬靜自然生活宅,新竹縣峨眉鄉峨眉段,,土地,151.25,,3房2廳2衛,0樓/0樓,無車位,1,BS54686HB,2025-10-04 04:56:00
關西景觀渡假山坡美地,新竹縣關西鎮大旱坑段大東坑小段,,土地,6701,,,0樓/0樓,無車位,5,DS88829HB,2025-10-04 04:56:00
新豐五樓健身美2房,新竹縣新豐鄉崁頭,30.1年,公寓,25.72,20.58,2房2廳1衛,5樓/5樓,無車位,398,VB00805GH,2025-10-04 04:56:00
湖口車站金店面,新竹縣湖口鄉中和街,49.2年,店面,43.43,43.43,2廳1衛,1-4樓/4樓,無車位,1,VB01316GH,2025-10-04 04:56:00
湖口中興國小前後路透店,新竹縣湖口鄉新生三路,33.3年,別墅/透天,47.13,42.08,4房2廳3衛,1-3樓/3樓,其他,1,VS02171HB,2025-10-04 04:56:00
優質小坪數美美田,新竹縣湖口鄉和興段,,土地,419.57,,,0樓/0樓,無車位,630,VS03550HB,2025-10-04 04:56:00
峨嵋休閒度假建地,新竹縣峨眉鄉興眉段,,土地,77.9,,,0樓/0樓,無車位,800,AS125920HB,2025-10-04 04:56:00
新湖國小一樓店住,新竹縣湖口鄉民族街,31.9年,店面,26.44,13.98,1房2廳1衛,1樓/7樓,無車位,858,AS129287HB,2025-10-04 04:56:00
湖口全新整理美透天,新竹縣湖口鄉民生街,35.5年,別墅/透天,45.68,41.18,5房3廳3衛,1-2樓/0樓,其他,1,CS166517HB,2025-10-04 04:56:09
新豐超便宜大面寬農地,新竹縣新豐鄉濱海公路,,土地,368.14,,,0樓/0樓,無車位,360,CS180072HB,2025-10-04 04:56:09
新屋近66快速路農地,新竹縣新豐鄉後湖段埔頂小段,,土地,605,,,0樓/0樓,無車位,907,S2878421PA,2025-10-04 04:56:09
新豐-堡騰御璽電梯住店,新竹縣新豐鄉建興路一段,6.7年,店面,49.26,38.38,,1-2樓/12樓,無車位,1,BS41271HB,2025-10-04 04:56:09
比佛利山莊霸氣花園別墅B,新竹縣寶山鄉寶山二街,1.3年,別墅/透天,154.18,154.18,5房4廳7衛,1-3樓/0樓,無車位,7,BS45517HB,2025-10-04 04:56:09
芎林竹林段景觀美田,新竹縣芎林鄉竹林段,,土地,1837.67,,,0樓/0樓,無車位,5,BS46370HB,2025-10-04 04:56:09
新埔關埔自辦重劃區角地,新竹縣新埔鎮遠東段,,土地,197.61,,,0樓/0樓,無車位,6,BS50807HB,2025-10-04 04:56:09
峨眉茶香景觀農地,新竹縣峨眉鄉十二寮段十寮坑小段,,土地,4361.14,,,0樓/0樓,無車位,1,BS50817HB,2025-10-04 04:56:09
高鐵富翼高樓美屋,新竹縣竹北市嘉豐十路,17.5年,大樓,17.59,11.23,1房1廳1衛,12樓/13樓,無車位,1,BS52154HB,2025-10-04 04:56:09
新埔農+建豪墅,新竹縣新埔鎮黃梨園43號,28.8年,別墅/透天,109.69,109.69,7房3廳4衛,1-3樓/0樓,無車位,4,BS54011HB,2025-10-04 04:56:09
新豐市區獨棟別墅,新竹縣新豐鄉振興街,1.0年,別墅/透天,47.52,47.52,4房2廳4衛,1-3樓/3樓,其他,2,DS89462HB,2025-10-04 04:56:09
青埔子美農地,新竹縣新豐鄉青埔子段,,土地,805.26,,,0樓/0樓,無車位,1,VB00976GH,2025-10-04 04:56:09
湖口市區前院車庫美透天,新竹縣湖口鄉民生街,35.5年,別墅/透天,45.67,39.47,5房2廳3衛,1-4樓/4樓,其他,1,VB01040GH,2025-10-04 04:56:09
湖口西區商圈亮麗兩房車位,新竹縣湖口鄉民享街,6.0年,華廈,21.57,11.7,2房2廳2衛,2樓/5樓,其他,738,VB01280GH,2025-10-04 04:56:09
新豐近校區美田,新竹縣新豐鄉員興段,,土地,571.8,,,0樓/0樓,無車位,3,VS03193HB,2025-10-04 04:56:09
竹北尚義街美農地,新竹縣竹北市貓兒錠段後面小段,,土地,353.93,,,0樓/0樓,無車位,814,WS56745HB,2025-10-04 04:56:09
台泥旁活巷透天,新竹縣竹東鎮工業一路,48.4年,別墅/透天,30.85,30.85,2廳2衛,0樓/0樓,無車位,1,S2728623PA,2025-10-04 04:56:09
湖口正30米路大腹地工業廠房,新竹縣湖口鄉中正路二段,44.4年,廠房,250.65,250.65,,0樓/2樓,無車位,35,S2845995PA,2025-10-04 04:56:09
新豐國中全新資材室農保田,新竹縣新豐鄉中崙段,,土地,336.08,,,0樓/0樓,無車位,1,1988631CT,2025-10-04 04:56:09
新竹橫山市區大肚國校旁都計內建地-投資價,新竹縣橫山鄉橫華段,,土地,397.72,,,0樓/0樓,無車位,6,2046774CT,2025-10-04 04:56:09
橫山台三線建+農,新竹縣橫山鄉沙坑,,土地,3871.68,,,0樓/0樓,無車位,3,BS41204HB,2025-10-04 04:56:18
正竹北中華路乙工買地送屋,新竹縣竹北市中華路,55.0年,其它,28.07,28.07,,1樓/0樓,無車位,4,BS41245HB,2025-10-04 04:56:18
竹北挑高合法優質店面,新竹縣竹北市勝利七街二段,18.0年,店面,56.76,44.34,2衛,-1-2樓/15樓,無車位,4,BS50271HB,2025-10-04 04:56:18
北埔簡單生活悠閒莊園(C),新竹縣北埔鄉福林段,,土地,337.14,,,0樓/0樓,無車位,958,BS50733HB,2025-10-04 04:56:18
竹北/三民路華廈/平車,新竹縣竹北市三民路,31.5年,華廈,42.86,24.76,3房2廳1衛,6樓/7樓,升降平面車位,1,BS53406HB,2025-10-04 04:56:18
福興三角窗燙金住店,新竹縣竹北市福興路,16.9年,別墅/透天,78.84,75.47,,1-3樓/0樓,無車位,4,BS54570HB,2025-10-04 04:56:18
關西錦山國小旁農+建A,新竹縣關西鎮馬武督段馬武督小段,,土地,524.23,,,0樓/0樓,無車位,886,DS87863HB,2025-10-04 04:56:18
關西老街超大土地透天,新竹縣關西鎮老街,43.0年,別墅/透天,54.91,54.91,4房3廳2衛,1-2樓/0樓,其他,1,DS89539HB,2025-10-04 04:56:18
新竹免千萬近千坪賠售六塘農地,新竹縣北埔鄉湖東段,,土地,928.28,,,0樓/0樓,無車位,988,RS85864HB,2025-10-04 04:56:18
湖口高鐵路旁甲建,新竹縣湖口鄉湖新段,,土地,312.48,,,0樓/0樓,無車位,5,VB01229GH,2025-10-04 04:56:18
新豐瑞興國小798美田,新竹縣新豐鄉青埔子段,,土地,798.6,,,0樓/0樓,無車位,1,VB01287GH,2025-10-04 04:56:18
竹東新民市區透天,新竹縣竹東鎮新民路,39.3年,別墅/透天,56.46,56.46,4房2廳2衛,1-3樓/3樓,無車位,1,VB01296GH,2025-10-04 04:56:18
湖口大面寬臨15米路住辦,新竹縣湖口鄉湖中路,27.0年,別墅/透天,229.82,229.82,12房1廳4衛,1-4樓/4樓,其他,4,VB01323GH,2025-10-04 04:56:18
新豐青埔子農地,新竹縣新豐鄉青埔子段,,土地,457.08,,,0樓/0樓,無車位,598,VB01371GH,2025-10-04 04:56:18
湖口東區2房公寓,新竹縣湖口鄉天津二街,29.8年,公寓,16.96,15.23,2房2廳1衛,4樓/5樓,無車位,590,VB01389GH,2025-10-04 04:56:18
湖口低總價3房樓中樓,新竹縣湖口鄉三元路二段,29.0年,華廈,21.4,15.15,3房2廳2衛,1樓/5樓,無車位,499,VB01667GH,2025-10-04 04:56:18
美都儷舍大露臺套房,新竹縣湖口鄉德和路,21.2年,華廈,9.92,6.37,1房1廳1衛,2樓/8樓,無車位,398,VS02505HB,2025-10-04 04:56:18
台15線一般農,新竹縣新豐鄉池和段,,土地,778,,,0樓/0樓,無車位,3,VS02861HB,2025-10-04 04:56:18
新豐台15線旁方正丁種工業地,新竹縣新豐鄉池和段,,土地,283.91,,,0樓/0樓,無車位,6,VS02879HB,2025-10-04 04:56:18
專任福陽6米雙車位別墅,新竹縣新豐鄉福陽三街,7.2年,別墅/透天,55.86,53.06,3房2廳4衛,1-5樓/5樓,其他,1,VS04398HB,2025-10-04 04:56:18
湖口市中心大地坪透天,新竹縣湖口鄉中和街,49.4年,別墅/透天,43.43,43.43,,1-2樓/2樓,其他,1,AS130223HB,2025-10-04 04:56:27
新竹北埔山坡林業用地,新竹縣北埔鄉湖西段,,土地,5607.98,,,0樓/0樓,無車位,1,AS133250HB,2025-10-04 04:56:27
關西美農田(三),新竹縣關西鎮上橫坑段,,土地,939.87,,,0樓/0樓,無車位,470,CS173910HB,2025-10-04 04:56:27
湖口中國科技大學旁正路邊農地,新竹縣湖口鄉中山路二段,,土地,103.15,,,0樓/0樓,無車位,850,S2426998PA,2025-10-04 04:56:27
峨眉-水岸第一排美地-A,新竹縣峨眉鄉赤柯坪,,土地,151.55,,,0樓/0樓,無車位,980,S2849589PA,2025-10-04 04:56:27
新埔便宜臨路美農地,新竹縣新埔鎮新竹縣,,土地,619.22,,,0樓/0樓,無車位,550,BS45582HB,2025-10-04 04:56:27
新豐獨立大車庫清幽美透天,新竹縣新豐鄉埔子段,30.4年,別墅/透天,46.26,43.94,4房2廳3衛,1-4樓/4樓,其他,758,BS50701HB,2025-10-04 04:56:27
竹北皇普雲鼎全新雙層黃金店面6,新竹縣竹北市光明六路,3.0年,店面,43.12,28.87,2衛,1樓/24樓,坡道平面車位,2,BS55289HB,2025-10-04 04:56:27
湖口長威段美田(二),新竹縣湖口鄉長威一街,,土地,905.37,,,0樓/0樓,無車位,5,DS58679HB,2025-10-04 04:56:27
新豐車站旁小資透天厝,新竹縣湖口鄉新興路忠信二巷,43.7年,別墅/透天,26.75,26.75,4房2廳2衛,1-3樓/3樓,無車位,838,TB10672GH,2025-10-04 04:56:27
湖口西區巴黎時尚6套房,新竹縣湖口鄉大智路,9.3年,華廈,31.4,16.94,6房6衛,5樓/5樓,其他,1,VB00491GH,2025-10-04 04:56:27
新豐都計內畸零地,新竹縣新豐鄉榮豐段,,土地,5.2,,,0樓/0樓,無車位,65,VB00604GH,2025-10-04 04:56:27
明新科大4套房,新竹縣湖口鄉明科街,33.6年,公寓,20.61,16.39,4房4衛,4樓/5樓,無車位,568,VB01102GH,2025-10-04 04:56:27
新豐西濱方正美田,新竹縣新豐鄉坡子頭,,土地,853.35,,,0樓/0樓,無車位,1,VS01597HB,2025-10-04 04:56:27
新豐大喜事一樓公寓,新竹縣新豐鄉崁頭,30.1年,公寓,27.28,23.33,3房2廳2衛,1樓/5樓,無車位,638,VS04433HB,2025-10-04 04:56:27
尖石煤源休閒農地,新竹縣尖石鄉煤源,,土地,2647.48,,,0樓/0樓,無車位,1,S2861873PA,2025-10-04 04:56:27
竹北車站財富透天,新竹縣竹北市竹義街,44.8年,別墅/透天,56.43,56.43,15房15衛,1-3樓/3樓,無車位,3,BB03089GH,2025-10-04 04:56:27
比佛利山莊霸氣花園別墅A,新竹縣寶山鄉寶山二街,1.3年,別墅/透天,154.18,154.18,5房4廳7衛,1-3樓/0樓,無車位,7,BS45515HB,2025-10-04 04:56:27
峨眉平坦渡假休閒屋,新竹縣峨眉鄉石硬子段,,土地,181.8,,,0樓/0樓,無車位,468,BS46984HB,2025-10-04 04:56:27
關西東豐美地A區,新竹縣關西鎮東豐段,,土地,445.63,,,0樓/0樓,無車位,780,BS49096HB,2025-10-04 04:56:27
關西景觀美居(14-2),新竹縣關西鎮馬武督段赤柯山小段,,土地,65.19,,,0樓/0樓,無車位,536,BS49952HB,2025-10-04 04:56:36
台積電旁蛋黃區電梯華廈,新竹縣寶山鄉寶新路一段,33.4年,華廈,30.11,24.55,3房2廳2衛,2樓/5樓,無車位,888,BS51441HB,2025-10-04 04:56:36
湖口和興建+農地,新竹縣湖口鄉和興段,,土地,906.29,,,0樓/0樓,無車位,13,VB00666GH,2025-10-04 04:56:36
新豐持分84坪田,新竹縣新豐鄉新豐段,,土地,84.37,,,0樓/0樓,無車位,126,VB00875GH,2025-10-04 04:56:36
湖口吳厝三車位美別墅,新竹縣湖口鄉信昌六街,10.7年,別墅/透天,64.09,63.08,4房2廳3衛,1-4樓/4樓,其他,2,VB00884GH,2025-10-04 04:56:36
湖口西區滿租14套房,新竹縣湖口鄉民享街,33.0年,別墅/透天,56.16,51,14房14衛,1-3樓/3樓,無車位,2,VB00903GH,2025-10-04 04:56:36
近北埔老街景觀山坡地,新竹縣北埔鄉湖西段,,土地,842.75,,,0樓/0樓,無車位,450,VB01010GH,2025-10-04 04:56:36
湖口西區2+1房2衛美廈,新竹縣湖口鄉文化路,20.1年,華廈,24.51,20.65,3房2廳2衛,3樓/5樓,無車位,768,VB01295GH,2025-10-04 04:56:36
獨家/新庄子住店(需整理),新竹縣新豐鄉振興街,52.8年,別墅/透天,26.93,25.66,4房2廳2衛,1-2樓/2樓,其他,1,VS01624HB,2025-10-04 04:56:36
近成功路休閒田,新竹縣湖口鄉信勢段,,土地,406.26,,,0樓/0樓,無車位,1,VS01682HB,2025-10-04 04:56:36
湖口近交流道透天,新竹縣湖口鄉新生三路,33.3年,別墅/透天,47.14,44.25,4房2廳3衛,1-3樓/3樓,無車位,1,VS02173HB,2025-10-04 04:56:36
關西稀有低總價休閒農地,新竹縣關西鎮燥坑段,,土地,191.79,,,0樓/0樓,無車位,298,AS127399HB,2025-10-04 04:56:36
新竹新埔農地+建地,新竹縣新埔鎮照鏡路,40.2年,其它,308.34,30.05,,1樓/0樓,無車位,9,CS175040HB,2025-10-04 04:56:36
高鐵特區I-PARK豐邑大樓,新竹縣竹北市六家五路二段,16.4年,大樓,52.65,29.6,3房2廳2衛,9樓/15樓,其他,3,YS189923HB,2025-10-04 04:56:36
湖口湖南段便宜美田,新竹縣湖口鄉湖南段,,土地,601.98,,,0樓/0樓,無車位,1,BB02263GH,2025-10-04 04:56:36
王爺壟角地建地,新竹縣湖口鄉中義段,,土地,157.62,,,0樓/0樓,無車位,6,BS39797HB,2025-10-04 04:56:36
北埔樂活農地(B),新竹縣北埔鄉湖西段,,土地,1483.07,,,0樓/0樓,無車位,460,BS46631HB,2025-10-04 04:56:36
獨家新埔內立美田,新竹縣新埔鎮內立段,,土地,293.43,,,0樓/0樓,無車位,528,BS52655HB,2025-10-04 04:56:36
成瓏重劃區大面寬電梯透天,新竹縣竹北市中山五街,8.7年,別墅/透天,77.28,75.07,4房3廳5衛,1-4樓/0樓,其他,3,BS53185HB,2025-10-04 04:56:36
【猛哥賣厝】峨眉陽光莊園美農地,新竹縣峨眉鄉赤柯山段,,土地,123.95,,,0樓/0樓,無車位,298,BS54758HB,2025-10-04 04:56:36
J750芎林鄉秀湖清優美農地,新竹縣芎林鄉山湖段秀湖小段,,土地,784.08,,,0樓/0樓,無車位,2,BS54794HB,2025-10-04 04:56:45
竹北皇普雲鼎全新雙層黃金店面9,新竹縣竹北市光明六路,3.0年,店面,42.23,28.28,2衛,1樓/24樓,坡道平面車位,2,BS55295HB,2025-10-04 04:56:45
禾心院成家裝潢美透天,新竹縣湖口鄉東楊路,4.4年,別墅/透天,50.46,50.46,2房2廳3衛,1-3樓/3樓,無車位,1,DS87844HB,2025-10-04 04:56:45
竹北鳳岡合法2房資材室,新竹縣竹北市貓兒錠段山腳小段,,土地,907.5,,,0樓/0樓,無車位,3,VB00701GH,2025-10-04 04:56:45
湖口臨成功路大地坪透天,新竹縣湖口鄉成功路,51.5年,別墅/透天,65.29,65.29,4房2廳2衛,1-2樓/2樓,無車位,1,VB00849GH,2025-10-04 04:56:45
湖口東區景觀大華廈,新竹縣湖口鄉光復東路,31.7年,華廈,34.11,24.03,3房2廳2衛,5樓/5樓,無車位,838,VB01306GH,2025-10-04 04:56:45
王爺壟重劃區內美墅,新竹縣湖口鄉達生六街,11.5年,別墅/透天,127.92,56.17,5房2廳4衛,1-4樓/4樓,其他,3,VS01415HB,2025-10-04 04:56:45
湖口東區*漂亮2+1房,新竹縣湖口鄉光復東路,32.9年,華廈,25.98,22.59,2房2廳1衛,3樓/5樓,無車位,798,VS01951HB,2025-10-04 04:56:45
新豐火車站前賺錢店面,新竹縣新豐鄉建興路一段,6.7年,店面,76.85,54.17,2房2衛,1-2樓/2樓,其他,3,VS02063HB,2025-10-04 04:56:45
建興85℃透天住店,新竹縣新豐鄉建興路一段,43.9年,別墅/透天,31.93,31.93,3房1廳2衛,1-3樓/3樓,其他,2,VS02439HB,2025-10-04 04:56:45
湖口西區美三房,新竹縣湖口鄉鳳凰三街,43.6年,公寓,17.69,17.69,3房2廳1衛,4樓/4樓,無車位,488,VS04085HB,2025-10-04 04:56:45
湖口和峻沐光兩房平車,新竹縣湖口鄉達生八街,0.9年,華廈,33.12,15.64,2房2廳1衛,9樓/10樓,其他,1,VS04427HB,2025-10-04 04:56:45
湖口夏季三角咖啡廳農地,新竹縣湖口鄉長安路,,土地,580.68,,,0樓/0樓,無車位,988,S2773060PA,2025-10-04 04:56:45
埔和國小美資材田,新竹縣新豐鄉新豐段,,土地,378.13,,,0樓/0樓,無車位,880,BB00960GH,2025-10-04 04:56:45
竹北市區透店,新竹縣竹北市中和街,50.7年,別墅/透天,27.77,27.77,3房2廳2衛,1-2樓/2樓,其他,1,BB01673GH,2025-10-04 04:56:45
新豐中崙雙面臨路三角田,新竹縣新豐鄉中崙段,,土地,440.14,,,0樓/0樓,無車位,1,BB02302GH,2025-10-04 04:56:45
湖口省道大地坪透天,新竹縣湖口鄉八德路二段,45.0年,別墅/透天,45.19,45.19,3房2廳2衛,1-2樓/2樓,其他,1,BB02459GH,2025-10-04 04:56:45
湖口德豐路大面寬甲建,新竹縣湖口鄉德豐路,,土地,251.68,,,0樓/0樓,無車位,3,BB03483GH,2025-10-04 04:56:45
新埔民生街臨路休閒農地,新竹縣新埔鎮泰陽段,,土地,631.48,,,0樓/0樓,無車位,668,BB03633GH,2025-10-04 04:56:45
遠百勝利商圈-城峰匯3+1房,新竹縣竹北市莊敬五街,11.4年,大樓,56.28,29.94,4房2廳2衛,18樓/23樓,坡道平面車位,2,BB03843GH,2025-10-04 04:56:45
新豐青埔便宜農地,新竹縣新豐鄉青埔子段,,土地,1064.8,1064,,0樓/0樓,無車位,1,BS28736HB,2025-10-04 04:56:53
櫻花聚高樓視野三房,新竹縣竹北市中央路,1.1年,大樓,41.39,20.96,3房2廳2衛,10樓/15樓,坡道平面車位,2,BS46057HB,2025-10-04 04:56:53
