標題,地址,屋齡,類型,建坪,主+陽,格局,樓層,車位,總價(萬),編號,抓取時間
家一方晨光入築三房車位家一方,新北市新莊區福美街,12.6年,大樓,60.83,34.18,3房2廳2衛1室,12樓/14樓,坡道平面車位,3,0815RD,2025-09-25 03:09:15
真理大學邊間收租置產,新北市淡水區新民街,37.1年,公寓,36.41,36.42,6房6衛,3樓/5樓,無車位,747,4403FQ,2025-09-25 03:09:15
法國賞優美二房法國賞,新北市板橋區光復街,22.8年,大樓,35.33,19.21,2房2廳1衛,2樓/14樓,坡道機械車位,2,8898NB,2025-09-25 03:09:15
來來香榭溫馨大套房大陽台來來香榭,新北市淡水區新民街,35.4年,華廈,10.54,8.43,1房1廳1衛,5樓/5樓,無車位,448,8679QT,2025-09-25 03:09:15
青山採光邊間高樓大四房桔運青山,新北市中和區忠孝街,26.0年,大樓,76.6,54.79,4房2廳2衛1室,10樓/12樓,兩個以上車位,3,5287FT,2025-09-25 03:09:15
竹圍頂級裝潢河景楓丹白露楓丹白露,新北市淡水區樹梅坑,41.9年,大樓,44.41,42.82,2房2廳2衛1室,8樓/12樓,無車位,1,8610FK,2025-09-25 03:09:15
㊣近公園及圖書館一樓,新北市三重區仁興街,50.7年,公寓,15.51,15.51,2房2廳1衛1室,1樓/4樓,無車位,1,2521YQ,2025-09-25 03:09:15
［早安清境］高樓兩房車位早安清境,新北市汐止區南興路,12.8年,大樓,39.31,19.06,2房2廳1衛,10樓/11樓,坡道平面車位,2,1125AL,2025-09-25 03:09:15
頂！方正美寓緊來看！讚的,新北市三重區頂崁街,41.2年,公寓,29.01,29,3房2廳2衛,4樓/5樓,無車位,1,1240CP,2025-09-25 03:09:15
專營．川普Ｇ３棧．舒適宅川普G3棧,新北市淡水區淡金路一段,10.0年,大樓,33.9,15.59,1房2廳1衛,15樓/15樓,坡道平面車位,1,59516Z,2025-09-25 03:09:15
青山湖畔極美世外桃源青山鎮,新北市新店區青山路,18.9年,華廈,92.55,69.93,3房3廳3衛1室,1-2樓/5樓,坡道平面車位,5,32629Q,2025-09-25 03:09:15
〖福利國〗藍線捷運旁３房泰隆福利國,新北市土城區中央路四段,26.3年,大樓,29.12,22.23,3房2廳2衛,5樓/18樓,無車位,1,3605DS,2025-09-25 03:09:15
Ｆ１．幸福美妝套房超級F1,新北市板橋區新府路,16.9年,大樓/套房,14.7,9.46,1房1廳1衛(含加蓋1房),20樓/24樓,無車位,1,6744LY,2025-09-25 03:09:15
金門街稀有大透天麗池花園A區,新北市板橋區金門街,22.7年,透天,62.76,30.79,6房2廳3衛(含加蓋2房1衛),1-2樓/2樓,坡道平面車位,3,1351WL,2025-09-25 03:09:15
★專任★世紀風情庭院三房世紀風情,新北市汐止區福德一路,25.9年,大樓,28.54,21.95,3房2廳2衛,1樓/14樓,無車位,2,2346JW,2025-09-25 03:09:15
百仕園邊間三房平面車位百仕園,新北市板橋區長江路二段,27.4年,大樓,46.17,25.82,3房2廳2衛,10樓/12樓,坡道平面車位,2,6377FD,2025-09-25 03:09:15
專任鳳凰花園景觀兩房車位鳳凰花園,新北市新莊區中正路,5.3年,大樓,33.45,17.25,2房2廳1衛,19樓/22樓,坡道平面車位,2,9052KC,2025-09-25 03:09:15
獨家專任蘭庭序成家二房蘭庭序,新北市汐止區汐萬路一段,10.3年,大樓,32.78,21.13,2房2廳1衛,9樓/15樓,無車位,1,1202ZB,2025-09-25 03:09:15
祥富龍⌂集英堡Ⅵ臻藏集英堡(六期),新北市三重區集智街,10.7年,大樓,53.1,28.6,3房2廳2衛,7樓/11樓,坡道平面車位,3,56200T,2025-09-25 03:09:15
林口粉寮路土地,新北市林口區粉寮路二段,,土地,96.5,,2廳(含加蓋2廳),1-1樓/1樓,無車位,948,11339S,2025-09-25 03:09:25
丹麥琥珀我是住宅大坪數麗寶北歐莊園-丹...,新北市板橋區華江一路,3.1年,大樓,45.41,22.29,1房2廳2衛,4樓/19樓,坡道平面車位,3,0388JU,2025-09-25 03:09:25
搶手輔大世界金雞輔大世界,新北市新莊區建國一路,31.7年,其它,66.7,39.32,22房22衛(含加蓋10房10衛),10樓/10樓,坡道平面車位,3,0498CB,2025-09-25 03:09:25
【好室研研】三房景觀戶好室研研,新北市土城區青雲路,3.8年,大樓,37.61,17.26,3房2廳1衛,14樓/14樓,坡道平面車位,2,9462QG,2025-09-25 03:09:25
美麗宏國海山方正兩房美麗宏國B區,新北市土城區學府路一段,30.8年,大樓,24.99,20.91,2房2廳1衛,12樓/18樓,無車位,1,8930NU,2025-09-25 03:09:25
Ａ９採光裝潢大五房羅芙宮,新北市林口區文化三路一段,17.4年,大樓,78.16,42.44,5房2廳2衛,11樓/12樓,兩個以上車位,3,4315GL,2025-09-25 03:09:25
主推⭐合謙美境三房車位合謙好境-美境,新北市汐止區長興街二段,9.2年,大樓,51.02,25.89,3房2廳2衛,11樓/11樓,坡道平面車位,1,2952ZW,2025-09-25 03:09:25
松下雲品亮麗大空間松下雲品,新北市板橋區國慶路,5.6年,辦公/大樓,50.23,29.45,1廳2.5衛,3樓/15樓,兩個以上車位,3,7914YM,2025-09-25 03:09:25
．德馨滿室．亞昕平方亞昕平方,新北市新莊區中原東路,12.8年,大樓,94.37,44.25,3房2廳2衛,15樓/19樓,兩個以上車位,5,7318XG,2025-09-25 03:09:25
晴空樹高樓景觀４房車位亞昕晴空樹,新北市林口區文化三路一段,7.8年,大樓,83.02,47.94,4房2廳2衛,20樓/33樓,坡道平面車位,5,2133GV,2025-09-25 03:09:25
江翠重劃高樓景觀三房車位江翠Park,新北市板橋區大漢街,6.0年,大樓,41.04,19.31,3房2廳2衛,8樓/15樓,坡道平面車位,2,8216PH,2025-09-25 03:09:25
金華錢潮店面金華龍邸,新北市板橋區公館街,27.4年,店面,28.57,17.72,2廳1衛,1樓/8樓,無車位,2,2764JD,2025-09-25 03:09:25
主推⭐稀有晶鑽兩房美屋⭐伯爵晶鑽,新北市汐止區康寧街,16.3年,大樓,30.25,23.98,2房2廳1衛,9樓/23樓,無車位,1,0204GS,2025-09-25 03:09:25
區公所低總邊間二樓大空間,新北市永和區竹林路,54.8年,公寓,29.73,29.73,3房2廳1衛,2樓/3樓,無車位,1,0918XU,2025-09-25 03:09:25
天禧江子翠河景３房雙車位,新北市板橋區溪頭街,預售,大樓,78.6,38.22,3房2廳2衛,13樓/28樓,兩個以上車位,4,8508UK,2025-09-25 03:09:25
【土地】三芝區埔頭段農地,新北市三芝區埔頭坑,,土地,102.92,,,,無車位,1,30041L,2025-09-25 03:09:25
【專任】板橋稀有素地釋出,新北市板橋區光復街,,土地,429.55,,,,無車位,28,1697WX,2025-09-25 03:09:25
專任坪頂路稀有土地,新北市淡水區坪頂路,,土地,592.83,,,,無車位,2,3029DM,2025-09-25 03:09:25
養氣養身養心深坑,新北市深坑區,14.1年,透天,209.34,168.15,5房5廳4衛5室,B1-4樓/4樓,兩個以上車位,13,07140L,2025-09-25 03:09:25
捷運輔大倉儲首選輔大世界,新北市新莊區建國一路,31.7年,倉庫,500.11,0,8廳2衛,-1樓/10樓,無車位,9,40394H,2025-09-25 03:09:25
蛇麼都順利林口店面法國小鎮-香堤區,新北市林口區仁愛路一段,18.5年,店面,57.47,37.61,4房2廳2衛,1-2樓/7樓,坡道平面車位,2,9901SU,2025-09-25 03:09:32
國泰溫馨小套房,新北市板橋區國泰街,49.7年,套房/公寓,3.79,3.79,1房1衛,4樓/4樓,無車位,298,2404KM,2025-09-25 03:09:32
新板巨星優質首選新板巨星/超級城...,新北市新莊區新樹路,3.5年,店面,35.11,23.3,3房2廳2衛,2樓/15樓,無車位,1,3991SC,2025-09-25 03:09:32
近台北橋捷運站＊小資店面陽光迷你群,新北市三重區福和街,28.7年,店面,17.2,4.04,1廳1衛,1樓/7樓,升降機械車位,1,4558CB,2025-09-25 03:09:32
玉上園面中庭三房美屋玉上園,新北市新店區寶橋路,12.1年,大樓,57.27,32.57,3房2廳2衛,3樓/26樓,坡道平面車位,4,9244JG,2025-09-25 03:09:32
稀有邊間免爬高２樓,新北市土城區明德路一段,37.6年,公寓,32.65,32.64,3房2廳2衛,2樓/5樓,無車位,1,5979HD,2025-09-25 03:09:32
陸光新城３房車位陸光新城-A區(...,新北市五股區六合街,17.1年,華廈,57.03,34.47,3房2廳2衛,3樓/8樓,坡道平面車位,1,5093GV,2025-09-25 03:09:32
【住宅】曼哈頓一房車位超級城市SUPE...,新北市新莊區莊崑路,8.4年,大樓,26.48,12.36,1房1廳1衛,8樓/15樓,坡道平面車位,1,4351XM,2025-09-25 03:09:32
舒適三房＋車位嘉新林園,新北市新店區中興路一段,32.4年,大樓,44,34.74,3房2廳2衛,7樓/12樓,坡道機械車位,2,0408AU,2025-09-25 03:09:32
悅桂近奇異鳥、忠孝路店面悅桂,新北市林口區公園路,16.2年,店面,50.86,30.45,1廳1衛1室,1樓/5樓,坡道平面車位,3,9460ML,2025-09-25 03:09:32
湯城園區面寬金店湯城園區10~2...,新北市三重區重新路五段,33.4年,店面,59.22,49.18,3廳1衛,1樓/10樓,無車位,3,6515TD,2025-09-25 03:09:32
金賀國凱名人大透天國凱名人社區,新北市樹林區國凱街,37.3年,透天,43.59,29.91,6房3廳6衛(含加蓋3房3衛),1-2樓/2樓,無車位,3,4807DX,2025-09-25 03:09:32
七張捷運中庭山景裝潢美屋園頂,新北市新店區中興路二段,8.5年,大樓,43.63,23.2,3房2廳2衛,8樓/26樓,坡道平面車位,3,8797HG,2025-09-25 03:09:32
中央官邸高樓兩房車位中央官邸,新北市三重區中央南路,8.7年,大樓,31.07,17.92,2房2廳1衛,14樓/14樓,塔式車位,2,3566FJ,2025-09-25 03:09:32
府中捷運溫馨明亮美屋,新北市板橋區館前東路,33.1年,大樓/套房,10.58,7.06,1房1廳1衛,8樓/11樓,無車位,728,7091BQ,2025-09-25 03:09:32
四季之旅Ω電梯三房台北灣五期-四季...,新北市淡水區新市一路一段,8.9年,大樓,36.7,23.39,3房2廳2衛,21樓/23樓,無車位,1,9490PV,2025-09-25 03:09:32
［新接］幸福捷運三房車位晶華二期,新北市新莊區福壽街,25.1年,華廈,49.51,29.54,3房2廳2衛,2樓/9樓,坡道平面車位,2,1447YM,2025-09-25 03:09:32
景安宏璽花園高樓景觀居宏璽新世界,新北市中和區景平路,28.4年,大樓,38.33,32.22,4房2廳2衛,8樓/17樓,無車位,2,0404SJ,2025-09-25 03:09:32
永安公園質感低總小資宅,新北市永和區安樂路,7.7年,華廈,11.68,6.54,1房1廳1衛,2樓/7樓,無車位,1,6662HP,2025-09-25 03:09:32
揚名學園單層單戶三房雙衛揚名學園,新北市新莊區中榮街,27.7年,華廈,34.29,24.05,3房2廳2衛,2樓/9樓,無車位,1,1136DT,2025-09-25 03:09:32
現代巴黎大兩房衛浴開窗世界盃二期-現代...,新北市新莊區新樹路,17.4年,大樓,38.48,19.04,2房2廳1衛,15樓/15樓,坡道平面車位,1,0016HM,2025-09-25 03:09:41
千坪新鮮水源農地,新北市淡水區,,土地,4445.74,,,,無車位,13,35999M,2025-09-25 03:09:41
新北樹林工業用地,新北市樹林區成功街,,土地,407.81,,,,無車位,24,5195UR,2025-09-25 03:09:41
近捷運電梯３房車位統才泰邑,新北市蘆洲區民族路,11.3年,大樓,56.01,31.55,3房2廳2衛,8樓/15樓,坡道平面車位,3,83409H,2025-09-25 03:09:41
近海山捷運站面寬店面,新北市土城區中華路一段,9.3年,店面/辦公,454.29,161.82,2廳6室,1-2樓/14樓,兩個以上車位,18,13255H,2025-09-25 03:09:41
陽光ＰＡＲＫ挑高一樓陽光PARK,新北市新店區安興路,9.5年,辦公/大樓,35.01,19.59,5房2廳1衛(含加蓋2房),1樓/14樓,坡道平面車位,1,5259KJ,2025-09-25 03:09:41
大空間機能好有車位富士通,新北市三重區仁政街,18.6年,大樓,61.25,38.53,4房2廳2衛,3樓/14樓,坡道平面車位,3,4862AJ,2025-09-25 03:09:41
機捷新莊副都心★富御匯富御匯,新北市新莊區新北大道四段,9.7年,辦公/大樓,52.05,23.93,1房2廳1衛,8樓/14樓,坡道平面車位,2,0648AK,2025-09-25 03:09:41
愛上聯上匯翠高樓聯上匯翠,新北市板橋區華江一路,4.4年,大樓,34.99,15.81,2房1廳1衛,13樓/19樓,坡道平面車位,1,7858YQ,2025-09-25 03:09:41
捷運邊間小資金店面樂鼎皇築,新北市中和區南山路,26.7年,店面,17.85,12.38,1廳1衛,1樓/6樓,無車位,1,2225GH,2025-09-25 03:09:41
【稀有】近三重國小站透天,新北市三重區秀江街,60.3年,透天,47.52,44.73,6房4廳4衛(含加蓋2廳1衛),1-3樓/3樓,無車位,3,6059YB,2025-09-25 03:09:41
光華邊間彈性利用一樓,新北市蘆洲區光華路,36.3年,公寓,31.27,28.12,4房2廳2衛,1樓/5樓,無車位,1,5394FT,2025-09-25 03:09:41
國泰市場１－２樓金店面國泰晶華,新北市板橋區國泰街,17.6年,店面,39.25,28.29,3廳2衛,1-2樓/2樓,無車位,2,5713UK,2025-09-25 03:09:41
德馨居面寬黃金店面德馨居,新北市林口區民族路,16.8年,店面,60.01,29.7,2廳2衛,1-2樓/11樓,兩個以上車位,5,1682UP,2025-09-25 03:09:41
鴻華天水河景三房車位鴻華天水,新北市三重區環河北路三段,3.8年,大樓,53.02,24.42,3房2廳2衛,5樓/18樓,坡道平面車位,3,0952SR,2025-09-25 03:09:41
板橋南雅低總公寓首選,新北市板橋區南雅南路一段,44.8年,公寓,14.39,14.39,2房2廳1衛,4樓/5樓,無車位,988,9622VB,2025-09-25 03:09:41
埔墘熱鬧金店面,新北市板橋區中山路二段,42.1年,店面,24,16.6,1房2廳1衛1室(含加蓋1衛),1樓/5樓,無車位,4,2868XQ,2025-09-25 03:09:41
⭐采采良品美妝三房⭐采采良品-采悅館,新北市汐止區福德一路,4.9年,大樓,31.01,19.55,3房2廳1衛,10樓/11樓,無車位,2,1645DX,2025-09-25 03:09:41
清淞河景藝術家清淞,新北市淡水區淡金路,17.1年,大樓,15.44,8.47,1房1廳1衛,7樓/29樓,坡道機械車位,798,1375YU,2025-09-25 03:09:41
海闊大器四房車位海闊-海闊區,新北市淡水區中正東路二段,18.4年,大樓,69.93,44.73,4房2廳3衛,2樓/14樓,坡道平面車位,2,3806CP,2025-09-25 03:09:41
捷運ＧＯ景觀美屋捷運GO境,新北市新莊區龍安路,16.8年,大樓,26.71,12.89,1房1廳1衛,10樓/15樓,升降機械車位,1,9627DW,2025-09-25 03:09:50
家順三角窗金店面佳順家順,新北市林口區文化二路二段,8.1年,店面,36.3,18.65,1廳1衛,1樓/11樓,坡道平面車位,2,0451DT,2025-09-25 03:09:50
江滙Ｌｉｆｅ。大寬金店面江滙Life,新北市板橋區華江一路,3.3年,店面,38.92,16.21,2廳1衛(含加蓋1廳),1樓/15樓,坡道平面車位,3,8586QZ,2025-09-25 03:09:50
金富精緻絕美高樓四房車位金富帝寶,新北市板橋區重慶路,14.9年,大樓,54.12,35.5,4房2廳2衛1室,12樓/15樓,坡道機械車位,3,8176GH,2025-09-25 03:09:50
千代田‧精緻美宅竹城千代田,新北市樹林區學府路,16.5年,大樓,44.54,25.34,3房2廳2衛,11樓/15樓,其他,1,1649DQ,2025-09-25 03:09:50
高鮮屋◇挑高美宅高鮮屋,新北市新店區安康路二段,27.3年,大樓,29.23,21.87,5房2廳2衛(含加蓋3房1衛),9樓/15樓,無車位,1,5456UW,2025-09-25 03:09:50
秀朗橋精美裝潢４房雙車位翠堤香檳,新北市中和區成功路,39.4年,華廈,88.24,69.5,4房3廳3衛,4-5樓/7樓,兩個以上車位,4,0746RP,2025-09-25 03:09:50
自強路上面寬金店面擎天大第,新北市淡水區自強路,35.1年,店面/辦公,90.63,37.71,2廳2衛1室,B1-1樓/16樓,無車位,3,2725NU,2025-09-25 03:09:50
伊吉邦陽光大空間好宅伊吉邦,新北市新莊區新北大道七段,26.5年,大樓,26.1,19.25,3房2廳1衛1室(含加蓋2房1室),12樓/18樓,無車位,1,1807VG,2025-09-25 03:09:50
【頭前】興天地三房車位興天地,新北市新莊區福美街,12.6年,大樓,71.44,41.08,3房2廳2衛,17樓/17樓,坡道平面車位,3,3707AV,2025-09-25 03:09:50
南加州精緻裝潢正河景南加州,新北市淡水區民權路,16.8年,其它/大樓,19.18,12.32,2房1廳1衛(含加蓋2房),11樓/24樓,無車位,1,8268VM,2025-09-25 03:09:50
荷雅邊間大兩房坡平車位荷雅時尚館,新北市淡水區淡金路,12.1年,大樓,37.01,18.01,2房2廳1衛,3樓/15樓,坡道平面車位,1,2494QW,2025-09-25 03:09:50
台北加州高樓四房雙車位台北加州C區、D...,新北市新莊區中平路,34.5年,大樓,78.96,42.74,4房2廳2衛,9樓/15樓,兩個以上車位,2,8078MG,2025-09-25 03:09:50
建安街華府電梯三房華府,新北市新莊區建安街,33.9年,華廈,30.56,23.44,3房2廳1衛,4樓/6樓,無車位,1,5355PN,2025-09-25 03:09:50
靜雅。聯邦３房聯邦大城2期,新北市土城區明德路一段,31.6年,大樓,29.99,22.37,3房2廳2衛,6樓/11樓,無車位,1,9025HD,2025-09-25 03:09:50
森晴三房稀有釋出,新北市鶯歌區龍七路,4.8年,華廈,41.19,25.55,3房2廳2衛,3樓/9樓,無車位,1,0239YZ,2025-09-25 03:09:50
朝代大第．帝王樓中樓朝代大第,新北市永和區成功路二段,31.9年,大樓,63.35,43.79,6房2廳4衛1室(含加蓋4房1衛),14-15樓/15樓,坡道平面車位,4,2122QX,2025-09-25 03:09:50
晴空鋼構＿東帝視野美宅摩天東帝市,新北市中和區景平路,27.9年,大樓,13.4,10.38,1房1廳1衛,21樓/41樓,無車位,1,3489KM,2025-09-25 03:09:50
遠雄紫金園三房車位遠雄紫金園/遠雄...,新北市中和區中原二街,11.8年,大樓,62.62,33.77,3房2廳2衛,6樓/23樓,兩個以上車位,3,4670GH,2025-09-25 03:09:50
吉成特區稀有一樓廠房,新北市新店區中正路,37.2年,廠房/倉庫,107.37,78.87,9房2衛,1樓/5樓,坡道平面車位,6,9649UT,2025-09-25 03:09:50
攬月挑高舒適１樓大空間攬月樓,新北市淡水區自強路,32.6年,大樓,59.93,38.32,5房3廳2衛(含加蓋3房1廳),1樓/19樓,坡道機械車位,2,0162VR,2025-09-25 03:10:00
興天地樹景辦公室興天地,新北市新莊區福美街,12.6年,辦公/大樓,150.4,70.95,4房2廳3衛,2樓/17樓,兩個以上車位,6,2546QZ,2025-09-25 03:10:00
鄉林鉅作•高樓純住釋出鄉林淳青,新北市新莊區新北大道四段,12.0年,大樓,146.22,83.35,4房3廳4衛,16樓/19樓,兩個以上車位,7,7898PX,2025-09-25 03:10:00
燙金門牌創業低總價店面台北公館,新北市新店區北新路三段,31.9年,店面/倉庫,13.21,10.2,1廳1衛,2樓/12樓,無車位,1,2853SQ,2025-09-25 03:10:00
仁愛公園經典美三房車位水築館,新北市永和區環河西路二段,23.3年,大樓,57.16,37.05,3房2廳2衛,15樓/22樓,坡道平面車位,3,7087WM,2025-09-25 03:10:00
［紅線］典雅裝潢即可入住水世紀,新北市淡水區民權路,18.0年,大樓,13.56,8.97,1房1廳1衛,10樓/29樓,無車位,858,8713FC,2025-09-25 03:10:00
天空之邑三房稀有雙車位天空之邑,新北市五股區新五路二段,2.0年,大樓,41.63,16.28,3房2廳2衛,8樓/24樓,兩個以上車位,1,6435TN,2025-09-25 03:10:00
ＡＡ三生道澄心谷,新北市三芝區陽光路,,土地,9413.8,,,,無車位,28,27757U,2025-09-25 03:10:00
宏普樂高質感美屋宏普樂高,新北市淡水區新市二路一段,7.8年,大樓/辦公,34.93,13.12,2房1廳1衛(含加蓋1房),10樓/13樓,坡道平面車位,1,4238CZ,2025-09-25 03:10:00
【專任】海揚溫馨裝潢三房海揚,新北市淡水區中正東路一段,17.9年,大樓,39.37,23.47,3房2廳2衛,13樓/24樓,坡道平面車位,1,5864US,2025-09-25 03:10:00
【新案】捷運幸福三房車位晶華二期,新北市新莊區福壽街,25.1年,華廈,47.91,28.59,3房2廳2衛,2樓/9樓,坡道平面車位,2,3760JM,2025-09-25 03:10:00
中央市場附近～金標的,新北市三重區中央北路,85.0年,店面/透天,29.34,25.41,2廳1衛1室(含加蓋1廳1衛1室),1-1樓/1樓,無車位,8,38954T,2025-09-25 03:10:00
頭前重劃熱鬧金店合康天賦,新北市新莊區中原東路,10.9年,店面,53.52,34.76,2廳1衛,1-2樓/19樓,坡道平面車位,6,78413S,2025-09-25 03:10:00
西盛稀有空間店辦,新北市新莊區西盛街,45.1年,店面/辦公,22.75,22.75,1房2廳1衛1室(含加蓋1房1廳1室),1樓/4樓,無車位,4,5688MR,2025-09-25 03:10:00
淡江後花園頂加套房,新北市淡水區英專路,45.3年,公寓/套房,29.55,29.55,11房1廳11衛(含加蓋5房5衛),5樓/5樓,無車位,1,1972UL,2025-09-25 03:10:00
香格里拉小資電梯美套房,新北市新店區松林路,40.7年,華廈,15.49,9.78,1廳1衛,-1樓/6樓,無車位,260,7818YH,2025-09-25 03:10:00
極麗－美兩房附車位！！！極麗,新北市新店區北宜路一段,10.4年,大樓,34.94,18.78,2房2廳1衛,8樓/14樓,塔式車位,2,3317CC,2025-09-25 03:10:00
康詩丹郡黃金三房車位康詩丹郡,新北市汐止區林森街,32.2年,大樓,48.79,29.3,3房2廳2衛,17樓/21樓,坡道平面車位,1,6193KK,2025-09-25 03:10:00
溪園路湯泉黃金店面湯泉櫻花,新北市新店區溪園路,22.9年,店面,38.95,22.71,1廳2衛1室(含加蓋1衛1室),1樓/14樓,無車位,3,7486SW,2025-09-25 03:10:00
★綠意皇邑金店面★綠意皇邑,新北市汐止區忠孝東路,9.3年,店面,42.81,16.86,1廳1衛,1樓/11樓,兩個以上車位,2,0353MG,2025-09-25 03:10:00
家天下三房車位皇城家天下,新北市淡水區後洲路一段,15.6年,大樓,45.86,26.81,3房2廳2衛,10樓/13樓,坡道平面車位,1,3889KK,2025-09-25 03:10:09
風清月朗Ω日月光日月光,新北市汐止區康寧街,29.2年,大樓,61.45,46.73,4房2廳2衛,11樓/24樓,坡道平面車位,2,9471FF,2025-09-25 03:10:09
專任麗園景觀三房新麗園/林口國宅...,新北市林口區麗園一街,30.2年,大樓,50.81,35.37,3房2廳2衛,10樓/16樓,無車位,1,5458FU,2025-09-25 03:10:09
林口、正信義路優質金店面法國四季,新北市林口區信義路,12.5年,店面,36.49,17.75,2廳2衛1室(含加蓋1廳1衛),1樓/15樓,坡道平面車位,2,3468ZS,2025-09-25 03:10:09
北歐風仁愛特區兩房長隄,新北市永和區環河西路二段,27.7年,大樓,30.44,20.22,2房2廳1衛,14樓/18樓,坡道機械車位,2,2459GD,2025-09-25 03:10:09
精選機捷景觀次頂高樓都峰苑,新北市新莊區新北大道四段,12.5年,辦公/大樓,50.38,26.32,3房2廳1衛,18樓/19樓,坡道平面車位,2,7420CY,2025-09-25 03:10:09
忠孝電梯採光魔術美華廈忠孝華廈,新北市三重區忠孝路二段,24.9年,華廈,15.84,13.75,1房2廳1衛,5樓/7樓,無車位,1,4863SL,2025-09-25 03:10:09
邊間路邊金廠辦,新北市樹林區中華路,46.0年,廠房,443.86,408.28,7房5廳5衛2室(含加蓋1廳),1-3樓/3樓,無車位,31,8951KF,2025-09-25 03:10:09
朝代大第．稀有大空間朝代大第,新北市永和區成功路二段,31.9年,大樓,60.99,54.88,4房2廳3衛,2樓/15樓,無車位,3,6956FY,2025-09-25 03:10:09
帝一宅景觀四房雙車位帝一宅,新北市林口區中山路,11.1年,大樓,83.17,45.47,4房2廳2衛,3樓/12樓,兩個以上車位,4,3848SV,2025-09-25 03:10:09
台北水都●面中庭台北水都,新北市汐止區工建路,28.4年,大樓,48.2,29.7,5房1廳1衛,8樓/20樓,坡道平面車位,2,7520UW,2025-09-25 03:10:09
成家首選˙免爬高３樓,新北市中和區員山路,46.9年,公寓,23.25,23.24,3房2廳1衛,3樓/5樓,無車位,1,4811QW,2025-09-25 03:10:09
國鼎‧三房車位花園豪邸國鼎,新北市板橋區漢生東路,16.5年,大樓,126.8,64.23,3房2廳3衛1室,4樓/28樓,兩個以上車位,9,5822ZZ,2025-09-25 03:10:09
碧瑤優賞稀有釋出四房車位碧瑤優賞,新北市泰山區福興一街,17.7年,華廈,57.13,36.92,4房2廳2衛,5樓/8樓,坡道平面車位,2,6202LZ,2025-09-25 03:10:09
康詩丹郡景觀美屋康詩丹郡,新北市汐止區林森街,32.2年,大樓,55.38,33.96,2房2廳2衛1室,15樓/21樓,坡道平面車位,2,0495DC,2025-09-25 03:10:09
汐科黃金大店面哈佛世家NO1,新北市汐止區大同路二段,25.9年,店面/大樓,77.46,62.16,1房2廳2衛,1-2樓/14樓,無車位,11,9798DF,2025-09-25 03:10:09
大椰林四房車位美屋大椰林,新北市新店區建國路,25.8年,大樓,45.24,34.14,4房2廳2衛,3樓/14樓,坡道機械車位,2,0270ZN,2025-09-25 03:10:09
優質湖前街文普帶Ｂ１車位文普湖前大地,新北市汐止區湖前街,28.5年,大樓,38.28,19.37,4房2廳2衛(含加蓋2房1衛),2樓/11樓,坡道平面車位,1,7602QL,2025-09-25 03:10:09
淡江大富翁稀有高樓層三房淡江大富翁,新北市淡水區水源街二段,13.1年,華廈,31.61,21.5,3房3衛,9樓/9樓,無車位,1,7740YJ,2025-09-25 03:10:09
桂冠邊間三房平面車位百城歡璽-桂冠區,新北市新莊區龍安路,7.8年,大樓,46.22,22.53,3房2廳2衛,10樓/22樓,坡道平面車位,2,5312WR,2025-09-25 03:10:09
揚名三房附車位揚名學園,新北市新莊區中榮街,27.7年,華廈,37.85,24.66,3房2廳2衛,7樓/9樓,坡道機械車位,2,6288ZQ,2025-09-25 03:10:18
龍騰天下四樓大坪數辦公室,新北市新莊區新北大道二段,34.9年,辦公/大樓,167.24,158.66,1室,4樓/15樓,無車位,6,1094NW,2025-09-25 03:10:18
金山清幽優質土地,新北市金山區竹子山腳,,土地,2933.08,,1房1廳1衛1室(含加蓋1房1廳1衛1室),1-1樓/1樓,無車位,2,57155D,2025-09-25 03:10:18
關渡大國挑高店面１＋２樓關渡大國二期,新北市淡水區民族路,28.4年,其它/大樓,25.37,18.73,2房2廳1衛1室(含加蓋2房1室),1-2樓/21樓,無車位,1,36822M,2025-09-25 03:10:18
海山捷運電梯三房蟠龍大地,新北市土城區明德路二段,34.6年,華廈,41.88,36.47,3房2廳2衛,7樓/7樓,無車位,2,4825ZU,2025-09-25 03:10:18
稀有電梯大廠房帶車位,新北市三重區中正北路,34.1年,辦公/廠房,136.6,103.95,3廳1衛3室,2樓/5樓,兩個以上車位,3,1948BT,2025-09-25 03:10:18
獨立權狀坡道機械車位上層四季花園,新北市蘆洲區水湳街,22.0年,單售車位,4.15,0,,--,坡道機械車位,150,4844QB,2025-09-25 03:10:18
【專任】中港傳家金店面,新北市新莊區中港路,55.5年,店面/透天,41.65,38.12,4房6廳3衛(含加蓋2房2廳2衛),1-2樓/2樓,無車位,8,4133ZR,2025-09-25 03:10:18
未來萬大線低總價收租,新北市中和區連城路,49.5年,公寓,13.9,13.9,4房4衛,4樓/4樓,無車位,898,9129GP,2025-09-25 03:10:18
大山圓精美電梯兩房大山圓,新北市汐止區福德二路,30.6年,大樓,13.87,10.23,2房1廳1衛,12樓/14樓,無車位,958,6154CX,2025-09-25 03:10:18
綠中海邊間樹海高樓綠中海1期,新北市新店區安祥路,19.6年,華廈/辦公,36.66,27.58,3房2廳2衛1室,8樓/9樓,無車位,1,3068XG,2025-09-25 03:10:18
文化苑大三房露臺精美裝潢,新北市林口區文化一路一段,9.9年,華廈,96.1,45.97,3房2廳2衛1室,3樓/9樓,兩個以上車位,4,6982CJ,2025-09-25 03:10:18
宏盛景觀裝潢兩房宏盛新世界No1,新北市淡水區沙崙路一段,9.1年,大樓,43.93,21.44,2房2廳2衛,12樓/23樓,坡道平面車位,1,1883ZB,2025-09-25 03:10:18
文化風華３房美裝潢含車位文化風華,新北市板橋區文化路二段,1.3年,大樓,47.19,24.08,3房2廳2衛,6樓/15樓,坡道平面車位,3,5483SM,2025-09-25 03:10:18
