標題,地址,屋齡,類型,建坪,主+陽,格局,樓層,車位,總價(萬),編號,抓取時間
央北）泉泓沐風三房＋車位泉泓沐風,新北市新店區央北一路,1.1年,華廈,47.48,28.18,3房2廳2衛,3樓/7樓,塔式車位,3,9345AY,2025-09-25 02:35:58
【台北桂冠】景觀三房車位歐洲村-台北桂冠...,新北市新莊區立信一街,18.8年,大樓,43.81,26.16,3房2廳2衛,8樓/13樓,坡道平面車位,2,6619FX,2025-09-25 02:35:58
星野之森沐松景觀悠活美屋星野之森-沐松,新北市汐止區新台五路二段,2.8年,大樓,18,11.55,1房1廳1衛,7樓/11樓,無車位,958,0531RX,2025-09-25 02:35:58
⭐皇家天下–高樓邊間皇家天下,新北市汐止區新台五路一段,25.4年,大樓,39.3,28.39,3房2廳2衛,14樓/28樓,無車位,2,3425SS,2025-09-25 02:35:58
長虹大鎮●稀有方正四房長虹大鎮F區,新北市汐止區福德一路,15.9年,華廈,40.17,29.21,4房2廳2衛,5樓/9樓,無車位,2,7924LP,2025-09-25 02:35:58
值得買的觀海極品觀海極品,新北市淡水區民族路,26.7年,廠房/大樓,36.76,33.33,3房2廳2衛,5樓/22樓,無車位,1,0499TY,2025-09-25 02:35:58
面柳堤如意堡帝景挑高豪邸如意堡,新北市蘆洲區光榮路,14.9年,華廈,70.55,31.18,2房4廳2衛2室(含加蓋1廳),7樓/7樓,升降平面車位,5,5154LG,2025-09-25 02:35:58
我住在民族路上文士林,新北市蘆洲區民族路,25.8年,華廈,30.69,26.12,3房2廳2衛1室,5樓/8樓,無車位,1,5400HT,2025-09-25 02:35:58
新巢代三房特別戶新巢代,新北市新店區北宜路二段,21.7年,華廈,31.43,24.7,3房2廳2衛,10樓/10樓,無車位,1,2091WJ,2025-09-25 02:35:58
住宅◆稀有釋出新都悅新都悅,新北市新莊區榮華路二段,8.7年,大樓,40.32,19.63,2房2廳1衛,9樓/19樓,坡道平面車位,2,8629AP,2025-09-25 02:35:58
氧樂多明亮裝潢兩房兩衛浴氧樂多,新北市林口區忠福路,4.2年,華廈,36.55,19.32,2房2廳2衛,4樓/7樓,坡道平面車位,1,5710RM,2025-09-25 02:35:58
莒光國小前後陽台方正２樓,新北市板橋區莒光路,45.0年,公寓,27.09,27.1,3房2廳1.5衛,2樓/5樓,無車位,1,0917AF,2025-09-25 02:36:07
大坪林美三房台北公館,新北市新店區復興路,31.9年,大樓,34.53,30.97,3房2廳2衛1室,10樓/12樓,無車位,2,4947DZ,2025-09-25 02:36:07
四季之旅四房平面車位台北灣五期-四季...,新北市淡水區新市一路一段,8.9年,大樓,66.56,38.21,4房2廳2衛,7樓/18樓,坡道平面車位,1,4742RX,2025-09-25 02:36:07
活力裝潢三房美屋活力城,新北市林口區中山路,17.7年,大樓,49.27,27.8,3房2廳2衛,10樓/15樓,坡道平面車位,1,8991QW,2025-09-25 02:36:07
遠雄左岸近河景霸氣玫瑰園遠雄玫瑰園/遠雄...,新北市中和區中原街,11.9年,大樓,94.68,48.37,4房2廳3衛1室,12樓/24樓,兩個以上車位,5,43462D,2025-09-25 02:36:07
面寬採光亮亮屋,新北市蘆洲區九芎街,36.4年,公寓,35.6,35.61,3房2廳2衛,5樓/5樓,無車位,1,4682AY,2025-09-25 02:36:07
江翠重劃稀有挑高美裝潢江翠ONE-A棟,新北市板橋區華江一路,6.8年,辦公/大樓,30.02,15.15,2房2廳1衛1室(含加蓋2房1室),3樓/19樓,坡道平面車位,1,8316CD,2025-09-25 02:36:07
海山捷運旁｜天京景觀３房天京,新北市土城區明德路二段,27.6年,大樓,37.08,26.6,3房2廳2衛,16樓/21樓,無車位,2,6733AA,2025-09-25 02:36:07
頂溪國小靜巷公寓,新北市永和區文化路,39.0年,公寓,32.7,32.7,3房2廳2衛,4樓/5樓,無車位,1,5060DS,2025-09-25 02:36:07
全天候管理電梯一房凱悅,新北市中和區中正路,29.0年,大樓,21.83,15.75,1房1廳1衛,3樓/23樓,無車位,1,8618KV,2025-09-25 02:36:07
皇家尊榮大四房平面車位皇家天下,新北市汐止區新台五路一段,25.4年,大樓,56.02,32.18,4房2廳2衛,5樓/28樓,坡道平面車位,2,8387LD,2025-09-25 02:36:07
天空之城玻璃美景天空之城,新北市中和區景平路,25.3年,大樓,16.92,12.55,1房1廳1衛,9樓/34樓,無車位,1,8737WG,2025-09-25 02:36:07
永和成功邊間三樓美寓,新北市永和區成功路二段,47.4年,公寓,34.15,34.15,3房2廳1衛,3樓/4樓,無車位,1,5131YW,2025-09-25 02:36:07
專任世界之星簡約裝潢美屋合新世界之星,新北市五股區新城八路,11.9年,大樓,45.04,24.66,2房2廳2衛,8樓/15樓,坡道平面車位,1,3924JR,2025-09-25 02:36:07
稀有華盛頓三房附車位超級城市SUPE...,新北市板橋區莊崑路,7.1年,大樓,39.54,20.22,3房2廳2衛,4樓/15樓,坡道平面車位,2,10764T,2025-09-25 02:36:07
新埔春池雙捷運低總價春池宇宙光,新北市板橋區民生路三段,25.0年,辦公/大樓,30.37,23.65,3房2廳1衛,2樓/31樓,無車位,2,55390M,2025-09-25 02:36:07
合環永新辦公室Ｃ合環永新,新北市新店區永新街,3.5年,辦公/大樓,86.5,46.29,2廳,3樓/14樓,兩個以上車位,5,36042Z,2025-09-25 02:36:07
遠雄新宿近捷運兩房車位遠雄新宿,新北市新莊區新北大道四段,9.5年,大樓,56.32,30.03,2房2廳2衛,12樓/27樓,坡道平面車位,3,0623LW,2025-09-25 02:36:07
綠意陽光旺氣美宅,新北市新店區三民路,43.8年,公寓,35.45,35.45,3房2廳2衛,5樓/5樓,無車位,1,2831DS,2025-09-25 02:36:07
視野採光低總價裝潢美屋富綠旺,新北市新莊區新北大道七段,31.3年,大樓,22.39,17.6,1房2廳1衛,12樓/12樓,無車位,1,1261XS,2025-09-25 02:36:07
［蛇來運轉］昌平四房車位宏福新莊,新北市新莊區昌平街,30.2年,大樓,55.44,28.81,4房2廳2衛,6樓/17樓,坡道平面車位,3,2197XX,2025-09-25 02:36:15
令荷園兩房首購優推令荷園/上河園2,新北市五股區新五路三段,2.2年,大樓,20.97,14.13,2房2廳1衛,8樓/19樓,無車位,1,2281NX,2025-09-25 02:36:15
新埔雙捷運輕裝潢首選春池宇宙光,新北市板橋區民生路三段,25.0年,辦公/大樓,34.66,23.65,3房2廳1衛,2樓/31樓,坡道機械車位,2,2951XS,2025-09-25 02:36:15
洲子洋全新三房車位天空之邑,新北市五股區新五路二段,2.0年,大樓,36.59,17.87,3房2廳2衛,24樓/24樓,坡道平面車位,2,9697RB,2025-09-25 02:36:15
新莊副都心遠雄九五遠雄九五,新北市新莊區新北大道三段,7.6年,辦公/大樓,186.44,89.96,1廳,7樓/42樓,兩個以上車位,11,4882ZV,2025-09-25 02:36:15
㊣海洋都心２‧海景二房海洋都心No2-...,新北市淡水區新市三路二段,7.3年,大樓,37.3,17.83,2房2廳1衛,27樓/29樓,坡道平面車位,1,5248YR,2025-09-25 02:36:15
【海天】樹梢綠景兩房海天,新北市淡水區八勢一街,16.8年,大樓,23.99,16.9,2房2廳1衛,5樓/11樓,無車位,1,1192HX,2025-09-25 02:36:15
佳瑪商圈四房平面車位台北大都心B區,新北市新莊區中平路,30.2年,華廈,51.58,32.76,4房2廳2衛,5樓/9樓,坡道平面車位,2,7273TF,2025-09-25 02:36:15
台信享樂區邊間大兩房車位台信享世代-享樂...,新北市新莊區新樹路,5.6年,大樓,44.11,20.21,2房2廳1衛,7樓/13樓,坡道平面車位,1,1886SM,2025-09-25 02:36:15
ＡＭＡＸ高樓層景觀佳宏普AMAXSO...,新北市新莊區中信街,8.0年,辦公/大樓,44.4,20.42,1廳1衛,22樓/24樓,坡道平面車位,2,8209TQ,2025-09-25 02:36:15
聖塔露琪亞大３房聖塔露琪亞,新北市淡水區淡金路,23.3年,大樓,42.95,32.63,3房2廳2衛,8樓/22樓,無車位,1,5753KC,2025-09-25 02:36:15
新生街～巷寬美３樓,新北市中和區新生街,39.1年,公寓,28.11,28.11,3房2廳2衛,3樓/5樓,無車位,1,7116JW,2025-09-25 02:36:15
春城麗緻明亮大三房春城麗緻,新北市林口區文化二路二段,17.7年,大樓,53.86,31.32,3房2廳2衛,5樓/11樓,坡道平面車位,2,3465KQ,2025-09-25 02:36:15
兒童樂園三房坡平車位兒童樂園,新北市蘆洲區永康街,26.8年,大樓,50.26,28.92,3房2廳2衛,2樓/12樓,坡道平面車位,2,4123XW,2025-09-25 02:36:15
㊣海揚木質調‧２房有車位海揚,新北市淡水區中正東路一段,17.9年,大樓,27.26,15.48,2房1廳1衛,17樓/24樓,坡道平面車位,1,5816DJ,2025-09-25 02:36:15
忠孝綠洲電梯三房車位忠孝綠洲,新北市汐止區樟樹一路,34.2年,華廈,41.14,28.17,3房2廳2衛,5樓/6樓,升降平面車位,1,6889VJ,2025-09-25 02:36:15
近華翠橋方正公寓三樓,新北市板橋區翠華街,46.3年,公寓,25.38,25.38,3房2廳2衛,3樓/4樓,無車位,1,4982FC,2025-09-25 02:36:15
親水景觀兩房車位漾都心,新北市新莊區中華路三段,4.6年,大樓,36.86,18.95,2房2廳1衛,4樓/14樓,塔式車位,2,4309QK,2025-09-25 02:36:15
府中站前好成家兩房站前凱悅,新北市板橋區中山路一段,24.6年,大樓,21.61,15.86,2房1廳1衛,8樓/23樓,無車位,1,2533LY,2025-09-25 02:36:15
稀有【日月光】日月光廣場,新北市土城區中央路二段,7.8年,大樓,45.45,23.47,2房2廳1衛,9樓/26樓,坡道平面車位,2,6537GN,2025-09-25 02:36:15
重陽稀有靚景兩房車位合康達觀,新北市三重區仁義街,17.8年,大樓,32.19,14.06,2房2廳1衛,7樓/15樓,坡道平面車位,2,3263KR,2025-09-25 02:36:24
『薇閣』稀有兩房釋出宏國薇閣,新北市淡水區民生路,30.2年,大樓,22.5,16.15,2房1廳1衛,4樓/16樓,無車位,998,5940YY,2025-09-25 02:36:24
近捷運大房間有車位騰景大第,新北市蘆洲區三民路,30.4年,大樓,43.33,25.81,2房2廳2衛,6樓/14樓,坡道平面車位,2,9299TV,2025-09-25 02:36:24
新林。長耀初Ａ９戶車位,新北市林口區文化三路一段,0.8年,大樓,35.66,18.5,2房2廳2衛,9樓/27樓,坡道平面車位,2,1673JC,2025-09-25 02:36:24
捷運丹鳳建安電梯邊間３房華府,新北市新莊區建安街,33.1年,華廈,38.98,28.51,3房2廳2衛,6樓/7樓,無車位,1,1825VM,2025-09-25 02:36:24
秀朗大空間你值得擁有,新北市永和區秀朗路二段,45.5年,公寓,36.03,36.04,6房4廳3衛(含加蓋2房2廳1衛),5樓/5樓,無車位,1,03269X,2025-09-25 02:36:24
海山捷運樹海電梯四房蟠龍大地,新北市土城區明德路二段,34.6年,華廈,51.41,44.19,4房2廳2衛,4樓/7樓,無車位,2,75400Q,2025-09-25 02:36:24
近十四張低總價成家好宅湯泉美地,新北市新店區溪園路,21.8年,大樓,22.62,16.78,1房1廳1衛1室,7樓/14樓,無車位,1,7614MD,2025-09-25 02:36:24
仁政街華廈６樓大空間,新北市三重區仁政街,30.9年,其它,40.64,37.74,3房2廳2衛,6樓/7樓,無車位,1,2368MN,2025-09-25 02:36:24
修德國小黃金２樓,新北市三重區安慶街,50.4年,公寓,30.09,30.09,2房2廳1衛,2樓/4樓,無車位,1,2362QV,2025-09-25 02:36:24
【當代純品】稀有釋出當代純品,新北市新莊區中平路,25.4年,華廈,45.03,27.23,3房2廳2衛,1樓/8樓,坡道平面車位,2,1799VQ,2025-09-25 02:36:24
晴海稀有庭院兩房車位晴海,新北市淡水區新市一路一段,10.9年,大樓,36.67,18.93,2房2廳1衛,1樓/15樓,坡道平面車位,1,4412XN,2025-09-25 02:36:24
⭐茄苳華城大三房車位⭐茄苳華城,新北市汐止區茄苳路,27.0年,大樓,52.55,38.29,3房2廳2衛1室,14樓/18樓,坡道機械車位,1,5719CU,2025-09-25 02:36:24
近未來捷運美３房,新北市中和區員山路,46.9年,公寓,23.06,23.07,3房2廳1衛,4樓/5樓,無車位,1,1054NB,2025-09-25 02:36:24
輕鬆成家首選宅伯爵山莊建業樓,新北市汐止區康寧街,42.5年,大樓,23.27,19.7,1房2廳1.5衛,4樓/12樓,無車位,860,4988FG,2025-09-25 02:36:24
錦秀低總價小資樂成家,新北市新店區錦秀路,43.8年,公寓,30.28,30.28,3房2廳1衛,5樓/5樓,無車位,698,2404NH,2025-09-25 02:36:24
新青安幸福成家＊電梯兩房綠多鶴,新北市八里區文昌五街,6.1年,大樓,28.67,13.66,2房2廳1衛,10樓/12樓,升降機械車位,990,6766SN,2025-09-25 02:36:24
遠雄ＵＴｏｗｎ－Ｃ棟邊間遠雄Utown-...,新北市汐止區新台五路一段,6.7年,辦公/大樓,153.23,81.38,1廳,13樓/37樓,兩個以上車位,6,9506GS,2025-09-25 02:36:24
遠雄ＵＴｏｗｎ－Ｃ棟朝北遠雄Utown-...,新北市汐止區新台五路一段,6.7年,辦公/大樓,110.24,61.51,1廳,13樓/37樓,坡道平面車位,4,7765LH,2025-09-25 02:36:24
首購好選擇大山圓兩房大山圓,新北市汐止區福德二路,30.6年,大樓/套房,13.87,10.23,2房1廳1衛,14樓/14樓,無車位,850,2573ZU,2025-09-25 02:36:24
永安捷運保平路採光屋,新北市永和區保平路,48.0年,公寓,30.07,30.07,3房2廳2衛,5樓/5樓,無車位,1,9039AV,2025-09-25 02:36:34
府中舒心大空間一樓,新北市板橋區四川路一段,35.3年,華廈,66,54.86,4房2廳2衛,1樓/5樓,無車位,3,7129TR,2025-09-25 02:36:34
福禧臨門電梯３房車位福禧花園生活廣場,新北市土城區永豐路,29.9年,大樓,39.37,25.97,3房2廳2衛,5樓/12樓,坡道平面車位,1,7331AK,2025-09-25 02:36:34
丹麥琥珀品味智能裝潢美學麗寶北歐莊園-丹...,新北市板橋區華江一路,3.1年,辦公/大樓,39.63,17.89,3房2廳1衛,2樓/17樓,坡道平面車位,2,6111QJ,2025-09-25 02:36:34
【城品】稀有四房車位城品,新北市新莊區中和街,33.2年,大樓,72.81,40.18,4房2廳2衛,5樓/16樓,兩個以上車位,2,8595DJ,2025-09-25 02:36:34
頂溪・網溪國小大空間美寓,新北市永和區竹林路,51.2年,公寓,37.84,37.84,4房2廳1.5衛,4樓/4樓,無車位,1,3164UZ,2025-09-25 02:36:34
前後陽台。中島設計師的家年紀青,新北市三重區五谷王北街,6.8年,華廈,34.93,22.87,2房2廳1衛1室,2樓/7樓,塔式車位,2,0467JP,2025-09-25 02:36:34
八德裝潢亮麗兩房,新北市新莊區八德街,50.8年,公寓,24.77,24.78,2房2衛,4樓/4樓,無車位,988,3208MB,2025-09-25 02:36:34
江南大宅兩房車位台北灣六期-江南...,新北市淡水區沙崙路一段,6.6年,大樓,37.79,18.71,2房2廳2衛,12樓/23樓,坡道平面車位,1,5216DH,2025-09-25 02:36:34
近捷運～低公設華廈次高樓,新北市中和區連城路,24.5年,華廈,49.2,34.82,3房2廳2衛,5樓/6樓,坡道平面車位,2,9582PH,2025-09-25 02:36:34
※推薦※幸福思源第一家思源第一家,新北市新莊區中原路,31.3年,華廈,45.16,24.11,2房2廳2衛,7樓/10樓,坡道平面車位,2,7819JY,2025-09-25 02:36:34
幸福學店面辦公皆宜１Ｆ幸福皇居-皇居特...,新北市新莊區福樂街,13.6年,店面/辦公/大樓,55.73,37.75,1廳1衛,1樓/12樓,坡道平面車位,3,4038WT,2025-09-25 02:36:34
晶華大大五房車位晶華二期,新北市新莊區福壽街,25.1年,華廈,73.66,47.87,5房2廳3衛,5樓/9樓,坡道平面車位,3,5981WJ,2025-09-25 02:36:34
誠售青安新店捷運２房大樓TR大道,新北市新店區北宜路一段,23.1年,大樓,19.63,15.12,2房2廳1衛,7樓/14樓,無車位,1,3380JP,2025-09-25 02:36:34
馥都三房車位ａｎｄ露臺,新北市土城區學府路二段,0.6年,大樓,49.1,25.83,3房2廳2衛,2樓/23樓,坡道平面車位,3,5079QR,2025-09-25 02:36:34
環東極品２房車位環東極品,新北市永和區環河東路四段,20.9年,大樓,25.53,16.13,2房2廳1衛,13樓/13樓,坡道機械車位,1,1372AP,2025-09-25 02:36:34
稀有蒲陽高樓２房車位蒲陽．文萃,新北市板橋區長安街,8.8年,大樓,32.55,18.19,2房2廳1衛1室,10樓/15樓,塔式車位,2,0623WZ,2025-09-25 02:36:34
少年家●店面少年家,新北市汐止區樟樹二路,27.8年,店面,22.45,16.75,1衛,1樓/9樓,無車位,1,6891JF,2025-09-25 02:36:34
丹麥琥珀翠綠美屋麗寶北歐莊園-丹...,新北市板橋區華江一路,3.1年,辦公/大樓,39.96,17.89,3房2廳1衛,2樓/17樓,坡道平面車位,2,7168YV,2025-09-25 02:36:34
☆ＧＯＧＯ幸福成家三房歐洲村-紐約GO...,新北市新莊區幸福路,21.5年,大樓,41.51,24.7,3房2廳2衛,3樓/11樓,坡道機械車位,2,4549JZ,2025-09-25 02:36:34
新市鎮美妝大空間起家厝國家新都,新北市淡水區崁頂三路,26.4年,大樓,56.62,29.08,2房2廳2衛,14樓/14樓,坡道平面車位,1,71606Z,2025-09-25 02:36:43
麗寶建設挪威森林邊間兩房麗寶北歐莊園-挪...,新北市板橋區華江八路,4.4年,大樓,40.6,17.83,2房2廳1衛,12樓/13樓,坡道平面車位,2,93396K,2025-09-25 02:36:43
睿暘沁小資宅,新北市三重區神農街,0.7年,套房/華廈,14.33,8.68,1房1廳1衛,6樓/6樓,無車位,1,85581Z,2025-09-25 02:36:43
城易迅兩房＋車位,新北市新店區大豐路,0.7年,大樓,31.24,16.86,2房2廳1衛,3樓/17樓,坡道機械車位,2,86505J,2025-09-25 02:36:43
汐止１０１●高樓景觀２房汐止101,新北市汐止區中興路,9.4年,大樓,27.54,12.59,2房2廳1衛,15樓/15樓,坡道平面車位,1,62361G,2025-09-25 02:36:43
邊間望紅樹林美景海帝,新北市淡水區中正東路一段,15.1年,大樓,92.81,55.5,3房2廳4衛,6樓/27樓,坡道平面車位,4,59483B,2025-09-25 02:36:43
御松院典藏兩房稀有釋出御松院,新北市蘆洲區民族路,19.9年,華廈,31.13,23.29,2房2廳1衛,1樓/8樓,無車位,2,5337WX,2025-09-25 02:36:43
聯邦市場優質店面,新北市新莊區中平路,51.2年,店面,18.69,13.85,1廳1衛,1樓/4樓,無車位,2,9395TR,2025-09-25 02:36:43
【精選】淡水天藝美景高樓天藝,新北市淡水區濱海路二段,9.3年,大樓,104.96,64.97,1廳,26樓/27樓,兩個以上車位,4,3408YN,2025-09-25 02:36:43
ｎｅｗ小城稀有兩房淡水小城,新北市淡水區學府路,30.2年,大樓,19.91,16.6,2房1廳1衛,6樓/17樓,無車位,750,2509RB,2025-09-25 02:36:43
八里昇陽九樂精裝渡假,新北市八里區龍米路一段,12.9年,大樓,31.3,20.59,1房2廳1衛,12樓/26樓,無車位,1,5506ST,2025-09-25 02:36:43
近捷運三和國中心動聯盟５心動聯盟,新北市三重區三和路四段,30.9年,辦公/大樓,41.71,20.37,2房1廳1衛,9樓/13樓,兩個以上車位,2,0239BW,2025-09-25 02:36:43
三井溫馨三房文化逸境文化逸境,新北市林口區忠孝路,19.0年,大樓,39.55,28.56,3房2廳2衛,4樓/13樓,無車位,2,2607YZ,2025-09-25 02:36:43
４房大公寓,新北市新店區建國路,56.1年,公寓,40.62,40.62,4房2廳2衛,3樓/4樓,無車位,1,8338AG,2025-09-25 02:36:43
【主推】樟樹亮麗景觀三房四季晏-A區,新北市汐止區樟樹二路,4.7年,大樓,36.37,16.53,3房2廳1衛,10樓/11樓,塔式車位,2,7576VT,2025-09-25 02:36:43
一樓店面住家＊辦公室皆可,新北市蘆洲區民權路,1.6年,辦公/華廈,45.98,11.72,1廳1衛,1樓/9樓,兩個以上車位,1,5056GL,2025-09-25 02:36:43
安德捷運年代電梯２房捷運年代,新北市新店區安德街,31.0年,大樓,28.08,21.02,2房2廳1衛,11樓/11樓,無車位,1,7335DB,2025-09-25 02:36:43
尚海科技新貴首選溫馨三房尚海,新北市淡水區淡金路,18.1年,大樓,56.59,29.48,3房2廳2衛,6樓/21樓,坡道平面車位,2,9657AS,2025-09-25 02:36:43
中央新村一層一戶平面車位,新北市新店區中央二街,23.3年,華廈,48.66,30.71,5房3廳3衛1室(含加蓋3房1廳1衛1室),5樓/5樓,一樓平面車位,3,8874GQ,2025-09-25 02:36:43
【宏盛水悅】兩房兩廳兩衛宏盛水悅,新北市淡水區新市三路一段,6.6年,大樓,34.24,17.18,2房2廳2衛,5樓/20樓,坡道平面車位,1,6236NN,2025-09-25 02:36:43
永和高樓景觀三房平面車位,新北市永和區成功路一段,3.0年,大樓,45.88,24.25,3房2廳2衛,10樓/11樓,坡道平面車位,2,8956RQ,2025-09-25 02:36:52
集美‧三重站‧重新中興橋歐風名家一,新北市三重區重新路四段,24.9年,大樓,43.56,33.56,3房2廳2衛1室,9樓/14樓,無車位,3,2084MG,2025-09-25 02:36:52
近捷運全新創業首選富品苑富品苑,新北市三重區介壽路,1.7年,辦公/大樓,23.72,15.33,1廳1衛,4樓/12樓,無車位,1,4196ZW,2025-09-25 02:36:52
幸福一方城心金店面一方(城心區),新北市新莊區頭興街,13.4年,店面,23.88,17.98,1廳1衛,1樓/13樓,無車位,2,6305QQ,2025-09-25 02:36:52
福營金雞母、近捷運丹鳳鈴木華城,新北市新莊區福營路,31.4年,店面/辦公,103.48,79.21,5房4廳4衛,1-2樓/10樓,無車位,5,1135UJ,2025-09-25 02:36:52
蘆洲京華天廈三房兩衛車位京華天廈,新北市蘆洲區中正路,35.5年,華廈,56.48,46.98,3房2廳2衛,2樓/9樓,坡道機械車位,2,1652BW,2025-09-25 02:36:52
米蘭公園高樓景觀空間米蘭公園,新北市新莊區中央路,11.1年,辦公/大樓,74.79,30.25,2房2廳2衛,13樓/24樓,兩個以上車位,3,1851UG,2025-09-25 02:36:52
永和活巷面寬大一樓,新北市永和區林森路,50.7年,公寓/店面,27.89,27.89,3房2廳2衛2室(含加蓋2衛),1樓/4樓,無車位,2,7669HT,2025-09-25 02:36:52
翡冷翠三房樹景美屋翡冷翠,新北市淡水區淡金路,16.1年,大樓,49.92,28.6,3房2廳2衛1室,3樓/11樓,坡道平面車位,1,1131QH,2025-09-25 02:36:52
尚海高樓河景精緻裝潢尚海,新北市淡水區淡金路,18.1年,大樓,90.74,43.74,3房2廳2衛1室,19樓/21樓,兩個以上車位,3,6702TV,2025-09-25 02:36:52
【ＶＲ】海帝景致三房車位海帝溫泉大樓,新北市淡水區中正東路一段,15.1年,大樓,92.76,55.43,3房2廳3衛,25樓/27樓,坡道平面車位,4,1111TR,2025-09-25 02:36:52
『天泉』景觀裝潢美屋天泉,新北市八里區龍米路一段,18.4年,大樓,79.21,43.53,3房2廳2衛1室,13樓/29樓,坡道平面車位,3,1503NX,2025-09-25 02:36:52
『主推』八里置產租寶盒,新北市八里區龍形一街,36.3年,公寓,42.83,42.83,4房2廳1衛,3樓/5樓,無車位,1,9389CQ,2025-09-25 02:36:52
巨蛋邊間景觀四房車位巨蛋,新北市板橋區民生路三段,19.0年,大樓,54.58,31.49,4房2廳2衛1室,15樓/37樓,坡道平面車位,2,0708BY,2025-09-25 02:36:52
江山優質景觀兩房兩衛江山萬里,新北市汐止區新台五路二段,28.8年,大樓,25.85,19.18,2房2廳2衛1室,21樓/36樓,無車位,1,7459DD,2025-09-25 02:36:52
★雲境天邸新婚美宅涵煙翠,新北市新店區新坡一街,30.5年,大樓,30.62,24.7,2房2廳1衛,3樓/12樓,無車位,1,9753LP,2025-09-25 02:36:52
精緻˙高樓美景居旭泰城光,新北市中和區中山路二段,7.9年,大樓,20.29,12.55,2房1廳1衛1室(含加蓋1房),10樓/13樓,無車位,1,9839HW,2025-09-25 02:36:52
吉星高照˙機能３樓美寓,新北市中和區員山路,46.9年,公寓,23.25,23.24,2廳1衛,3樓/5樓,無車位,1,2313JG,2025-09-25 02:36:52
屋況美美的一樓,新北市三重區自強路三段,47.2年,公寓,23.9,19.36,3房2廳2衛,1樓/5樓,無車位,1,1994HN,2025-09-25 02:36:52
小資首購低總價３房台北圓山,新北市泰山區泰林路二段,28.8年,大樓,31.41,24.41,3房2廳2衛,9樓/12樓,無車位,1,4751XR,2025-09-25 02:36:52
冠德鼎峰三房車位冠德鼎峰,新北市新莊區中原東路,11.8年,大樓,79.92,36.42,3房2廳2衛,16樓/25樓,兩個以上車位,4,9723RT,2025-09-25 02:37:02
永安捷運站前儷晶典藏站前儷晶,新北市中和區中和路,25.0年,辦公/大樓,25.96,21.1,2房2廳1衛,9樓/11樓,無車位,2,9064GY,2025-09-25 02:37:02
環堤邊間景觀佳四房車位觀山河畔,新北市蘆洲區長安街,29.4年,華廈,51.8,36.22,4房2廳2衛,6樓/8樓,坡道平面車位,2,0223DW,2025-09-25 02:37:02
捷運～捷洋天湛河景戶捷洋天湛,新北市永和區環河西路一段,11.7年,大樓,63.29,39.44,4房2廳2衛,13樓/20樓,無車位,4,6281XT,2025-09-25 02:37:02
湯泉二期溫馨三房車位湯泉美地,新北市新店區溪園路,21.8年,大樓,42.11,27.05,3房2廳2衛,7樓/14樓,坡道平面車位,2,0759BT,2025-09-25 02:37:02
正隆●高樓明亮●四房車位正隆廣場,新北市板橋區民生路一段,30.8年,大樓,67.84,48.6,4房2廳2衛,21樓/25樓,坡道機械車位,3,9384JC,2025-09-25 02:37:02
優質摩登低總高樓景觀摩登大國,新北市中和區中正路,28.9年,大樓,10.32,9.33,1房1廳1衛,11樓/22樓,無車位,798,8621FP,2025-09-25 02:37:02
百順客‧永安捷運大器辦公百順客,新北市永和區中和路,29.3年,辦公/大樓,102.15,72.32,1廳1衛,3樓/15樓,兩個以上車位,5,3824LZ,2025-09-25 02:37:02
冠德後棟三房坡平車位冠德住易,新北市中和區景德街,27.9年,大樓,41.59,22.97,3房2廳1.5衛,9樓/25樓,坡道平面車位,2,8906DZ,2025-09-25 02:37:02
稀有忠承豪美大兩房忠承新都六期,新北市新莊區中榮街,17.6年,華廈,27.87,18.51,2房2廳1衛,2樓/7樓,無車位,1,4750RP,2025-09-25 02:37:02
輕裝潢方正電梯兩房,新北市中和區和平路,29.8年,華廈,22.44,20.32,2房2廳1衛,7樓/7樓,無車位,1,1474SF,2025-09-25 02:37:02
近家樂福柏悅金店辦收租寶合康柏悅,新北市三重區集仁街,14.4年,店面,55.21,21.17,1房1廳1衛,1樓/13樓,兩個以上車位,3,9349UL,2025-09-25 02:37:02
南加州首選精緻裝潢南加州,新北市淡水區民權路,16.8年,其它/大樓,15.84,10.28,1房2廳1衛(含加蓋1房),11樓/24樓,無車位,868,8138XM,2025-09-25 02:37:02
仁愛路乾淨漂亮大３房,新北市土城區仁愛路,44.8年,公寓,39.44,39.44,3房2廳3衛,4樓/5樓,無車位,1,6818RK,2025-09-25 02:37:02
富貴商圈富貴裝潢三房富貴天下,新北市新莊區富國路,31.8年,大樓,33.66,24.34,3房2廳2衛,12樓/12樓,無車位,1,8829KK,2025-09-25 02:37:02
湯泉邊間景觀３房,新北市中和區員山路,0.7年,華廈,29.77,18.87,3房2廳1衛,6樓/7樓,無車位,1,7348YJ,2025-09-25 02:37:02
合康新時代加車位合康新時代,新北市新莊區福前街,11.8年,大樓,28.54,12.98,1房1廳1衛,5樓/14樓,坡道機械車位,1,9164SC,2025-09-25 02:37:02
田園芳鄰稀有裝潢成家首選田園芳鄰,新北市淡水區北新路,32.5年,大樓,22.25,17.35,2房2廳1衛,16樓/16樓,無車位,1,9115FN,2025-09-25 02:37:02
紅樹林聖塔成家首選聖塔露琪亞,新北市淡水區淡金路,23.3年,大樓,23.43,17.81,1房2廳1衛1室,6樓/22樓,無車位,1,8963RB,2025-09-25 02:37:02
ＷＯＮＥ遠眺天海景觀兩房宏錦WONE,新北市林口區民族路,7.2年,大樓,36.35,16.53,2房2廳1衛,21樓/26樓,坡道平面車位,2,4598GY,2025-09-25 02:37:02
統領星鑽高樓美屋,新北市永和區中正路,34.5年,大樓,38.11,31.66,1房2廳1衛,11樓/11樓,無車位,3,6882FD,2025-09-25 02:37:12
麗池花園廣場４房坡平車位麗池花園廣場,新北市板橋區篤行路一段,18.5年,大樓,48.07,26.89,4房2廳2衛,2樓/13樓,坡道平面車位,2,2896BL,2025-09-25 02:37:12
大學京都➤景觀三房➤圓夢大學京都(遠雄京...,新北市樹林區學成路,15.5年,大樓,85.21,40.97,4房2廳2衛,19樓/19樓,兩個以上車位,3,42411L,2025-09-25 02:37:12
