標題,地址,屋齡,類型,建坪,主+陽,格局,樓層,車位,總價(萬),編號,抓取時間
近捷運松江敦華四房大戶松江敦華,台北市中山區建國北路二段,15.0年,大樓,86.73,38.87,4房2廳2衛,2樓/15樓,兩個以上車位,6,46103R,2025-10-06 01:33:08
大中正古亭金店面泊樂,台北市中正區廈門街,9.0年,店面/辦公/大樓,31.66,11.85,1廳1衛,1樓/11樓,塔式車位,3,3309DP,2025-10-06 01:33:08
☆中山國小芳鄰電梯２房,台北市中山區新生北路三段,38.7年,華廈,24.8,18.52,2房2廳1衛,5樓/8樓,無車位,2,4908XZ,2025-10-06 01:33:08
東區洽談整合潮牌金店羅馬儷都-B棟,台北市大安區忠孝東路四段,39.1年,店面/辦公,20.32,14.66,1廳2衛(含加蓋1衛),1樓/6樓,無車位,6,8894QC,2025-10-06 01:33:08
東區整合洽談中潮牌金店羅馬儷都-B棟,台北市大安區忠孝東路四段,39.1年,店面/辦公,17.35,15.74,1廳1衛,1樓/6樓,無車位,6,5239RX,2025-10-06 01:33:08
大空間傳家黃金好屋,台北市中山區農安街,49.3年,華廈,64.44,57.77,6房1廳6衛,3樓/10樓,無車位,3,8316BZ,2025-10-06 01:33:08
景美溪河畔電梯車位宅長堤二重奏,台北市文山區樟新街,28.7年,華廈,24.3,13.64,2房2廳1衛(含加蓋1房),3樓/7樓,坡道機械車位,1,4726CD,2025-10-06 01:33:08
巨蛋機能八德路邊間金店面龍苑,台北市松山區八德路三段,39.0年,店面,37.4,9.38,2廳1衛1室(含加蓋0.5衛),B1-1樓/12樓,無車位,3,3120GU,2025-10-06 01:33:08
【精選】中山正章明亮華廈,台北市中山區新生北路二段,47.5年,其它/辦公,13.59,12.1,1房1廳1衛,4樓/7樓,無車位,1,7526YN,2025-10-06 01:33:08
天母品味一樓庭院美宅,台北市士林區中山北路七段,39.7年,華廈/辦公,86.7,37.93,2房2廳2衛1室,B1-1樓/7樓,無車位,4,8275AF,2025-10-06 01:33:08
誠售文普高樓景觀氣派辦公文普世紀天廈,台北市信義區基隆路二段,28.6年,辦公/大樓,21.5,11.96,1廳,14樓/21樓,坡道機械車位,1,2454LV,2025-10-06 01:33:08
【三民美寓】正面學校美景,台北市松山區三民路,50.3年,公寓,38.64,38.63,4房2廳2衛1室,4樓/4樓,無車位,3,0661XB,2025-10-06 01:33:08
近馬偕高樓層兩房可住可辦,台北市中山區民生東路一段,47.3年,大樓,21.08,15.46,2房1廳1衛,9樓/12樓,無車位,1,5424SD,2025-10-06 01:33:08
【稀有】大安區方．正２房,台北市大安區樂利路,58.3年,公寓,11.82,11.82,2房2廳1衛,2樓/4樓,無車位,1,8716YU,2025-10-06 01:33:08
福華廣場邊間辦公福華廣場,台北市內湖區民權東路六段,25.9年,辦公/大樓,42.76,25.74,1廳1室,6樓/12樓,無車位,2,1547FC,2025-10-06 01:33:08
建國北稀有小坪數高樓純辦時春大樓,台北市中山區建國北路二段,43.3年,辦公/大樓,24.22,17.34,2房1廳,8樓/14樓,無車位,2,6434QD,2025-10-06 01:33:18
國語實小精裝３房美寓,台北市中正區和平西路二段,46.5年,公寓,21.81,20.06,3房2廳2衛,5樓/5樓,無車位,2,1102BQ,2025-10-06 01:33:18
葉綠素景觀美宅葉綠素,台北市文山區萬壽路,17.4年,華廈,55.24,34.69,4房2廳3衛1室,4樓/5樓,坡道機械車位,3,6871HN,2025-10-06 01:33:18
低總價民生撫遠靜巷孝親宅,台北市松山區撫遠街,51.5年,公寓,26.71,26.71,3房2廳1衛,2樓/4樓,無車位,1,3662YY,2025-10-06 01:33:18
政大低總價精緻美套房政大資優生,台北市文山區萬壽路,18.0年,華廈,12.77,5.8,1房1衛,1樓/5樓,升降機械車位,988,8085LL,2025-10-06 01:33:18
明曜百貨忠敦捷運電梯２房,台北市大安區忠孝東路四段,49.5年,華廈/辦公,25.73,25.73,2房2廳2衛1室,3樓/7樓,無車位,3,8643XH,2025-10-06 01:33:18
正捷運收租投資辦公萬隆NO4,台北市文山區羅斯福路五段,13.9年,辦公,161.76,111.94,1廳1室,2樓/9樓,無車位,13,72074D,2025-10-06 01:33:18
萬芳大樓整層７７２坪收租,台北市文山區萬和街,28.5年,辦公/套房/大樓,772.71,561.38,45房1廳45衛11室,12樓/12樓,無車位,36,3195XL,2025-10-06 01:33:18
世紀之光,台北市內湖區瑞湖街,17.6年,辦公/廠房,103.95,47.25,1廳,4樓/5樓,兩個以上車位,4,2583VG,2025-10-06 01:33:18
近華山置產兩套房,台北市中山區新生北路一段,47.0年,大樓,17.72,13.95,2房1廳2衛,2樓/12樓,無車位,1,95055U,2025-10-06 01:33:18
甲第名宮★安和高樓美景甲第名宮,台北市大安區信義路四段,42.9年,大樓,81.44,57.01,4房2廳3.5衛,15樓/15樓,坡道平面車位,7,95758L,2025-10-06 01:33:18
金華國中大土持公寓,台北市中正區臨沂街,57.0年,公寓,45.6,45.6,4房2廳2衛,2樓/4樓,無車位,4,78420Y,2025-10-06 01:33:18
市場寬店面投資置產首選,台北市北投區知行路,46.7年,店面/辦公,31.43,27.23,2廳1衛1室(含加蓋1室),1樓/5樓,無車位,2,05462T,2025-10-06 01:33:18
捷運★羅斯福美寓,台北市大安區羅斯福路三段,58.8年,公寓,37.26,36.6,4房4衛(含加蓋1房1衛),4樓/4樓,無車位,3,25511T,2025-10-06 01:33:18
《請進劍潭》近公園美華廈,台北市士林區劍潭路,39.7年,華廈,40.11,33.9,3房2廳3衛,6樓/7樓,無車位,3,4469NS,2025-10-06 01:33:18
信義觀天方正四房,台北市信義區吳興街,31.6年,大樓,43.71,38.28,4房2廳2衛,2樓/17樓,無車位,3,2340LS,2025-10-06 01:33:18
文化華岡☆收租美寓,台北市士林區格致路,40.8年,公寓,34.56,32.98,8房1廳4衛1室(含加蓋3房2衛1室),5樓/5樓,無車位,1,0010GH,2025-10-06 01:33:18
古亭和平三青師大名邸,台北市大安區和平東路一段,40.7年,大樓,33.45,29.11,3房2廳2衛,6樓/12樓,無車位,4,0599GD,2025-10-06 01:33:18
華爾道夫露臺稀有小坪數華爾道夫一期,台北市中山區長春路,20.4年,大樓,60.09,26.6,2房2廳2衛1室(含加蓋1室),2樓/14樓,兩個以上車位,6,2440UB,2025-10-06 01:33:18
泰順溫州邊間採光三房,台北市大安區泰順街,42.6年,公寓,35.64,31.89,3房2廳2衛,5樓/5樓,無車位,2,7018CG,2025-10-06 01:33:18
第一次～距離靜心這麼近ෆ,台北市文山區景華街,54.2年,公寓,38.02,38.01,4房2廳2衛,4樓/4樓,無車位,2,7474KC,2025-10-06 01:33:27
捷運中山國小吉品美屋,台北市中山區新生北路三段,48.7年,公寓,22.79,22.79,3房2廳1衛,5樓/5樓,無車位,1,7964BY,2025-10-06 01:33:27
裝潢機能便捷小宅,台北市內湖區安康路,48.7年,公寓,29.3,29.3,3房2廳2衛1室,3樓/4樓,無車位,1,0210AX,2025-10-06 01:33:27
民生介壽設籍低總好幫手,台北市松山區民生東路五段,8.1年,華廈,18.37,10.48,1房1廳1衛,2樓/7樓,無車位,2,1522DV,2025-10-06 01:33:27
主推＊忠孝１６２小豪邸,台北市中正區忠孝東路一段,6.2年,大樓,17.16,10.59,1房1廳1衛,6樓/13樓,無車位,2,6134LL,2025-10-06 01:33:27
興安國宅南棟高樓３房興安國宅南棟,台北市中山區復興北路,39.4年,大樓,29.78,23.38,3房2廳1衛,10樓/14樓,無車位,2,0930PX,2025-10-06 01:33:27
專任捷運美妝靈活大空間,台北市松山區八德路四段,46.6年,公寓,23.67,23.68,6房2廳4衛(含加蓋3房3衛),5樓/5樓,無車位,2,7236PY,2025-10-06 01:33:27
買黑土等改建˙仁愛康莊康莊大廈,台北市大安區仁愛路三段,44.7年,其它,103.17,0,7房1廳1衛2室,-1樓/12樓,無車位,8,3605MM,2025-10-06 01:33:27
近捷運稀有兩房低總價美寓,台北市信義區崇德街,53.3年,公寓,14.34,14.34,2房2廳1衛1室,3樓/4樓,無車位,1,7825ZV,2025-10-06 01:33:27
中正學區優質寓邸,台北市中正區寧波西街,49.1年,公寓,32.27,32.28,3房2廳1衛,4樓/5樓,無車位,3,1549FN,2025-10-06 01:33:27
新生國小美巷黃金３樓,台北市大安區永康街,42.7年,公寓,25.38,22.56,2房2廳1.5衛,3樓/5樓,無車位,2,1502GC,2025-10-06 01:33:27
民生川普芳鄰住辦,台北市中山區民生東路三段,29.7年,華廈/辦公,17.14,12.02,1廳1衛,3樓/9樓,無車位,1,2707QM,2025-10-06 01:33:27
⭐和興路黃金貳樓,台北市文山區和興路,45.7年,公寓,33.34,33.33,3房2廳1衛,2樓/5樓,無車位,1,1349ZK,2025-10-06 01:33:27
公園大院方正三房,台北市北投區中和街,1.2年,大樓,35.97,22.74,3房2廳2衛,3樓/14樓,塔式車位,2,4001SG,2025-10-06 01:33:27
新碩文曲１３樓之２,台北市大同區重慶北路二段,0.4年,大樓,18.15,12.3,2房2廳1衛,13樓/15樓,無車位,2,0807UB,2025-10-06 01:33:27
加瑪科技１４９附４車位,台北市內湖區內湖路一段,27.0年,辦公,195.21,106.9,1廳12室,6樓/10樓,兩個以上車位,12,87833T,2025-10-06 01:33:27
敦南安和富裕金店雙橡園,台北市大安區敦化南路二段,43.8年,店面/辦公,78.36,58.03,1廳2衛2室,1樓/7樓,無車位,15,90952H,2025-10-06 01:33:27
石牌漂亮大三房,台北市北投區尊賢街,40.8年,公寓,35.96,32.92,3房2廳2衛,5樓/5樓,無車位,2,52085W,2025-10-06 01:33:27
台大公館面寬金店,台北市中正區汀州路三段,45.8年,店面,43.04,23.86,1廳,1樓/7樓,無車位,13,76552B,2025-10-06 01:33:27
一層一戶黃金３樓大間美寓,台北市文山區興隆路一段,48.2年,公寓,43.6,43.6,3房2廳2衛,3樓/5樓,無車位,2,43701G,2025-10-06 01:33:27
北投稀有公寓三樓,台北市北投區溫泉路,50.1年,公寓,28.31,28.31,2房2廳1衛,3樓/4樓,無車位,1,0805CC,2025-10-06 01:33:35
大安路面寬超級金店仁愛華廈,台北市大安區大安路一段,49.7年,店面,29.02,15.48,2廳1衛2室(含加蓋1廳2室),1樓/7樓,無車位,7,7962QY,2025-10-06 01:33:35
龍安國小對面三樓美寓,台北市大安區新生南路三段,57.7年,公寓,30.66,30.1,3房2廳1衛,3樓/4樓,無車位,3,0420PN,2025-10-06 01:33:35
森林公園金華附小電梯４房,台北市大安區瑞安街,26.9年,華廈,49.31,32.72,4房2廳2衛,3樓/5樓,升降機械車位,5,1526LS,2025-10-06 01:33:35
近中山國小捷運高挑金店辦,台北市中山區雙城街,5.8年,店面/辦公/大樓,24.2,16.02,1廳1衛,1樓/18樓,無車位,3,8215YS,2025-10-06 01:33:35
士林國中綠景３房珠寶盒,台北市士林區中正路,44.7年,公寓/辦公,30.28,30.29,3房2廳2衛,3樓/5樓,無車位,2,8901WT,2025-10-06 01:33:35
復興中小學芳鄰三房美廈,台北市大安區復興南路一段,48.3年,華廈,36.71,31.88,3房2廳2衛1室,4樓/7樓,無車位,4,4340LV,2025-10-06 01:33:35
更新釋出空間好規劃更新大樓,台北市松山區八德路四段,37.2年,店面,36.79,17.74,1廳1衛,2樓/12樓,無車位,2,4846QR,2025-10-06 01:33:35
【新案】西門商三電梯４房,台北市萬華區開封街二段,38.4年,華廈/辦公,37.76,29.25,4房2廳2衛,2樓/9樓,無車位,2,8791AU,2025-10-06 01:33:35
民權國小旁方正雅寓,台北市松山區新東街,42.3年,公寓,35.44,33.49,3房2廳2衛1室,4樓/5樓,無車位,2,6326FR,2025-10-06 01:33:35
邊間大空間亮眼美寓,台北市文山區興隆路二段,56.4年,公寓,31.17,31.17,5房4廳3衛1室(含加蓋2房2廳1衛),4樓/4樓,無車位,2,8973CU,2025-10-06 01:33:35
靚靚邊間加乘美宅,台北市文山區興隆路二段,47.8年,公寓,34.71,31.88,4房2廳2衛(含加蓋1房1衛),4樓/4樓,無車位,1,6484LY,2025-10-06 01:33:35
靜心特區四面採光好屋,台北市文山區景豐街,50.7年,公寓,45.83,45.84,7房4廳3衛(含加蓋3房2廳1衛),4樓/4樓,無車位,2,6109JC,2025-10-06 01:33:35
大陸營造鋼骨邊間小豪宅W110,台北市信義區光復南路,17.1年,大樓,28.88,18.99,1房1廳1衛1室,6樓/18樓,無車位,3,0801GU,2025-10-06 01:33:35
風和日麗☆四房美寓２樓,台北市南港區研究院路三段,34.7年,公寓,47.55,41.87,4房2廳2衛,2樓/3樓,無車位,2,9195MS,2025-10-06 01:33:35
北士科＊大邊間低樓層,台北市北投區承德路七段,51.8年,公寓,28.42,28.42,2房2廳1衛,3樓/4樓,無車位,1,1524NZ,2025-10-06 01:33:35
南海逸園近廈安捷運站店面新第來亨,台北市萬華區莒光路,37.6年,店面/華廈,20.38,16.64,2房2廳1衛1室(含加蓋1室),1樓/7樓,無車位,2,7404DH,2025-10-06 01:33:35
近捷運美妝彩光一樓,台北市北投區中央北路三段,43.5年,公寓,34.4,31.43,4房2廳1衛1室,1樓/5樓,無車位,2,3113BU,2025-10-06 01:33:35
公舘路乾淨採光一樓,台北市北投區公館路,39.4年,公寓,27.8,22.7,3房2廳2衛,1樓/5樓,無車位,2,7818CT,2025-10-06 01:33:35
新美齊心居美屋新美齊心居,台北市南港區重陽路,2.7年,大樓,15.07,9.81,1房1廳1衛,7樓/12樓,無車位,2,4663XU,2025-10-06 01:33:35
市府捷運電梯方正２房,台北市信義區永吉路,14.2年,華廈,30.61,13.02,2房1廳1衛1室,3樓/8樓,升降機械車位,2,8199QR,2025-10-06 01:33:44
北士科李天鐸設計大樓昭揚天際,台北市北投區承德路七段,1.3年,大樓,71.35,38.34,3房2廳2衛,6樓/19樓,坡道平面車位,6,5661BZ,2025-10-06 01:33:44
世貿龍庭一樓庭院戶,台北市信義區吳興街,33.0年,華廈,52.97,35.15,3房2廳2衛,1樓/5樓,坡道平面車位,3,5063ZR,2025-10-06 01:33:44
利來華府●近捷運電梯兩房,台北市信義區基隆路二段,43.9年,大樓,23.42,19.83,2房2廳1衛,8樓/12樓,無車位,3,0631PR,2025-10-06 01:33:44
朗朗台大⭐三角窗金店面,台北市大安區新生南路三段,1.2年,店面,40.15,18.58,1廳1衛,1樓/12樓,坡道平面車位,6,2560FT,2025-10-06 01:33:44
劍潭捷運方正３樓珠寶盒,台北市士林區承德路四段,54.5年,公寓,33.51,33.51,3房2廳2衛1室,3樓/4樓,無車位,2,7308VP,2025-10-06 01:33:44
金華龍門溫馨美頂加,台北市大安區泰順街,60.0年,公寓,35.2,31.46,2房3廳2衛1室(含加蓋1廳),4樓/4樓,無車位,3,0268DM,2025-10-06 01:33:44
可看屋！遠企高樓邊間四房,台北市大安區和平東路三段,41.6年,大樓,49.98,46.78,4房2廳3衛,9樓/12樓,無車位,4,0306TL,2025-10-06 01:33:44
《請進天母》林園之中林園山莊-鴻福樓,台北市士林區中山北路七段,40.2年,華廈,47.64,34.27,2房2廳2衛,2樓/6樓,無車位,3,0170QC,2025-10-06 01:33:44
金龍師大空間美寓,台北市大安區泰順街,48.5年,公寓,52.91,52.91,4房2廳2衛,3樓/5樓,無車位,4,6562SK,2025-10-06 01:33:44
【新接】近捷運靜巷三樓,台北市大安區樂業街,48.6年,公寓,32.4,32.4,3房2廳2衛,3樓/4樓,無車位,2,2251AS,2025-10-06 01:33:44
★敦南大空間綠意美寓★,台北市大安區四維路,50.8年,公寓,27.48,27.48,3房3廳2衛(含加蓋1房1廳1衛),4樓/4樓,無車位,3,2966BP,2025-10-06 01:33:44
近石牌國中小明亮３房,台北市北投區致遠一路二段,42.5年,公寓,36.5,33.24,3房2廳2衛,4樓/5樓,無車位,2,9123UT,2025-10-06 01:33:44
芝山捷運站大空間公寓３樓,台北市士林區中山北路五段,47.8年,公寓,39.62,39.62,4房2廳1.5衛,3樓/4樓,無車位,2,1563GV,2025-10-06 01:33:44
富陽華廈●電梯方正三房,台北市信義區富陽街,43.3年,華廈,37.11,32.8,3房2廳2衛,5樓/7樓,無車位,3,5706SU,2025-10-06 01:33:44
內湖捷運１樓置產好旺宅,台北市內湖區內湖路二段,47.9年,公寓,30.84,27.11,6房6衛,1樓/4樓,無車位,3,3817BX,2025-10-06 01:33:44
安和公寓近捷運土地持份大,台北市大安區安和路一段,41.7年,公寓,44.46,38.88,6房3廳3衛1室(含加蓋2房1廳1衛1室),5樓/5樓,無車位,4,2594VF,2025-10-06 01:33:44
稀有⭐廣慈⭐雙衛⭐三房,台北市信義區福德街,47.4年,公寓,22.79,20.74,3房2廳2衛,4樓/4樓,無車位,1,4056PT,2025-10-06 01:33:44
稀有★敦南精品★邊間,台北市大安區四維路,39.9年,華廈,37.55,34.7,3房2廳2衛,4樓/6樓,無車位,3,4626HC,2025-10-06 01:33:44
再興中學住店一樓,台北市文山區木柵路二段,56.9年,公寓/店面,28.94,28.94,2房2廳2衛,1樓/3樓,無車位,2,9008FF,2025-10-06 01:33:44
★新接★師大三房美屋,台北市大安區師大路,41.8年,華廈,38.47,30.12,3房2廳1衛,6樓/7樓,無車位,4,3775WD,2025-10-06 01:33:53
麗水新生電梯美景,台北市大安區麗水街,54.3年,華廈,53.62,53.63,4房2廳2衛(含加蓋1廳),4樓/7樓,無車位,5,5492BZ,2025-10-06 01:33:53
⭐正馬路公寓⭐屋況優,台北市南港區舊莊街一段,52.0年,公寓,31.35,31.36,3房2廳1衛,2樓/4樓,無車位,1,4921BT,2025-10-06 01:33:53
⭐正面三越．珍稀面寬住辦,台北市中正區館前路,48.7年,大樓/辦公,18.68,14.39,1廳1衛,4樓/12樓,無車位,1,7907WQ,2025-10-06 01:33:53
新東撫遠商圈一樓大空間,台北市松山區新東街,51.4年,公寓,29.56,29.56,5房2廳2衛(含加蓋1房1衛),1樓/4樓,無車位,3,4743RH,2025-10-06 01:33:53
四期全新成屋２房平面車位,台北市內湖區成功路二段,3.4年,大樓,51.47,24.93,2房2廳1衛,6樓/11樓,坡道平面車位,3,0310CD,2025-10-06 01:33:53
約克國際指名度高,台北市內湖區行愛路,17.0年,辦公/廠房,118.98,55.84,1廳7室,2樓/8樓,兩個以上車位,6,5936HW,2025-10-06 01:33:53
台電大樓捷運－四房收租宅龍泉華廈,台北市大安區師大路,47.0年,華廈,33.51,29,4房4衛,6樓/7樓,無車位,3,3296PQ,2025-10-06 01:33:53
內湖麗山１樓綠景３房,台北市內湖區環山路三段,44.8年,公寓,35.86,27.19,3房2廳2衛,1樓/5樓,無車位,2,7049DT,2025-10-06 01:33:53
稀有高投報大樓首選,台北市中山區林森北路,41.1年,辦公/大樓,17.55,12.94,1廳,9樓/13樓,無車位,1,3283CG,2025-10-06 01:33:53
【新接】北醫公寓三樓,台北市信義區吳興街,40.2年,公寓,35.37,32.15,3房2廳2衛1室,3樓/5樓,無車位,2,4355ND,2025-10-06 01:33:53
正忠孝東路樹影搖曳二樓,台北市信義區忠孝東路五段,53.3年,公寓,23.88,23.88,2房2廳2衛1室,2樓/4樓,無車位,2,3355AN,2025-10-06 01:33:53
河景．大直儒園大直儒園,台北市中山區明水路,30.6年,華廈,71.7,46.3,4房2廳2衛,4樓/7樓,升降平面車位,5,1754TQ,2025-10-06 01:33:53
✿萬芳捷運旁大坪數美寓✿,台北市文山區興隆路三段,45.7年,公寓,32.77,32.77,3房2廳2衛,4樓/5樓,無車位,2,5008CN,2025-10-06 01:33:53
新案★青田街靜巷綠蔭華廈,台北市大安區青田街,54.6年,華廈,55.47,55.47,4房2廳2衛,4樓/6樓,無車位,6,2519ZV,2025-10-06 01:33:53
新生金華修德園電梯三房修德園大廈,台北市大安區和平東路一段,47.2年,大樓,41.47,36.91,3房2廳2衛,9樓/12樓,無車位,4,1311YU,2025-10-06 01:33:53
文青一隅邊間奇遇,台北市信義區忠孝東路四段,31.2年,華廈,43.72,24.74,3房2廳2衛1室,2樓/7樓,無車位,4,4189XB,2025-10-06 01:33:53
【地標型店辦】珍稀釋出,台北市大安區和平東路二段,47.5年,店面/辦公/大樓,70.03,61.12,2廳2衛3室(含加蓋1衛),2樓/11樓,無車位,8,6407PQ,2025-10-06 01:33:53
市中心公園小築,台北市中山區新生北路一段,44.8年,大樓,17.22,14.26,1房1衛,9樓/12樓,無車位,1,1750VD,2025-10-06 01:33:53
家樂福捷運公園機能小品,台北市大同區歸綏街,46.1年,套房/華廈,8.15,5.63,1房1廳1衛,8樓/10樓,無車位,758,8457YL,2025-10-06 01:33:53
大稻埕溫馨三房華廈,台北市大同區西寧北路,40.5年,華廈,36.7,35.06,3房2廳2衛,2樓/7樓,無車位,2,9969QK,2025-10-06 01:34:02
稀有高樓露臺★採光二房,台北市中山區龍江路,1.4年,華廈,33.88,16.21,2房2廳1衛,9樓/9樓,塔式車位,4,5831XM,2025-10-06 01:34:02
古亭高樓電梯３房惠安同福,台北市中正區羅斯福路二段,43.3年,大樓,37.74,30.37,3房2廳2衛,10樓/12樓,無車位,3,9347YU,2025-10-06 01:34:02
博愛學區邊間四房公寓,台北市信義區信義路六段,44.7年,公寓,42.76,42.76,4房2廳2衛,2樓/5樓,無車位,3,9041JP,2025-10-06 01:34:02
稀有店辦創業首選敦品(辛亥路四段...,台北市文山區辛亥路四段,23.4年,店面,12.2,9.49,1房1廳1衛,1樓/14樓,無車位,1,4210CJ,2025-10-06 01:34:02
逸仙雅仕多空間高樓逸仙雅仕,台北市信義區光復南路,24.9年,其它,20.92,14.61,3房2廳1衛1室(含加蓋1房1室),13樓/13樓,無車位,2,6278XF,2025-10-06 01:34:02
陽光花束文德捷運三房,台北市內湖區陽光街,42.3年,公寓,24.79,24.79,3房2廳1.5衛1室,4樓/5樓,無車位,2,77645D,2025-10-06 01:34:02
福華商業廣場我要發辦公福華廣場,台北市內湖區民權東路六段,25.9年,辦公/大樓,65.8,39.2,2廳,5樓/12樓,無車位,4,86989E,2025-10-06 01:34:02
專約新光三越邊間華廈２房天母華琪-愛座,台北市士林區天母東路,47.5年,華廈,22.05,19.55,2房1廳1衛,5樓/8樓,無車位,1,6995UH,2025-10-06 01:34:02
加瑪科技２２２附７車位,台北市內湖區內湖路一段,27.0年,辦公,301.3,158.95,2廳14室,6樓/10樓,兩個以上車位,18,9911RN,2025-10-06 01:34:02
美宅屋況★新世界★１０１新世界,台北市信義區松勤街,17.8年,大樓,15.71,10.21,1房1廳1衛,6樓/19樓,無車位,2,15167K,2025-10-06 01:34:02
【大直香榭Ａ２】,台北市內湖區文湖街,9.6年,華廈,44.19,23.4,3房2廳2衛,2樓/7樓,無車位,2,20658L,2025-10-06 01:34:02
綠意新川普２房新川普,台北市信義區信義路五段,16.3年,辦公/大樓,36.68,15.52,2房1廳1衛,2樓/19樓,兩個以上車位,3,68964P,2025-10-06 01:34:02
京宴高樓精裝美宅,台北市中山區林森北路,22.7年,大樓,14.74,9.91,1房1衛,10樓/14樓,無車位,1,5700DH,2025-10-06 01:34:02
馥邑捷運靜巷１樓民權馥邑,台北市松山區民權東路三段,40.6年,華廈/辦公,31.65,21.71,4房1廳1衛1室,1樓/7樓,無車位,3,7994YP,2025-10-06 01:34:02
景美新電梯河岸高樓露臺戶,台北市文山區景興路,5.7年,大樓,36.41,13.9,2房1廳1衛,14樓/27樓,兩個以上車位,2,5175PF,2025-10-06 01:34:02
中山北路上。時代會館時代會館,台北市中山區中山北路一段,24.4年,辦公/華廈,8.82,5.41,1廳1衛1室(含加蓋1室),8樓/10樓,無車位,1,5695RV,2025-10-06 01:34:02
芝玉●朝南邊間３樓,台北市士林區芝玉路二段,39.3年,公寓,33.4,32.57,3房2廳2衛,3樓/5樓,無車位,2,9864NU,2025-10-06 01:34:02
近永樂商圈正馬路金店,台北市大同區延平北路二段,46.5年,店面/辦公/大樓,21.24,18.01,1廳1衛1室,1樓/11樓,無車位,2,58917C,2025-10-06 01:34:02
台大璞園芳鄰捷運美廈,台北市中正區汀州路三段,44.5年,華廈,32.13,28.29,3房2廳2衛,6樓/7樓,無車位,2,2413XZ,2025-10-06 01:34:02
天母國中好所在,台北市士林區天母東路,46.9年,其它,58.72,,4房4廳2衛(含加蓋2房),5-6樓/4樓,無車位,2,1201NM,2025-10-06 01:34:11
近芝山站琉御四房車位琉御永龍華,台北市士林區中山北路六段,14.6年,華廈,63.9,35.16,4房2廳2衛2室,4樓/7樓,塔式車位,6,8515BJ,2025-10-06 01:34:11
財盛通商純辦財盛通商大樓,台北市信義區基隆路二段,29.1年,辦公/大樓,67.2,37.4,1廳,2樓/17樓,無車位,4,9477NY,2025-10-06 01:34:11
南京三民林蔭樹海四房車位南京御品樓,台北市松山區吉祥路,32.8年,華廈,55.61,36.75,4房2廳2衛,4樓/7樓,坡道平面車位,4,2743YK,2025-10-06 01:34:11
★仁愛星鑽★樓中樓,台北市大安區仁愛路三段,24.8年,華廈,76.7,41.63,5房2廳2衛,5-6樓/6樓,兩個以上車位,8,4494CP,2025-10-06 01:34:11
內湖捷運。綠意電梯美宅,台北市內湖區內湖路三段,29.5年,華廈,30.01,26.75,3房2廳2衛,2樓/7樓,無車位,2,5816WX,2025-10-06 01:34:11
南京三民低總價採光三房,台北市松山區寶清街,53.7年,公寓,22.3,22.31,3房1廳1衛,4樓/4樓,無車位,1,3437VB,2025-10-06 01:34:11
松平／昇陽國寶一戶一梯廳,台北市信義區松平路,24.8年,華廈,86.93,51.07,4房2廳3衛(含加蓋1房1衛),4樓/8樓,兩個以上車位,11,3799WF,2025-10-06 01:34:11
捷運中山站機能美居,台北市中山區中山北路一段,29.3年,華廈,14.35,8.77,1房1廳1衛(含加蓋1房),5樓/7樓,無車位,1,3612ZF,2025-10-06 01:34:11
極稀有國泰建設公寓二樓,台北市文山區忠順街一段,50.2年,公寓,25.58,25.58,3房2廳1衛,2樓/4樓,無車位,1,0244CJ,2025-10-06 01:34:11
時尚之星一樓店面時尚之星,台北市大同區五原路,15.8年,店面,36.08,21.12,1廳1衛1室,1樓/14樓,無車位,3,8503JF,2025-10-06 01:34:11
【信義國品】邊間三房,台北市信義區基隆路一段,43.9年,華廈,39.12,34.12,3房2廳2衛,3樓/7樓,無車位,4,1611GV,2025-10-06 01:34:11
捷運１０１站★面公園一樓,台北市信義區莊敬路,54.1年,公寓,21.57,21.57,3房2廳1衛(含加蓋1廳),1樓/4樓,無車位,2,3131QY,2025-10-06 01:34:11
統創緻－精緻美屋,台北市大安區復興南路一段,1.5年,大樓,21.03,9.86,1房1廳1衛,6樓/15樓,塔式車位,3,8199WV,2025-10-06 01:34:11
天母黃金２樓新裝潢面樹海,台北市士林區芝玉路一段,40.9年,公寓,20.62,17.93,2房2廳2衛,2樓/5樓,無車位,1,5485GL,2025-10-06 01:34:11
新．天母精品挑高住店天母小西華,台北市士林區天母北路,17.7年,華廈/店面,24.39,13.85,2房2廳1衛(含加蓋2房),1樓/9樓,無車位,2,2503YX,2025-10-06 01:34:11
內科稀有一層一戶大辦公室,台北市內湖區堤頂大道二段,25.7年,辦公/大樓,153.34,78.11,2廳1衛7室(含加蓋1廳1衛5室),3樓/12樓,升降平面車位,7,8129WF,2025-10-06 01:34:11
中山一樓公寓,台北市中山區錦州街,60.6年,公寓,21.25,20.55,3房1廳1衛,1樓/4樓,無車位,2,4636RV,2025-10-06 01:34:11
草山悠然精緻湯屋草山水美,台北市北投區幽雅路,16.7年,大樓,17.68,10.3,1房1廳1衛,5樓/13樓,無車位,998,4513LN,2025-10-06 01:34:11
萬隆捷運邊間美寓,台北市文山區羅斯福路五段,45.0年,公寓,35.61,35.61,3房2廳2衛,3樓/5樓,無車位,2,8547CP,2025-10-06 01:34:11
【久石讓】尊爵鋼骨大戶久石讓,台北市松山區南京東路四段,15.1年,大樓,204.2,122.76,4房2廳4衛4室,8樓/15樓,兩個以上車位,22,0441SC,2025-10-06 01:34:20
社子公園芳鄰頂加,台北市士林區永平街,37.7年,公寓,45.04,39.99,4房4廳3衛1室(含加蓋1房2廳1衛1室),5樓/5樓,無車位,2,0932NT,2025-10-06 01:34:20
富康街一樓美寓,台北市南港區富康街,47.9年,公寓,22.56,18.95,2房2廳2衛1室,1樓/4樓,無車位,2,5926VG,2025-10-06 01:34:20
台北站前地上權店辦,台北市中正區公園路,58.0年,店面/辦公,23.29,23.29,3房1廳1衛(含加蓋1衛),3樓/5樓,無車位,600,8325WK,2025-10-06 01:34:20
