標題,地址,屋齡,類型,建坪,主+陽,格局,樓層,車位,總價(萬),編號,抓取時間
金華國中電梯景觀四房車位,台北市大安區泰順街,44.3年,華廈,53.04,43.7,4房2廳2衛1室,6樓/7樓,塔式車位,5,82864D,2025-10-06 01:59:33
近石牌國小獨立權狀車位Ａ,台北市北投區自強街,24.2年,單售車位,1.66,0,,--,塔式車位,110,93032H,2025-10-06 01:59:33
黃金南港稀有挑高廠房中視新都會,台北市南港區重陽路,35.5年,廠房/店面,37.67,28.72,2廳2衛(含加蓋1廳1衛),1樓/5樓,無車位,3,61704Z,2025-10-06 01:59:33
公園景捷運雙語國小三房,台北市大同區重慶北路三段,51.5年,公寓,29.29,29.29,3房2廳1衛,4樓/4樓,無車位,1,36231E,2025-10-06 01:59:33
大新生金華電梯兩房小蘋果,台北市大安區金華街,24.4年,華廈,18.79,12.9,3房2廳1衛(含加蓋1房),5樓/6樓,無車位,3,9093QQ,2025-10-06 01:59:41
專任石牌捷運店面,台北市北投區東華街二段,28.9年,店面,24.88,16.35,1廳1衛,1樓/7樓,塔式車位,2,8489NK,2025-10-06 01:59:41
獨賣！晶麒高樓極品美屋,台北市萬華區康定路,9.5年,大樓,16.24,10.27,1房1廳1衛,14樓/26樓,無車位,1,2386VD,2025-10-06 01:59:41
首購置產小資成家三房寓所,台北市文山區興隆路三段,42.2年,公寓,26.23,23.81,3房2廳1衛,5樓/5樓,無車位,1,5489SW,2025-10-06 01:59:41
⭐紀念堂．四房坡平將完工,台北市中正區金華街,預售,大樓,66.46,38.63,4房2廳2衛1室,13樓/15樓,坡道平面車位,9,8367RM,2025-10-06 01:59:41
衡陽１０８,台北市中正區衡陽路,17.7年,大樓,15.05,8.72,1房1廳1衛(含加蓋1房),4樓/14樓,無車位,1,2470QQ,2025-10-06 01:59:41
《雙捷運》美辦附車位,台北市大同區承德路二段,32.1年,辦公/大樓,51.44,28.84,1廳4室,5樓/16樓,兩個以上車位,4,9884KX,2025-10-06 01:59:41
城裡喧囂，家中靜好,台北市北投區溫泉路,50.1年,公寓,28.31,28.31,2房2廳1衛,4樓/4樓,無車位,1,3266YN,2025-10-06 01:59:41
中山豪華收租公園美套,台北市中山區錦州街,47.6年,套房,13.18,10.92,1房1廳1衛,4樓/7樓,無車位,1,4833NM,2025-10-06 01:59:41
［桂林］舒適優質三樓,台北市萬華區桂林路,55.6年,公寓,29.3,29.3,4房2廳1衛,3樓/4樓,無車位,1,3712UW,2025-10-06 01:59:41
信義區高樓美景毛胚辦公,台北市信義區信義路五段,29.9年,辦公/大樓,80.74,54.88,1廳,15樓/22樓,無車位,7,2073PS,2025-10-06 01:59:41
銀河洞越嶺步道旁林地,台北市文山區老泉街,,土地,1406.93,,,,無車位,1,7196WL,2025-10-06 01:59:41
文山區土地＊第三種住宅區,台北市文山區一壽街,,土地,2.42,,,,無車位,205,0629AA,2025-10-06 01:59:41
【精選】秀泰晶華三角窗店,台北市中山區林森北路,43.3年,店面,31.68,13.18,2廳2衛,1樓/12樓,無車位,16,17692M,2025-10-06 01:59:41
★國泰．信義亞緻★信義亞緻,台北市信義區信義路五段,16.1年,大樓,115.39,60.92,4房2廳3衛2室,7樓/12樓,兩個以上車位,15,51858B,2025-10-06 01:59:41
康定鑽石黃金店面,台北市萬華區康定路,44.5年,店面/辦公,91.84,70.15,3房2廳4衛9室,1-2樓/11樓,無車位,6,28873F,2025-10-06 01:59:41
碧湖氣派車位美墅,台北市內湖區內湖路二段,24.8年,別墅/透天,117.58,81.88,5房3廳4衛3室(含加蓋1室),B1-4樓/4樓,兩個以上車位,12,96348Q,2025-10-06 01:59:41
龍飛鳳舞收租寶Ｃ,台北市萬華區廣州街,41.3年,華廈,41.98,36.91,8房8衛,8樓/9樓,無車位,1,84867M,2025-10-06 01:59:41
捷運東區辦店可掛廣告招牌忠孝九如大樓,台北市大安區忠孝東路四段,41.3年,辦公/店面/大樓,74,56.72,1廳3室,4樓/12樓,無車位,8,67434T,2025-10-06 01:59:41
民生頂加收租隔套大空間,台北市松山區撫遠街,52.1年,公寓,26.09,26.09,7房7衛(含加蓋2房2衛),4樓/4樓,無車位,2,30734V,2025-10-06 01:59:41
民生大馬路二樓套房高收租,台北市松山區民生東路五段,42.5年,公寓,35.38,35.38,5房5衛,2樓/5樓,無車位,3,72898L,2025-10-06 01:59:49
市府捷運一巷居公寓,台北市信義區忠孝東路五段,53.6年,公寓,30.55,30.55,5房2廳2衛(含加蓋2房1廳1衛),4樓/4樓,無車位,4,28956L,2025-10-06 01:59:49
長春路國賓影城旁２樓店辦,台北市中山區長春路,55.4年,店面/辦公,28.65,28.66,1廳1衛,2樓/4樓,無車位,4,50428Z,2025-10-06 01:59:49
高興興業極景商旅,台北市松山區基隆路一段,30.7年,辦公/大樓,230.3,149.62,17房1廳17衛1室,18樓/18樓,升降平面車位,13,92078R,2025-10-06 01:59:49
文化大學電梯收租自用聖品,台北市士林區光華路,47.3年,華廈,40.2,34.62,9房3衛,5樓/7樓,無車位,2,24594K,2025-10-06 01:59:49
環山復興豪邸,台北市北投區復興四路,35.1年,透天,130.24,88.83,6房2廳8衛3室,B1-4樓/4樓,其他,6,7269JS,2025-10-06 01:59:49
明德捷運三樓方正公寓,台北市北投區致遠一路一段,49.1年,公寓,35.68,35.68,3房2廳2衛1室,3樓/4樓,無車位,2,7000XB,2025-10-06 01:59:49
台北低總五房五衛公寓,台北市萬華區梧州街,44.7年,公寓,28.57,28.56,5房5衛,3樓/5樓,無車位,1,5001MT,2025-10-06 01:59:49
南京復興捷運站旁收租寶,台北市中山區遼寧街,41.5年,公寓,32.82,32.82,5房1廳5衛(含加蓋1房1廳1衛),5樓/5樓,無車位,3,3562VQ,2025-10-06 01:59:49
宏築信義Ａ１－１２Ｆ,台北市信義區和平東路三段,預售,大樓,68.75,37.93,3房2廳2衛,12樓/24樓,坡道平面車位,7,1993AN,2025-10-06 01:59:49
附中學區全新七樓三房登峰大廈,台北市大安區復興南路一段,預售,大樓/辦公,33.76,24.17,3房2廳2衛,7樓/15樓,無車位,5,9250UW,2025-10-06 01:59:49
伊邸高樓翱翔景觀車位三房,台北市松山區復興北路,預售,大樓,53.73,26.17,3房2廳2衛,12樓/12樓,坡道平面車位,6,5000BY,2025-10-06 01:59:49
寶舖ＣＡＲＥ即將交屋Ｆ,台北市中正區羅斯福路三段,預售,大樓,27.01,15.43,1房2廳2衛,13樓/14樓,其他,3,7208LL,2025-10-06 01:59:49
一青。悠高樓小資首選,台北市北投區溫泉路,預售,大樓,12.27,7.99,1房1廳1衛,8樓/12樓,無車位,1,3507SJ,2025-10-06 01:59:49
即將交屋德運永康快把握,台北市大安區信義路二段,預售,大樓,95.51,57.73,5房2廳3衛,11樓/23樓,坡道平面車位,15,1571QJ,2025-10-06 01:59:49
忠孝東路四段住辦萬林大樓,台北市大安區忠孝東路四段,48.2年,大樓/辦公,39.84,39.84,1房2廳1衛,4樓/12樓,無車位,4,4485JH,2025-10-06 01:59:49
♛東區名店城漂亮店面♛太平洋頂好大樓,台北市大安區忠孝東路四段,37.7年,店面,10.59,4.98,1廳,3樓/15樓,無車位,980,5549NL,2025-10-06 01:59:49
排隊日式老店✬面寬金三角民福大樓,台北市松山區民權東路三段,40.5年,店面/辦公,30.69,21.7,1廳1衛,1樓/10樓,無車位,11,1332MV,2025-10-06 01:59:49
南京東路－Ａ級百坪辦公,台北市中山區南京東路三段,22.6年,辦公/大樓,236.54,125.36,1廳9室(含加蓋1室),6樓/11樓,兩個以上車位,24,7058NM,2025-10-06 01:59:49
正信義路三角窗金店,台北市大安區信義路四段,29.4年,店面,160.94,24.31,2廳1衛2室,B1-1樓/12樓,兩個以上車位,19,5517WR,2025-10-06 01:59:49
雙連成淵金店面,台北市大同區承德路二段,30.5年,店面,32.55,15.5,1廳1衛(含加蓋1衛),1樓/11樓,無車位,3,9733NB,2025-10-06 01:59:56
名邸台大緣獨立產權車位台大緣,台北市文山區汀州路四段,14.7年,單售車位,10.89,0,,--,坡道機械車位,130,9731VY,2025-10-06 01:59:56
屋主急售●東區頂好小店面太平洋頂好大樓,台北市大安區忠孝東路四段,37.7年,店面,7.9,4.44,1廳1室,3樓/15樓,無車位,838,3913GW,2025-10-06 01:59:56
彩色羅馬車位５彩色羅馬,台北市南港區東明街,16.1年,單售車位,8.09,0,,--,升降平面車位,200,1064HJ,2025-10-06 01:59:56
彩色羅馬車位１彩色羅馬,台北市南港區東明街,16.1年,單售車位,8.09,0,,--,坡道機械車位,145,9906CP,2025-10-06 01:59:56
彩色羅馬車位２彩色羅馬,台北市南港區東明街,16.1年,單售車位,8.09,0,,--,坡道機械車位,145,7334QK,2025-10-06 01:59:56
彩色羅馬車位４彩色羅馬,台北市南港區東明街,16.1年,單售車位,8.09,0,,--,坡道機械車位,145,8700VD,2025-10-06 01:59:56
行天宮大面三角窗三石華廈,台北市中山區松江路,40.5年,店面,87.36,70.51,2廳2衛,1樓/7樓,無車位,16,8564CB,2025-10-06 01:59:56
信義安和★優質一樓,台北市大安區信義路四段,48.2年,華廈,34.16,26.14,3房2廳2衛(含加蓋1房1衛),1樓/7樓,無車位,4,1345FX,2025-10-06 01:59:56
萬大稀有邊間美透天,台北市萬華區萬大路,56.6年,店面,25.72,25.72,5房3廳4衛(含加蓋1房2廳1衛),1-3樓/3樓,無車位,3,9582DX,2025-10-06 01:59:56
玻璃帷幕。國美鋼骨純辦,台北市內湖區瑞光路,22.4年,辦公,277.61,119.06,1廳11室(含加蓋1室),7樓/10樓,兩個以上車位,18,6973BV,2025-10-06 01:59:56
陽明山★大亨溫泉別墅,台北市士林區大亨路,59.2年,別墅/透天,48.78,43.02,3房2廳3衛1室,1-2樓/2樓,無車位,12,3610SG,2025-10-06 01:59:56
敦南觀止坡機車位Ｉ敦南觀止,台北市文山區福興路,13.1年,單售車位,6.43,0,,--,坡道機械車位,180,1552ZB,2025-10-06 01:59:56
敦南觀止坡機車位ＩＩ敦南觀止,台北市文山區福興路,13.1年,單售車位,6.43,0,,--,坡道機械車位,170,0068KX,2025-10-06 01:59:56
南軟商圈穩定金店面世界心,台北市南港區重陽路,13.4年,店面,80.51,31.22,1廳1室,1樓/12樓,兩個以上車位,8,2694LB,2025-10-06 01:59:56
降價急售．仁愛路百坪店面仁愛三青,台北市大安區仁愛路四段,43.6年,店面/辦公/大樓,104.17,0,5房2廳2衛1室(含加蓋1房),-1樓/14樓,無車位,12,4637UG,2025-10-06 01:59:56
雙星優質一樓辦公敦化雙星,台北市大安區敦化南路一段,43.8年,店面/辦公/大樓,45.36,40.45,2廳1衛2室,1樓/14樓,無車位,9,7405AR,2025-10-06 01:59:56
福華商場旁★收租店面國家財經大樓,台北市內湖區民權東路六段,33.3年,店面,44.8,33.24,1房2廳2衛2室,1-2樓/14樓,無車位,4,3752TT,2025-10-06 01:59:56
㊣古亭三房三樓公寓,台北市中正區同安街,51.4年,公寓,24.03,24.03,3房2廳2衛,3樓/4樓,無車位,2,3206KX,2025-10-06 01:59:56
南港松山站迷你倉辦首選萬象大樓,台北市南港區八德路四段,29.8年,辦公/大樓,8.47,2.74,1廳,1樓/16樓,無車位,488,3318CF,2025-10-06 01:59:56
雙語學區捷運公園四房電梯,台北市大同區延平北路三段,44.8年,華廈,27.49,24.37,4房3廳1衛,2樓/7樓,無車位,1,3209GC,2025-10-06 02:00:04
稀有重慶南路黃金店辦,台北市中正區重慶南路一段,43.0年,店面/辦公,143.42,79.08,2廳3衛,1-2樓/8樓,兩個以上車位,13,3302VF,2025-10-06 02:00:04
天母圓環社區管理一樓錦龍華廈,台北市士林區中山北路七段,48.1年,華廈,40.13,29.21,3房2廳2衛2室,1樓/7樓,無車位,3,6210MC,2025-10-06 02:00:04
港墘金雞母,台北市內湖區內湖路一段,44.0年,公寓,28.52,28.52,7房7衛(含加蓋2房2衛),5樓/5樓,無車位,2,2437KJ,2025-10-06 02:00:04
綠景美妝低樓層碧湖園新城,台北市內湖區內湖路三段,43.6年,公寓,23.74,19.81,2房2廳1衛,2樓/5樓,無車位,1,4170TY,2025-10-06 02:00:04
華榮市場收租金店面,台北市士林區華榮街,65.8年,店面/透天,47.49,43.56,7房6廳3.5衛(含加蓋4房3廳),1-2樓/2樓,無車位,13,6922RS,2025-10-06 02:00:04
中山國小捷運美妝套房,台北市中山區新生北路三段,44.7年,大樓,11.44,8.02,1房1廳1衛,8樓/14樓,無車位,1,5581BW,2025-10-06 02:00:04
圓頂塔式大車位圓頂藝術廳,台北市北投區中央南路一段,16.2年,單售車位,0.72,0,,--,塔式車位,125,0883VL,2025-10-06 02:00:04
近芝山站綠景美寓,台北市士林區至誠路二段,43.2年,公寓,33.75,30.35,3房2廳2衛1室,5樓/5樓,無車位,2,0938GV,2025-10-06 02:00:04
雙溪畔花園綠意透天,台北市士林區至誠路一段,49.7年,透天,46.71,41.84,4房4廳3衛2室(含加蓋1房1廳1衛1室),1-2樓/2樓,無車位,5,9564NB,2025-10-06 02:00:04
威靈頓樹海別墅莊園,台北市北投區崇仰七路,58.6年,別墅/透天,71.99,64.18,5房2廳4衛(含加蓋1衛),1-2樓/2樓,其他,6,5180NC,2025-10-06 02:00:04
★北醫吳興街三房★,台北市信義區吳興街,41.2年,公寓,28.17,26.05,3房2廳2衛,2樓/5樓,無車位,2,6771HN,2025-10-06 02:00:04
金華龍門大安公園美高樓師大林園,台北市大安區和平東路一段,18.6年,大樓,64.73,38.26,3房2廳2衛,15樓/15樓,兩個以上車位,7,7832JF,2025-10-06 02:00:04
北安路近捷運頂加,台北市中山區北安路,50.3年,公寓,33.23,33.23,5房4廳2.5衛(含加蓋2房2廳1衛),4樓/4樓,無車位,2,0452YL,2025-10-06 02:00:04
東方文華✨機械平移車位東方文華,台北市南港區興華路,20.4年,單售車位,4.02,0,,--,升降機械車位,150,2014XR,2025-10-06 02:00:04
景美捷運大空間美寓,台北市文山區景福街,51.0年,公寓,31.04,31.04,4房2廳3衛1室(含加蓋2房1廳1衛),4樓/4樓,無車位,2,1857YL,2025-10-06 02:00:04
三面採光方正美寓,台北市北投區復興一路,56.4年,公寓,18.51,18.51,2房2廳1衛,3樓/3樓,無車位,998,4542VP,2025-10-06 02:00:04
東門面金華校園頂加公寓,台北市大安區金山南路二段,53.5年,公寓,30.72,30.72,11房2廳2衛(含加蓋7房1衛),4樓/4樓,無車位,5,1296NG,2025-10-06 02:00:04
東湖國小精裝二雙兩房,台北市內湖區東湖路,44.9年,公寓,28.21,28.21,4房2廳2衛,5樓/5樓,無車位,1,9754PS,2025-10-06 02:00:04
近公園‧三代同樂邊間二樓,台北市士林區延平北路五段,54.2年,公寓,30.34,30.34,4房2廳1衛,2樓/4樓,無車位,2,6635CK,2025-10-06 02:00:04
⭐屋主誠售天母轉角大店辦,台北市士林區天母西路,12.1年,店面/辦公,248.93,101.02,2廳3衛2室,B1-2樓/7樓,兩個以上車位,23,1964AQ,2025-10-06 02:00:12
蘇黎世金店面１４１,台北市內湖區新湖一路,16.3年,店面,84.48,41.33,1廳1室(含加蓋1室),1樓/7樓,兩個以上車位,8,1206US,2025-10-06 02:00:12
收租金雞母＞商四公寓,台北市萬華區貴陽街二段,52.5年,公寓,50.64,50.63,7房4廳7衛(含加蓋2房2廳2衛),4樓/4樓,無車位,3,3676ZN,2025-10-06 02:00:12
近捷運伊通公園靜巷美邸,台北市中山區伊通街,17.5年,華廈/辦公,20.9,9.86,1房1廳1衛,6樓/6樓,升降機械車位,2,0949TX,2025-10-06 02:00:12
中正紀念堂住辦大樓首選,台北市中正區重慶南路二段,47.3年,大樓,38.63,31.22,1房2廳2衛,6樓/12樓,無車位,3,4196LR,2025-10-06 02:00:12
附小面公園★收租頂加,台北市大安區和平東路二段,50.9年,公寓,33.71,33.71,9房9衛(含加蓋4房4衛),4樓/4樓,無車位,4,0420SQ,2025-10-06 02:00:12
廈門街➤電梯華廈➤圓夢,台北市中正區廈門街,49.5年,華廈,30.07,27.25,6房4廳4衛(含加蓋2房2廳2衛),5樓/5樓,無車位,3,8352JV,2025-10-06 02:00:12
士北科士林捷運三房美寓,台北市士林區大北路,53.8年,公寓,22.09,19.97,3房1廳1衛(含加蓋1廳),4樓/4樓,無車位,1,1312PW,2025-10-06 02:00:12
近未來社子捷運精美公寓,台北市士林區中正路,45.1年,公寓/套房,35.12,35.12,4房2廳2衛,4樓/5樓,無車位,2,1204QM,2025-10-06 02:00:12
葫洲捷運站附近金店面文心大湖緣,台北市內湖區民權東路六段,32.0年,店面,70.43,23.66,2廳2衛2室,B1-1樓/7樓,坡道平面車位,4,5183KK,2025-10-06 02:00:12
民權吉林路２樓,台北市中山區吉林路,51.1年,公寓,26.54,26.54,3房1廳1衛,2樓/4樓,無車位,2,7915FC,2025-10-06 02:00:12
民權吉林路３樓,台北市中山區吉林路,51.1年,公寓,26.54,26.54,5房1衛,3樓/4樓,無車位,2,6032HN,2025-10-06 02:00:12
昇陽．南京復興稀有車位昇陽SUNRIS...,台北市中山區長安東路二段,24.5年,單售車位,2.97,0,,--,升降機械車位,105,3035UJ,2025-10-06 02:00:12
民生東溫馨美套翡冷翠,台北市中山區民生東路二段,45.6年,華廈,13.62,10.37,1房1廳1衛,3樓/7樓,無車位,1,0751KR,2025-10-06 02:00:12
內湖站碧湖新鑽碧湖新鑽,台北市內湖區內湖路三段,30.7年,華廈,14.51,11.02,1房1廳1衛,2樓/10樓,無車位,1,3540SX,2025-10-06 02:00:12
ＳＯＧＯ旁金店面人潮多香檳華廈-CD座,台北市大安區復興南路一段,41.7年,店面,22.59,13.97,1廳1衛,B1-1樓/7樓,無車位,4,4066UX,2025-10-06 02:00:12
【中山國中商圈】典雅美寓,台北市中山區合江街,47.8年,公寓,29.16,29.16,2房2廳2衛1室,3樓/4樓,無車位,2,3646ZQ,2025-10-06 02:00:12
雙子星商三土地獨棟公寓,台北市大同區重慶北路一段,43.6年,辦公,12.62,12.62,2房1廳1衛,3樓/4樓,無車位,1,5270HY,2025-10-06 02:00:12
通勤北士科雙捷運大公寓,台北市士林區文林路,41.2年,公寓,40.5,38.93,3房2廳2衛,3樓/5樓,無車位,3,9790DD,2025-10-06 02:00:12
南京靜巷•璞居,台北市中山區南京東路一段,44.1年,套房/公寓,10.81,8.78,1房1衛,2樓/6樓,無車位,1,4113AU,2025-10-06 02:00:12
萬大黃金３樓美宅,台北市萬華區萬大路,48.6年,公寓,23.46,23.46,3房1廳1衛,3樓/4樓,無車位,1,2362KV,2025-10-06 02:00:19
♚麗水街黃金稀有二樓♚,台北市大安區麗水街,42.7年,公寓,49.27,43.76,4房2廳2衛,2樓/5樓,無車位,6,2802AP,2025-10-06 02:00:19
指名凱廈金店面凱廈,台北市信義區松德路,31.0年,店面/辦公/大樓,22.92,16.01,1廳1衛,1樓/23樓,無車位,4,6114JH,2025-10-06 02:00:19
松仁低調日式庭院戶,台北市信義區松仁路,35.2年,華廈,66.13,28.05,4房3廳2衛2室(含加蓋1室),B1-1樓/6樓,無車位,4,8580FC,2025-10-06 02:00:19
捷運旁✦靜謐角落陽光宅,台北市萬華區長泰街,50.9年,公寓,25.86,25.86,4房4廳2衛(含加蓋2房2廳1衛),4樓/4樓,無車位,1,5105JG,2025-10-06 02:00:19
ＮＥＷ東區面寬人潮金店,台北市大安區忠孝東路四段,47.8年,店面,55.1,43.48,2廳2衛,1樓/7樓,無車位,18,0619ZM,2025-10-06 02:00:19
亮靚！高樓邊間２房２衛,台北市中山區新生北路二段,53.5年,大樓/辦公,15.11,15.11,2房1廳2衛,10樓/12樓,無車位,1,2886LT,2025-10-06 02:00:19
國光成家好屋國光國宅,台北市萬華區中華路二段,46.5年,大樓,19.08,19.09,3房2廳1衛,8樓/12樓,無車位,1,5975TN,2025-10-06 02:00:19
超站Ｓ正馬路金店超站S,台北市大同區延平北路三段,6.3年,店面/辦公,56.19,35.21,1房2廳1衛,1-2樓/19樓,坡道機械車位,10,4182AA,2025-10-06 02:00:19
國泰名人後棟三房國泰名人,台北市信義區永吉路,39.2年,大樓,39.41,32.92,3房2廳2衛,3樓/14樓,無車位,4,9776GQ,2025-10-06 02:00:19
豪宅區香榭朝東信義香榭,台北市信義區信義路五段,18.8年,大樓,20.32,12.78,1房1廳1衛,9樓/19樓,無車位,2,4242DK,2025-10-06 02:00:19
信義區吳興收租美寓,台北市信義區吳興街,41.2年,公寓,29.89,27.77,4房4廳4衛3室(含加蓋2房2廳2衛2室),5樓/5樓,無車位,3,5364BW,2025-10-06 02:00:19
［泉之鄉］置產電梯華廈,台北市北投區溫泉路,48.0年,華廈,30.21,24.9,4房4衛,5樓/7樓,無車位,1,0604CZ,2025-10-06 02:00:19
正松德路金店世貿雙庭,台北市信義區松德路,35.2年,店面,40.5,22.02,1房1廳2衛1室,1樓/12樓,坡道機械車位,8,8613CU,2025-10-06 02:00:19
雙鐵精華店面！稀有釋出,台北市萬華區康定路,41.8年,店面,33.21,13.21,1廳1衛1室(含加蓋1衛1室),1樓/10樓,無車位,5,46057H,2025-10-06 02:00:19
百貨商圈收租置產店面環翠名宮,台北市士林區天母東路,39.0年,店面,48.04,17.37,3廳2衛(含加蓋1衛),B1-1樓/12樓,無車位,6,19922W,2025-10-06 02:00:19
第一城四房大空間,台北市信義區虎林街,40.4年,公寓,40.73,37.62,6房4廳3衛(含加蓋2房2廳1衛),5樓/5樓,無車位,2,37906N,2025-10-06 02:00:19
天母新光三越面寬金店天母華琪-愛座,台北市士林區天母東路,47.5年,店面/辦公,29.83,24.68,1廳1衛,1樓/8樓,無車位,2,1865LK,2025-10-06 02:00:19
長沙街近捷運全棟商辦大樓,台北市萬華區長沙街二段,52.4年,辦公/店面,593.79,460.93,5廳5衛29室,B1-6樓/6樓,兩個以上車位,27,6852TS,2025-10-06 02:00:19
世達懿居稀有可換約,台北市中正區南昌路二段,預售,大樓,11.15,7.8,1房1廳1衛,4樓/15樓,無車位,1,4521LC,2025-10-06 02:00:19
收租★新世界★１０１新世界,台北市信義區松勤街,17.8年,大樓,15.71,10.21,1房1廳1衛,6樓/19樓,無車位,2,67187Q,2025-10-06 02:00:29
置產收租八德路低總公寓,台北市松山區八德路四段,46.7年,公寓,23.39,23.38,2房2廳2衛,4樓/5樓,無車位,1,1435VF,2025-10-06 02:00:29
信義後山埤近未來廣慈一樓,台北市信義區中坡南路,53.5年,公寓/店面,30.47,21.07,2廳1衛1室(含加蓋1室),1樓/4樓,無車位,4,6492YT,2025-10-06 02:00:29
正信義路森林公園車位信義新象,台北市大安區永康街,17.5年,單售車位,0.69,0,,--,塔式車位,122,8760PT,2025-10-06 02:00:29
敦北長春林蔭方正辦住,台北市松山區敦化北路,55.3年,辦公/大樓,62.69,54.12,3房1廳1衛,5樓/12樓,無車位,6,1093YD,2025-10-06 02:00:29
【專任】雙城電梯管理套房,台北市中山區雙城街,46.5年,套房,12,9.77,1房1廳1衛,4樓/7樓,無車位,980,6231XU,2025-10-06 02:00:29
誠售旅行與閱讀車位旅行與閱讀,台北市中正區仁愛路二段,16.6年,單售車位,0.38,0,,--,塔式車位,188,62487D,2025-10-06 02:00:29
信義東興優質辦公附車位,台北市信義區東興路,11.4年,辦公/大樓,95.67,52.64,1廳1衛,7樓/11樓,坡道平面車位,8,66901P,2025-10-06 02:00:29
仙岩路一樓,台北市文山區仙岩路,31.8年,公寓,33.72,30.23,4房2廳2衛,1樓/5樓,無車位,2,39867N,2025-10-06 02:00:29
光里蘊三房坡平車位,台北市內湖區行善路,預售,大樓,49.79,24.68,3房2廳2衛,3樓/13樓,坡道平面車位,4,5240NL,2025-10-06 02:00:29
璞森晴遠眺山景璞森晴,台北市內湖區內湖路二段,3.2年,華廈,47.98,24.08,3房2廳2衛,2樓/5樓,坡道平面車位,5,8060RC,2025-10-06 02:00:29
西湖國中小獨棟靓公寓三房,台北市內湖區內湖路一段,45.3年,公寓,28.79,28.79,3房2廳2衛,4樓/5樓,無車位,2,8416FW,2025-10-06 02:00:29
稀有＊明水四季中庭美樹海明水四季,台北市中山區明水路,17.6年,辦公/大樓,16.58,10.19,3廳1衛,3樓/12樓,無車位,1,6648GD,2025-10-06 02:00:29
內科搶手黃金三樓,台北市內湖區內湖路一段,42.2年,公寓,28.03,28.03,3房2廳1衛,3樓/5樓,無車位,1,0821DH,2025-10-06 02:00:29
南京武昌低總價熱鬧金店面,台北市松山區南京東路五段,52.9年,店面,31.31,29.4,2廳2衛,1樓/6樓,無車位,3,2075LG,2025-10-06 02:00:29
捷運旁收租大辦公,台北市中山區林森北路,41.1年,辦公/大樓,34.27,25.43,1廳1衛2室,5樓/13樓,無車位,2,6471MH,2025-10-06 02:00:29
圓山花博捷運發跡金店美麗圓山,台北市大同區承德路三段,19.0年,店面,11.38,5.35,2廳1衛,1樓/13樓,無車位,1,0588SN,2025-10-06 02:00:29
華崗文化景觀小套房,台北市士林區格致路,29.0年,華廈,10.84,7.27,1房1廳1衛,4樓/10樓,無車位,580,0850QF,2025-10-06 02:00:29
近西門／北門站。黃金店面,台北市萬華區洛陽街,42.0年,店面,6.58,3.78,1廳,1樓/9樓,無車位,588,8208PP,2025-10-06 02:00:29
天母靜謐●橙光生活寓所,台北市士林區中山北路七段,46.1年,公寓,32.92,32.92,4房3廳2.5衛(含加蓋1房1廳1衛),5樓/5樓,無車位,2,8427DY,2025-10-06 02:00:29
新接新世界高樓美妝附車位新世界,台北市信義區松勤街,17.8年,大樓,19.94,9.53,1房1廳1衛,15樓/19樓,坡道機械車位,2,7123WK,2025-10-06 02:00:37
⭐誠售⭐貳樓⭐置產捷運宅,台北市文山區興德路,45.4年,公寓,23.69,23.7,4房4衛,2樓/5樓,無車位,1,8779SS,2025-10-06 02:00:37
中正稀有大土地透天,台北市中正區同安街,63.3年,透天/套房,19.14,19.14,8房1廳5衛(含加蓋4房1衛),1-1樓/1樓,無車位,5,5075PX,2025-10-06 02:00:37
昇陽２房帶坡平車位昇陽GRAND,台北市大安區光復南路,17.3年,大樓,35.9,14.01,2房1廳1衛,9樓/14樓,坡道平面車位,3,2093SH,2025-10-06 02:00:37
濱湖名宮機能店面濱湖名宮,台北市內湖區民權東路六段,38.9年,店面,49.91,33.8,1廳1衛1室,1樓/12樓,無車位,6,6245SF,2025-10-06 02:00:37
中山雙連‧電梯大空間,台北市中山區新生北路二段,34.6年,華廈,19.09,14.26,1房2廳1衛,4樓/9樓,無車位,2,6019DP,2025-10-06 02:00:37
萬利街大庭院車庫一樓,台北市文山區萬利街,37.9年,公寓,49.84,34.03,4房3廳2衛(含加蓋1廳1衛),1樓/4樓,無車位,4,9317GU,2025-10-06 02:00:37
吉美和風Ｂ４優質坡平車位吉美和風,台北市大同區昌吉街,13.7年,單售車位,14.14,0,,--,坡道平面車位,330,1623DU,2025-10-06 02:00:37
近雙連馬偕公園美景低總價,台北市中山區民生東路一段,45.2年,大樓,15.65,12.13,1房1廳1衛,9樓/12樓,無車位,1,6105ZN,2025-10-06 02:00:37
敦南商辦保富高樓面樹海保富寰宇大樓,台北市大安區敦化南路二段,42.3年,辦公/大樓,25.96,17.97,1廳3室,16樓/20樓,無車位,3,3842MM,2025-10-06 02:00:37
逸仙一樓美屋有前院逸欣大廈,台北市信義區逸仙路,44.1年,華廈,56.36,42.42,2房2廳2.5衛,1樓/7樓,無車位,9,0608PK,2025-10-06 02:00:37
御庭大廈☆面公園四房車位御庭大廈,台北市中山區民權東路三段,37.4年,大樓/辦公,60.65,45.48,4房2廳2.5衛,3樓/12樓,坡道平面車位,5,3513WZ,2025-10-06 02:00:37
捷運中山國小坡道平面車位,台北市中山區林森北路,15.9年,單售車位,8.29,0,,--,坡道平面車位,160,8914TP,2025-10-06 02:00:37
可看－民生面公園２樓,台北市松山區民生東路五段,50.3年,公寓,31.01,31,3房2廳2衛,2樓/4樓,無車位,3,7291JU,2025-10-06 02:00:37
將捷寰宇商業大樓,台北市中正區中華路二段,6.4年,辦公/透天,1925.14,829.38,74房13廳75衛,1-11樓/11樓,兩個以上車位,127,89341Z,2025-10-06 02:00:37
瑞光辦公店面一樓加Ｂ１,台北市內湖區瑞光路,24.0年,辦公,383.7,84.37,2廳,B1-1樓/7樓,兩個以上車位,22,2176BU,2025-10-06 02:00:37
