標題,地址,屋齡,類型,建坪,主+陽,格局,樓層,車位,總價(萬),編號,抓取時間
藍天白雲仰德景觀優質別墅,台北市士林區仰德大道二段,45.9年,別墅/透天,60.94,52.65,4房4廳5衛4室(含加蓋2房2廳2衛1室),1-2樓/2樓,其他,9,9913AM,2025-10-06 01:46:37
士林北投超值庭院透天,台北市北投區中和街,52.4年,透天,29.34,26.22,3房3廳1.5衛,1-2樓/2樓,無車位,2,5392XC,2025-10-06 01:46:37
好運開中山國中住辦車位中泰國際大樓,台北市中山區復興北路,44.8年,辦公/大樓,41.9,37.89,7房1廳1衛,10樓/12樓,無車位,4,3572TQ,2025-10-06 01:46:37
★河堤前後庭院車位一樓★,台北市文山區樟新街,34.5年,華廈,93.69,26.46,5房4廳4衛1室(含加蓋1室),B2-1樓/9樓,升降平面車位,3,7359DY,2025-10-06 01:46:37
站前城中商圈稀有透天１,台北市中正區武昌街一段,78.8年,透天/店面,43.77,43.77,6房3廳3衛1室(含加蓋4房1廳1.5衛1室),1-2樓/2樓,無車位,8,7276HL,2025-10-06 01:46:37
國揚林園名人巷金店國揚林園,台北市大安區大安路一段,48.7年,店面,48.65,37.73,1廳1衛2室,1樓/7樓,無車位,9,4530LR,2025-10-06 01:46:37
台電捷運正師大路面寬金店,台北市中正區師大路,48.6年,店面/辦公,74.61,19.21,3廳2衛1室(含加蓋1衛1室),B1-1樓/5樓,無車位,6,1357DT,2025-10-06 01:46:37
中崙商圈整棟透天,台北市中山區八德路二段,65.9年,店面/透天,71.21,66.14,5房3廳4衛,1-3樓/3樓,無車位,29,8590QW,2025-10-06 01:46:37
正臨江街觀光夜市店面,台北市大安區臨江街,67.8年,店面,15.9,12.14,1廳1衛,1樓/2樓,無車位,5,2824AP,2025-10-06 01:46:37
【新接】１０１大空間華廈,台北市信義區莊敬路,42.1年,華廈,36.51,34.55,5房3廳3衛2室(含加蓋2房1廳1衛2室),7樓/7樓,無車位,3,4684RK,2025-10-06 01:46:37
大直國家環境清幽大直國家,台北市內湖區內湖路一段,35.3年,公寓,65.86,21.67,3房2廳3衛,1樓/5樓,坡道平面車位,3,5848DZ,2025-10-06 01:46:37
幽雅路獨棟電梯,台北市北投區幽雅路,43.1年,透天,410.66,330.49,15房11廳13衛10室(含加蓋1房1衛4室),1-4樓/4樓,其他,30,0332JK,2025-10-06 01:46:37
七段豪宅區豪華一樓,台北市士林區中山北路七段,46.4年,公寓,38.5,32.35,1房2廳1衛2室(含加蓋1房2室),1樓/5樓,無車位,4,6668RH,2025-10-06 01:46:37
電梯四房☆美好相遇康橋花園,台北市北投區行義路,23.0年,大樓,53.57,34.4,4房2廳2衛,6樓/14樓,塔式車位,4,5787CF,2025-10-06 01:46:37
忠孝東路凌雲稀有住辦凌雲大廈,台北市大安區忠孝東路四段,53.0年,辦公/大樓,46.72,42.99,1廳2衛,6樓/12樓,無車位,7,4618UF,2025-10-06 01:46:37
大巨蛋華視人潮金店,台北市大安區光復南路,42.7年,店面,50.73,25,1房2廳2衛(含加蓋1衛),B1-1樓/7樓,無車位,6,5826WN,2025-10-06 01:46:37
光南金星近捷運邊間電梯金星大廈,台北市松山區光復南路,42.2年,華廈,33.5,32.06,3房2廳2衛,2樓/7樓,無車位,2,2491RM,2025-10-06 01:46:47
小巨蛋旁熱鬧黃金店面,台北市松山區南京東路四段,62.7年,店面,24.8,24.8,1廳1衛,1樓/4樓,無車位,6,3764CF,2025-10-06 01:46:47
原商二聖瑪莉同棟黑土,台北市大安區信義路二段,52.8年,華廈/辦公,35.89,35.89,5房4廳2衛1室(含加蓋2房2廳1衛1室),6樓/6樓,無車位,5,8975DS,2025-10-06 01:46:47
奇岩大戶別墅,台北市北投區奇岩路,54.1年,透天,70.78,70.78,5房2廳3.5衛(含加蓋1衛),1-2樓/2樓,坡道平面車位,5,6950VG,2025-10-06 01:46:47
新★重慶北孝親二代小透天,台北市士林區重慶北路四段,58.2年,透天,25.16,25.16,4房4廳2衛(含加蓋1廳2衛),1-2樓/2樓,無車位,2,3626UW,2025-10-06 01:46:47
馬可波羅公園樹海綠景戶馬可波羅,台北市信義區松德路,34.6年,大樓,90.58,54.98,4房2廳3衛1室,4樓/12樓,兩個以上車位,9,8251LW,2025-10-06 01:46:47
公館轉角遇到愛店面,台北市大安區新生南路三段,37.6年,店面,80.47,36.79,4廳1衛1室,B1-1樓/9樓,無車位,14,0985PG,2025-10-06 01:46:47
長安靜巷適三代同堂,台北市中山區長安東路一段,65.9年,透天,77.82,77.82,4房5廳3.5衛2室(含加蓋1廳1.5衛),1-4樓/4樓,無車位,7,7494UN,2025-10-06 01:46:47
稀有綠華濃三房帶車位綠華濃,台北市內湖區民權東路六段,20.3年,華廈,46.86,30.55,3房2廳2衛,5樓/10樓,塔式車位,4,4256JW,2025-10-06 01:46:47
空間佳－公設比不到十趴,台北市內湖區康寧路三段,35.0年,華廈,81.54,26.85,5房2廳4衛(含加蓋1房1衛),B1-1樓/7樓,兩個以上車位,4,59167F,2025-10-06 01:46:47
中正面寬美一樓,台北市中正區重慶南路三段,16.0年,華廈/辦公,10.11,7.19,1房1廳1衛,1樓/6樓,無車位,1,6324LG,2025-10-06 01:46:47
士林面寬邊間一樓,台北市士林區福港街,40.4年,公寓/店面,35.47,26.92,5房4廳1衛(含加蓋2房1廳1衛),1樓/5樓,無車位,3,2289JF,2025-10-06 01:46:47
台大龍門附小精美一樓,台北市大安區和平東路二段,48.1年,公寓/辦公,20.18,18.71,3房2廳4衛(含加蓋1房2衛),1樓/5樓,無車位,3,5468SP,2025-10-06 01:46:47
恆光街住辦合一宅,台北市文山區恆光街,35.6年,公寓/辦公,77.13,35.34,3房2廳3衛,B1-1樓/5樓,無車位,3,1257BK,2025-10-06 01:46:47
天母寬敞加蓋庭院豪邸,台北市士林區至誠路一段,16.9年,華廈,82.59,31.21,4房3廳5衛5室(含加蓋2房1廳2衛4室),1樓/6樓,兩個以上車位,6,9038SB,2025-10-06 01:46:47
大同學區一樓店辦,台北市中山區伊通街,42.3年,店面/辦公,40.44,30.89,2房2廳2衛1室(含加蓋1室),1樓/6樓,無車位,4,4736QG,2025-10-06 01:46:47
新案信義低總價公寓３樓,台北市信義區福德街,47.1年,公寓,23.01,23.01,3房2廳1衛,3樓/5樓,無車位,1,6796GK,2025-10-06 01:46:47
雙敦學區店辦,台北市松山區延吉街,42.8年,店面/辦公,55.25,26.22,3廳2衛2室(含加蓋2室),B1-1樓/7樓,無車位,4,0317BQ,2025-10-06 01:46:47
公館商區黃金店面,台北市大安區新生南路三段,37.6年,店面/辦公,142.4,86.05,7廳2衛1室,B1-2樓/9樓,無車位,19,1643AA,2025-10-06 01:46:47
天母星鑽天母星鑽,台北市士林區中山北路七段,32.9年,大樓,189.91,95.4,7房4廳4衛2室(含加蓋3房),13-15樓/19樓,兩個以上車位,11,33949J,2025-10-06 01:46:47
北市漂亮公寓４樓頂加,台北市萬華區興義街,56.2年,公寓,34.31,34.31,5房3廳2衛(含加蓋2房1廳1衛),4樓/4樓,無車位,1,26798P,2025-10-06 01:46:55
陽明山稀有山泉大別墅,台北市士林區至善路三段,34.4年,透天,130.91,86.9,6房3廳5衛3室(含加蓋1室),B1-2樓/2樓,無車位,5,3257GR,2025-10-06 01:46:55
近後山埤大空間,台北市南港區忠孝東路六段,45.7年,辦公,38.54,36.38,2廳1衛,2樓/4樓,無車位,2,4394FJ,2025-10-06 01:46:55
至誠黃金三角窗,台北市士林區至誠路二段,43.2年,公寓,58.32,26.02,1廳1衛,B1-1樓/5樓,無車位,7,5208HF,2025-10-06 01:46:55
好運開內湖邊間次高樓辦公大湖企業家,台北市內湖區民權東路六段,32.8年,辦公,42.57,32.5,1廳1衛6室,9樓/10樓,無車位,3,4536XC,2025-10-06 01:46:55
南港一樓未來可期,台北市南港區南港路三段,51.1年,廠房,28.93,24.8,2廳1衛3室(含加蓋1廳1室),1樓/4樓,無車位,3,5129JY,2025-10-06 01:46:55
松廈車位四十六號,台北市中山區一江街,19.6年,單售車位,5.08,0,,--,升降機械車位,160,5524FZ,2025-10-06 01:46:55
城市農夫開心農場,台北市士林區德行東路,,土地,228.64,,,,無車位,800,9705AJ,2025-10-06 01:46:55
富比仕小巧店面富比仕,台北市中正區懷寧街,23.2年,店面,11.95,4.52,1廳,1樓/14樓,無車位,2,25925W,2025-10-06 01:46:55
台北雙星潛力透天２０餘房,台北市大同區太原路,55.4年,辦公,304.87,254.74,23房7廳23衛4室(含加蓋2房2衛),B1-5樓/5樓,一樓平面車位,25,60638U,2025-10-06 01:46:55
東湖大空間美寓,台北市內湖區康樂街,38.5年,公寓,30.23,21.8,3房3廳2.5衛(含加蓋1房1廳1.5衛),5樓/5樓,無車位,1,22586M,2025-10-06 01:46:55
嚴選中正學區高樓獨棟住辦,台北市中正區南昌路二段,46.0年,辦公,57.87,56.2,2廳4衛4室(含加蓋1廳4衛4室),8樓/8樓,無車位,5,9454WH,2025-10-06 01:46:55
ＮＥＷ邊間三房美寓,台北市內湖區內湖路三段,47.1年,公寓,29.9,20.41,3房2廳1衛,1樓/4樓,無車位,2,7822WY,2025-10-06 01:46:55
收租聖品！雙連捷運金店面,台北市中山區中山北路二段,2.6年,店面,59.56,32.89,2廳2衛,1-2樓/13樓,塔式車位,8,5674RC,2025-10-06 01:46:55
★敦南吟龍★名邸附車位,台北市大安區敦化南路一段,41.0年,大樓,76.31,51.66,4房2廳2衛,8樓/14樓,坡道平面車位,8,3575NP,2025-10-06 01:46:55
古亭庭院公園一樓,台北市中正區廈門街,49.9年,公寓,34.07,25.17,2廳1.5衛1室(含加蓋1衛1室),1樓/4樓,無車位,3,1183ZR,2025-10-06 01:46:55
木柵世新清幽景觀庭院透天,台北市文山區木柵路一段,57.6年,別墅/透天,20.47,20.47,3房4廳2衛(含加蓋2廳1衛),1-1樓/1樓,無車位,2,2014PM,2025-10-06 01:46:55
稀有庭園美景＊天母別墅,台北市士林區東山路,54.0年,透天,79.64,79.64,5房2廳4衛1室,1-2樓/2樓,無車位,13,9069RB,2025-10-06 01:46:55
士林捷運幸福美透天,台北市士林區幸福街,60.9年,透天,21.01,21.01,2房2廳2衛1室(含加蓋1房),1-2樓/2樓,無車位,3,2218FG,2025-10-06 01:46:55
信義計畫挑高時代時代廣場,台北市信義區信義路五段,28.0年,大樓,36.1,21.56,3房1廳2衛1室(含加蓋2房1衛1室),7樓/12樓,坡道機械車位,3,5887HV,2025-10-06 01:46:55
上林苑總裁之星二代宅ＩＩ上林苑,台北市信義區青雲街,39.5年,透天,167.14,82.04,9房6廳5衛(含加蓋1房),B2-3樓/3樓,其他,16,3378FU,2025-10-06 01:47:03
鄉林典藏露台大戶鄉林左岸,台北市士林區延平北路六段,9.4年,大樓,63.63,33.06,4房2廳2衛,7樓/11樓,坡道平面車位,4,5335RC,2025-10-06 01:47:03
✿近光仁國小公寓一樓✿,台北市萬華區萬大路,57.2年,公寓/店面,18.91,17.45,2房3廳1衛(含加蓋1廳),1樓/4樓,無車位,2,5530RT,2025-10-06 01:47:03
內湖四期樓中樓雙車位宏盛香頌,台北市內湖區民權東路六段,23.5年,華廈,87.59,47.33,4房2廳2衛1室,2-4樓/4樓,兩個以上車位,5,6187WR,2025-10-06 01:47:03
八方來財˙天母金店面,台北市士林區中山北路七段,44.7年,店面,76.55,32.12,2廳1衛,B1-1樓/7樓,無車位,5,5696KL,2025-10-06 01:47:03
復興北路自由發揮雙語學校,台北市松山區復興北路,45.1年,公寓,34.29,34.3,4房2廳2.5衛,5樓/5樓,無車位,2,0737WU,2025-10-06 01:47:03
陽明山莊頂路花園別墅,台北市士林區莊頂路,54.9年,別墅/透天,94.05,94.05,4房4廳5衛4室(含加蓋1室),1-2樓/2樓,一樓平面車位,10,6938ZT,2025-10-06 01:47:03
迪化商圈民生西路文創透天,台北市大同區民生西路,13.6年,店面/透天,69.59,66.39,3廳2衛,1-3樓/3樓,無車位,8,7642YR,2025-10-06 01:47:03
哲學之道高樓景觀四房哲學之道,台北市北投區石牌路二段,21.2年,大樓,121.34,65.61,4房3廳3.5衛1室(含加蓋0.5衛1室),11樓/14樓,兩個以上車位,9,6011DS,2025-10-06 01:47:03
大直⭐忠泰⭐交響曲⭐珍藏忠泰交響曲,台北市中山區堤頂大道二段,17.8年,大樓,149.82,81.73,4房2廳4.5衛2室,2樓/13樓,兩個以上車位,22,7736UY,2025-10-06 01:47:03
上林苑總裁之星二代宅Ｉ上林苑,台北市信義區青雲街,39.5年,別墅/透天,351.06,186.66,9房10廳8衛3室,B2-3樓/3樓,兩個以上車位,35,6544KU,2025-10-06 01:47:03
小資首選再興１房１室,台北市文山區興隆路三段,31.2年,華廈,10.8,6.27,1房2廳1衛1室(含加蓋1廳1室),2樓/5樓,無車位,1,2724QT,2025-10-06 01:47:03
行天宮捷運公寓３房,台北市中山區錦州街,51.8年,公寓,33.3,33.3,3房2廳2衛,3樓/4樓,無車位,2,2525RZ,2025-10-06 01:47:03
忠孝新生難得美廈,台北市大安區新生南路一段,41.4年,華廈,47.8,34.45,4房2廳2衛(含加蓋1房),5樓/7樓,無車位,4,8843BN,2025-10-06 01:47:03
愛丁堡５米５邊間店辦,台北市內湖區洲子街,26.7年,辦公/店面,105.82,54.34,1廳,1樓/8樓,兩個以上車位,8,6468NB,2025-10-06 01:47:03
華山雙捷運兩層金店,台北市中正區忠孝東路二段,25.9年,店面/辦公,115.67,71.89,5廳2衛,1-2樓/13樓,無車位,29,30923W,2025-10-06 01:47:03
南港超值公寓空間大,台北市南港區研究院路三段,47.2年,公寓,24.71,24.72,4房3廳2衛(含加蓋2房1廳1衛),4樓/4樓,無車位,1,7083KK,2025-10-06 01:47:03
【杭南百坪豪邸】雙平車位,台北市中正區杭州南路一段,17.5年,華廈,117.28,75.33,6房2廳3衛1室,9-10樓/10樓,兩個以上車位,17,5918ZL,2025-10-06 01:47:03
正臨江夜市中心透天金店面,台北市大安區臨江街,63.1年,店面,63.53,63.53,2廳2衛3室(含加蓋1室),1-2樓/2樓,無車位,28,5842VU,2025-10-06 01:47:03
敦南華廈一樓住辦,台北市大安區基隆路三段,42.8年,店面,71.31,26.48,3房3廳3衛,B1-1樓/7樓,無車位,4,9360GR,2025-10-06 01:47:03
金華國中頂加好屋,台北市中正區臨沂街,52.9年,公寓,23.33,23.33,4房3廳2衛2室(含加蓋2房1廳1衛1室),4樓/4樓,無車位,3,4629RV,2025-10-06 01:47:12
敦化新城敦化國中學區敦化新城乙標,台北市松山區敦化北路,35.4年,華廈,33.53,27.95,3房2廳2衛,9樓/9樓,無車位,4,3670WR,2025-10-06 01:47:12
內湖科技挑高一樓店辦,台北市內湖區新湖三路,19.2年,店面/辦公,224.45,80.92,2廳(含加蓋1廳),1樓/7樓,兩個以上車位,16,4396MM,2025-10-06 01:47:12
德安御璽美妝德安御璽,台北市內湖區內湖路二段,23.6年,大樓,41.17,30.39,3房2廳2衛,4樓/14樓,無車位,4,2432QD,2025-10-06 01:47:12
鼎峰一樓店辦附雙車位,台北市南港區松河街,13.1年,辦公/店面,46.4,10.45,2房1廳2衛1室(含加蓋1房1衛),1樓/9樓,兩個以上車位,1,6800DL,2025-10-06 01:47:12
信義１０１景觀大空間美邸,台北市信義區紫雲街,45.4年,華廈,70.08,31.68,6房4廳4衛(含加蓋3房2廳2衛),1樓/6樓,無車位,3,3124HM,2025-10-06 01:47:12
松信路高樓層電梯兩大房永順大樓,台北市信義區松信路,43.8年,大樓,33.59,32.31,2房2廳2衛,12樓/12樓,無車位,2,3311ZP,2025-10-06 01:47:12
稀有景觀小歌林歌林大廈,台北市大安區復興南路一段,48.9年,大樓,16.41,14.78,1房2廳1衛1室,3樓/12樓,無車位,2,9950AC,2025-10-06 01:47:12
專任松山車站超值辦公大樓,台北市南港區八德路四段,35.3年,辦公/廠房/大樓,188.36,138.33,1廳,8樓/13樓,兩個以上車位,9,9782FH,2025-10-06 01:47:12
捷運挑高面寬金店,台北市文山區羅斯福路六段,10.4年,店面,92.43,36.6,1廳2衛,1樓/12樓,無車位,13,80380K,2025-10-06 01:47:12
陽明山獨棟景觀別墅,台北市士林區新安路,8.7年,別墅/透天,172.62,117.36,3房2廳4衛3室,B1-2樓/2樓,其他,9,86317T,2025-10-06 01:47:12
國際●饒河觀光夜市透天,台北市松山區饒河街,44.0年,店面/透天,135.66,119.35,7房6廳5衛1室(含加蓋1衛),B1-5樓/5樓,無車位,19,88252L,2025-10-06 01:47:12
三角窗捷運人潮商用店面,台北市信義區忠孝東路五段,40.6年,店面,119.63,20.44,1廳1衛1室,B1-1樓/7樓,無車位,16,39794Z,2025-10-06 01:47:12
長安東正馬路百坪餐飲店面,台北市中山區長安東路一段,43.1年,店面/辦公,112.87,71.54,1房4廳2衛1室,B1-2樓/7樓,無車位,9,49800U,2025-10-06 01:47:12
民生圓環低總價探吉金店辦新光大廈,台北市松山區民生東路五段,41.8年,店面/辦公/大樓,28.5,15.88,1廳1衛,1樓/16樓,無車位,1,93330P,2025-10-06 01:47:12
平地少有庭院毛胚別墅,台北市士林區士東路,7.8年,別墅/透天,215.11,163.04,7房2廳4衛,B1-3樓/3樓,無車位,22,84770W,2025-10-06 01:47:12
遠眺山景高樓兩房車位湖光CD,台北市內湖區文德路,19.5年,華廈,31.92,20.28,2房1廳1衛1室,9樓/10樓,坡道機械車位,2,4294CH,2025-10-06 01:47:12
膝蓋救星稀有一樓公寓,台北市北投區中和街,50.4年,公寓,27.29,24.18,3房2廳2衛,1樓/4樓,無車位,1,3031QW,2025-10-06 01:47:12
一層一戶電梯２房松江樂活,台北市中山區松江路,16.9年,華廈,40.73,14.4,3房2廳2衛(含加蓋1房1廳),5樓/7樓,升降平面車位,3,2500HY,2025-10-06 01:47:12
麗緻坡平車位麗緻一期,台北市中山區北安路,20.7年,單售車位,11.74,0,,--,坡道平面車位,188,2309WF,2025-10-06 01:47:12
東湖文武百業三角金店,台北市內湖區康樂街,40.5年,店面,28.03,25.24,4房3廳1衛(含加蓋3房1廳),1樓/5樓,無車位,4,8100AB,2025-10-06 01:47:20
信義帝圖樓中樓大戶,台北市信義區永吉路,24.9年,華廈,88.7,60.52,6房2廳5衛,5-6樓/6樓,坡道平面車位,7,6728VL,2025-10-06 01:47:20
內湖住辦１樓,台北市內湖區內湖路一段,44.5年,公寓,29.99,24.18,2房3廳2衛(含加蓋1廳1衛),1樓/5樓,無車位,3,7038KP,2025-10-06 01:47:20
瑞皇大樓,台北市中山區民生東路一段,47.3年,辦公/大樓,36.43,29.29,1廳1衛3室,5樓/12樓,無車位,2,1087TT,2025-10-06 01:47:20
八條通旺旺發財金１樓,台北市中山區林森北路,60.7年,公寓,22.41,22.41,1廳2衛2室,1樓/3樓,無車位,3,3191QH,2025-10-06 01:47:20
ＢＥＴＡ稀有辦公釋出,台北市內湖區瑞光路,27.1年,辦公,94.28,49.88,3廳,3樓/10樓,兩個以上車位,5,1344QS,2025-10-06 01:47:20
永春捷運松德金店面世貿國座,台北市信義區松德路,34.7年,店面,29.69,26.83,2廳1衛,1-2樓/12樓,無車位,4,8987MK,2025-10-06 01:47:20
近花博公園一樓首選,台北市大同區哈密街,54.8年,公寓,26.51,26.51,2房2廳2.5衛1室(含加蓋1.5衛1室),1樓/4樓,無車位,2,2098AQ,2025-10-06 01:47:20
德孚瑞光１３８坪邊間店面,台北市內湖區瑞光路,9.4年,店面/辦公/大樓,188.32,74.31,2廳7室,1樓/12樓,兩個以上車位,23,9113QK,2025-10-06 01:47:20
中正精選透天,台北市士林區中正路,58.9年,透天,53.13,53.13,4房2廳2衛1室(含加蓋1室),1-2樓/2樓,無車位,8,8207ZY,2025-10-06 01:47:20
三民國中靜巷美寓頂加,台北市內湖區民權東路六段,39.9年,公寓,32.28,28.67,7房4廳4衛1室(含加蓋3房2廳2衛),5樓/5樓,無車位,1,3743AU,2025-10-06 01:47:20
捷運景觀電梯頂加大戶,台北市大安區和平東路三段,42.8年,華廈,35.6,33.33,6房4廳3衛1室(含加蓋3房2廳1衛1室),7樓/7樓,無車位,3,4211XY,2025-10-06 01:47:20
恭賀新禧雙敦學區一樓華南花園別墅,台北市松山區延吉街,47.6年,華廈/店面,44.24,23.1,4房1廳3衛(含加蓋1房1衛),1樓/7樓,無車位,4,86263J,2025-10-06 01:47:20
行天宮捷運面寬１樓住辦,台北市中山區建國北路二段,41.4年,華廈/辦公,70.21,35.66,1房2廳1衛,B1-1樓/7樓,無車位,5,3633TB,2025-10-06 01:47:20
興隆山莊愜意生活美透天,台北市文山區興隆路四段,54.0年,透天,44.39,44.39,3房2廳3衛1室,1-2樓/2樓,無車位,4,4758ZZ,2025-10-06 01:47:20
第一道精巧兩房第一道,台北市南港區園區街,16.3年,大樓,29.75,15.9,2房2廳1衛,7樓/14樓,坡道機械車位,3,7293BL,2025-10-06 01:47:20
中正區大四房公寓,台北市中正區重慶南路三段,56.5年,公寓,38.46,37.28,4房2廳1衛1室,2樓/4樓,無車位,2,3238SK,2025-10-06 01:47:20
【專任】稀有大空間店辦,台北市信義區吳興街,35.5年,店面/辦公,78.77,38,3廳3衛(含加蓋2廳1衛),B1-1樓/5樓,無車位,3,23229H,2025-10-06 01:47:20
繁華中的寧靜❤️美屋,台北市大同區寧夏路,35.6年,公寓/辦公,22.69,19.37,2房2廳1衛,2樓/5樓,無車位,2,8240SQ,2025-10-06 01:47:20
復北百坪雙併純辦附車位,台北市中山區復興北路,42.6年,辦公/大樓,119.63,77.18,10房2廳,4樓/12樓,坡道平面車位,10,0375UV,2025-10-06 01:47:20
好物件好入手伊勢丹,台北市文山區景興路,16.0年,套房/大樓,14.2,8.52,1房1廳1衛,10樓/15樓,無車位,1,3504TU,2025-10-06 01:47:28
你要的附中邊間景觀時尚宅仁愛A+,台北市大安區大安路一段,17.0年,大樓,16.92,8.04,2房2廳1衛(含加蓋1房),12樓/12樓,無車位,2,3898AH,2025-10-06 01:47:28
榮星新城高樓綠意盎然榮星新城,台北市中山區民權東路三段,28.9年,大樓,52.19,34.59,3房2廳2衛1室,13樓/15樓,坡道平面車位,5,8571RN,2025-10-06 01:47:28
大安森林龍門高樓美妝豪邸台大龍門-藏閱,台北市大安區和平東路二段,2.6年,大樓,57.03,29.99,3房2廳2衛,10樓/11樓,坡道平面車位,9,6377GL,2025-10-06 01:47:28
【國泰榮星】精緻兩房華廈國泰榮星,台北市中山區復興北路,47.9年,華廈,44.24,35.47,3房2廳1衛1室,6樓/7樓,無車位,4,17671R,2025-10-06 01:47:28
【新接】崇德電梯Ａ,台北市信義區崇德街,36.9年,華廈,35.7,30.26,2房1廳2衛,7樓/7樓,無車位,2,19963A,2025-10-06 01:47:28
菁山～文化大學旁透天別墅,台北市士林區菁山路,30.4年,別墅/透天,128.54,51.01,5房2廳4衛2室,B2-3樓/3樓,其他,4,31995M,2025-10-06 01:47:28
近圓山低總價一樓稀有出售,台北市大同區敦煌路,42.3年,辦公/店面,24.79,14.17,1房2廳1衛,B1-1樓/7樓,無車位,1,49395Z,2025-10-06 01:47:28
松山監理站旁金店面１雙星儷廈,台北市松山區八德路四段,36.5年,店面,16.77,12.97,1廳1衛,1樓/12樓,無車位,2,75168M,2025-10-06 01:47:28
高土持迪化黃金透天,台北市大同區迪化街二段,94.7年,透天,26.33,26.33,1房3廳1衛(含加蓋1廳),1-1樓/1樓,無車位,6,7633GZ,2025-10-06 01:47:28
國安近青年公園稀有釋出,台北市萬華區西藏路,29.7年,華廈,34.99,21.83,3房2廳1.5衛,1樓/8樓,無車位,2,5086LK,2025-10-06 01:47:28
松江南京捷運面寬金店辦,台北市中山區松江路,46.2年,店面,77.05,29.76,4廳2衛2室,B1-1樓/6樓,無車位,6,0723FS,2025-10-06 01:47:28
推薦中山北路黃金獨棟,台北市中山區中山北路一段,61.2年,透天,62.94,59.02,4房4廳4衛(含加蓋2房1衛),1-3樓/3樓,無車位,8,3067KK,2025-10-06 01:47:28
『薇閣』白宮山莊獨棟別墅,台北市北投區復興三路,48.3年,透天,112.55,105.71,5房3廳4衛2室,1-2樓/2樓,其他,8,7967PN,2025-10-06 01:47:28
延吉三角窗金店,台北市大安區延吉街,44.7年,店面,41.35,13.61,2廳2衛1室(含加蓋1廳1衛1室),1樓/7樓,無車位,8,6084BW,2025-10-06 01:47:28
日光森居．高樓綠景宅昇陽大地,台北市內湖區金龍路,31.8年,大樓,40.67,25.9,2房2廳1衛1室,12樓/12樓,坡道平面車位,2,1543JQ,2025-10-06 01:47:28
樂群新城邊間稀有採光三房樂群新城,台北市萬華區中華路二段,12.3年,大樓,48.36,29.95,3房2廳2衛,8樓/14樓,坡道平面車位,4,9409CS,2025-10-06 01:47:28
遠企之戀挑高後棟寂靜美屋遠企之戀,台北市大安區和平東路三段,21.5年,大樓,8.88,5.79,1房1廳1衛(含加蓋1房),7樓/12樓,無車位,1,9436NL,2025-10-06 01:47:28
公館台電汀州三總金店舖,台北市中正區汀州路三段,51.4年,店面,33.51,22.33,1廳1衛1室(含加蓋1衛1室),1樓/4樓,無車位,8,1557JT,2025-10-06 01:47:28
內湖捷運。財源旺旺宅,台北市內湖區內湖路三段,42.0年,公寓,27.26,24.14,4房4衛,4樓/5樓,無車位,1,0139HM,2025-10-06 01:47:28
麟光捷運空間１樓住辦,台北市信義區和平東路三段,47.0年,公寓/辦公,27.25,23.66,3房3廳3衛(含加蓋1廳),1樓/5樓,無車位,2,6923VP,2025-10-06 01:47:37
陽明山首選～大衛營美屋,台北市士林區格致路,30.3年,華廈,57.1,20.21,3房2廳2衛(含加蓋1房1衛),5樓/5樓,坡道平面車位,1,0953TH,2025-10-06 01:47:37
大安路面寬黃金店面,台北市大安區大安路一段,49.1年,店面/華廈,37.97,31.61,2廳2衛2室(含加蓋1廳2衛2室),1樓/7樓,無車位,9,6322FQ,2025-10-06 01:47:37
南京歌林超群帝王向住辦歌林超群大廈,台北市松山區南京東路五段,45.7年,大樓/辦公,40.71,37.02,3房2廳2衛,2樓/13樓,無車位,3,9228NQ,2025-10-06 01:47:37
花園電梯景觀別墅,台北市士林區中庸五路,10.5年,別墅/透天,145.25,109.81,3廳4衛,B1-2樓/2樓,一樓平面車位,16,38799S,2025-10-06 01:47:37
古亭多功能１＋２辦公臻第大樓,台北市中正區重慶南路三段,16.9年,店面/辦公,43.64,27.22,1房2廳2衛,1-2樓/12樓,無車位,5,2792TM,2025-10-06 01:47:37
復興市民黃金店面,台北市大安區市民大道三段,49.1年,店面,32.49,24.51,1廳1衛3室(含加蓋1衛2室),1樓/4樓,無車位,8,6538KF,2025-10-06 01:47:37
傳家成家金雞母,台北市萬華區桂林路,28.2年,店面/大樓,53.75,26.34,4房4廳4衛1室(含加蓋4房1廳3衛1室),1樓/11樓,升降平面車位,4,8290US,2025-10-06 01:47:37
瑞璟木新商圈低總價店面,台北市文山區興隆路四段,11.9年,店面,14.05,2.14,2廳1衛(含加蓋1廳),1樓/7樓,無車位,2,3341JR,2025-10-06 01:47:37
南京巨蛋△角窗邊間店面,台北市松山區寧安街,49.6年,店面,41.55,37.66,4廳4衛,1樓/4樓,無車位,7,2423ST,2025-10-06 01:47:37
南港低總邊間三樓美寓,台北市南港區福德街,47.2年,公寓,14.82,14.82,1房1廳1衛,3樓/4樓,無車位,1,8614WJ,2025-10-06 01:47:37
未來萬大新妝透天,台北市萬華區萬大路,63.3年,透天,28.63,28.63,3房2廳4衛(含加蓋1房),1-2樓/2樓,無車位,3,8352KX,2025-10-06 01:47:37
國泰方正珍稀透天,台北市北投區中和街,52.1年,透天,27.23,27.23,4房3廳2衛1室(含加蓋1房1廳),1-2樓/2樓,無車位,2,5986VS,2025-10-06 01:47:37
吉祥如意土坪大公告現值高,台北市中山區新生北路二段,64.9年,公寓,24.68,22.44,4房3廳3衛(含加蓋1房1廳1衛),2樓/2樓,無車位,2,0633JP,2025-10-06 01:47:37
新婚首選樹海管理美邸師大名園大廈,台北市大安區和平東路一段,37.0年,大樓/套房,16.51,12.5,1房1廳1衛,4樓/12樓,無車位,2,3388MC,2025-10-06 01:47:37
近辛亥捷運站透天庭院戶,台北市文山區辛亥路四段,52.1年,透天,24.42,24.42,5房3廳2衛(含加蓋2房1廳1衛),1-2樓/2樓,無車位,2,8133HJ,2025-10-06 01:47:37
安和新力精品大四房新力大廈,台北市大安區安和路一段,48.7年,大樓,46.83,41.14,4房2廳2衛,3樓/12樓,無車位,5,2656FB,2025-10-06 01:47:37
